id	text	category	newtext	label
ta_sent_2404	Thala marana look yuvan BGM ultimate	Positive	thala marana {Positive} marana look {XXX} look yuvan {XXX} yuvan bgm {Positive} 	1
ta_sent_2405	Sarkar Teaser likes ah beat pana mudilayeda... Ama payale🤣🤣🤣🤣  Iththu ponavane	Positive	sarkar teaser {Positive} teaser likes {Positive} likes ah {Positive} ah beat {Positive} beat pana {XXX} pana mudilayeda {XXX} mudilayeda ama {XXX} ama payale {XXX} payale iththu {XXX} 	1
ta_sent_2406	I love u THALIVA..... From kerala.. Waiting for marana MaSs pEtta....	Positive	i love {Positive} love u {Positive} u thaliva {XXX} thaliva from {XXX} from kerala {Positive} kerala waiting {XXX} waiting for {Positive} for marana {Positive} marana mass {Positive} 	1
ta_sent_2407	Oruthangaluku viswasam katrathukaga en enoruthara asinga  paduthureeenga... Thala vera level mass	Positive	oruthangaluku viswasam {XXX} viswasam katrathukaga {Positive} katrathukaga en {XXX} en enoruthara {XXX} enoruthara asinga {XXX} asinga paduthureeenga {XXX} paduthureeenga thala {XXX} thala vera {Positive} vera level {Positive} 	1
ta_sent_2408	Thalafans make it fast likes 24hrs la 1.1m varanum...	Positive	thalafans make {XXX} make it {Positive} it fast {XXX} fast likes {XXX} likes hrs {XXX} hrs la {Positive} la m {XXX} 	1
ta_sent_2409	Padippa mattum namma kitta irunthu eduthukitave mudiyathu...... super thalaiva semma dialogue	Positive	padippa mattum {Positive} mattum namma {Positive} namma kitta {Positive} kitta irunthu {Positive} irunthu eduthukitave {XXX} eduthukitave mudiyathu {XXX} mudiyathu super {XXX} super thalaiva {Positive} thalaiva semma {Positive} 	1
ta_sent_2410	RAJINI NA Endrum super star ni kalaku thalavaaaa	Positive	rajini na {Positive} na endrum {XXX} endrum super {Positive} super star {Positive} star ni {XXX} ni kalaku {XXX} 	1
ta_sent_2411	Thalayoda ner konda paarvai semma masss	Positive	thalayoda ner {XXX} ner konda {Positive} konda paarvai {Positive} paarvai semma {Positive} 	1
ta_sent_2412	Thalaivaruda rajini   aj avadu vj  avadu	Positive	thalaivaruda rajini {XXX} rajini aj {XXX} aj avadu {XXX} avadu vj {XXX} 	1
ta_sent_2413	ennanga da irumbuthirai part 2 va	Positive	ennanga da {Positive} da irumbuthirai {XXX} irumbuthirai part {XXX} 	1
ta_sent_2414	thala innum ipdi full white evvalavu naal nadippenga ,kaduppa irukku thala	Positive	thala innum {Positive} innum ipdi {XXX} ipdi full {XXX} full white {XXX} white evvalavu {XXX} evvalavu naal {XXX} naal nadippenga {XXX} nadippenga kaduppa {XXX} kaduppa irukku {Mixed_feelings} 	1
ta_sent_2415	Petta no. 1 trending in Singapore, but Viswasam no. 2 trending in Singapore.	Positive	petta no {XXX} no trending {Mixed_feelings} trending in {Positive} in singapore {Positive} singapore but {XXX} but viswasam {Mixed_feelings} viswasam no {Mixed_feelings} no trending {Mixed_feelings} trending in {Positive} 	1
ta_sent_2416	Thala na Thala dhan, vera level ultimatu	Positive	thala na {Positive} na thala {Positive} thala dhan {Positive} dhan vera {Mixed_feelings} vera level {Positive} 	1
ta_sent_2417	Thalaivar verithanam... Look like 90s rajini	Positive	thalaivar verithanam {XXX} verithanam look {XXX} look like {Positive} like s {Positive} 	1
ta_sent_2418	Vikram looks just like he was in iru mugan. Looks cool !	Positive	vikram looks {Positive} looks just {Negative} just like {Negative} like he {Positive} he was {XXX} was in {Mixed_feelings} in iru {XXX} iru mugan {Positive} mugan looks {XXX} 	1
ta_sent_2419	Watched 20 times..Thalaivar marana mass..petta parak..	Positive	watched timesthalaivar {XXX} timesthalaivar marana {XXX} marana masspetta {XXX} 	1
ta_sent_2420	Daiii nenga oam pasava kudhadhu da	Positive	daiii nenga {XXX} nenga oam {XXX} oam pasava {XXX} pasava kudhadhu {XXX} 	1
ta_sent_2421	Padam vera leval la varum nu solravanga mattum like podunga	Positive	padam vera {Positive} vera leval {Positive} leval la {Mixed_feelings} la varum {Positive} varum nu {Positive} nu solravanga {Positive} solravanga mattum {Positive} mattum like {Positive} 	1
ta_sent_2422	Amy jackson ah vachu epdi u certificate film eduthanga. Chinna pasangala keduka trick ah	Positive	amy jackson {Positive} jackson ah {XXX} ah vachu {XXX} vachu epdi {XXX} epdi u {XXX} u certificate {Mixed_feelings} certificate film {XXX} film eduthanga {XXX} eduthanga chinna {XXX} chinna pasangala {XXX} pasangala keduka {XXX} keduka trick {XXX} 	1
ta_sent_2423	I am thalapathi veriyan but Thala trailar  super	Positive	i am {Positive} am thalapathi {Positive} thalapathi veriyan {XXX} veriyan but {unknown_state} but thala {Positive} thala trailar {XXX} 	1
ta_sent_2424	Vadachannai 2 ku whait panravaga la oru like thatti uttu ponga	Positive	vadachannai ku {XXX} ku whait {XXX} whait panravaga {XXX} panravaga la {XXX} la oru {Positive} oru like {Positive} like thatti {Positive} thatti uttu {XXX} 	1
ta_sent_2425	Need 29k to make it 800k likes ....	Positive	need k {XXX} k to {XXX} to make {XXX} make it {Positive} it k {XXX} 	1
ta_sent_2426	Thala	Positive		1
ta_sent_2427	Suyama Sindhikka Therinjavandhaan  Super Hero	Positive	suyama sindhikka {Positive} sindhikka therinjavandhaan {XXX} therinjavandhaan super {XXX} 	1
ta_sent_2428	No 1 trending in malaysia	Positive	no trending {Mixed_feelings} trending in {Positive} 	1
ta_sent_2429	Ththaaa ithu than da Rajini Padam  Marana waiting	Positive	ththaaa ithu {XXX} ithu than {Positive} than da {Positive} da rajini {Positive} rajini padam {Positive} padam marana {Positive} 	1
ta_sent_2430	1 Number  SuperStar Rajinikant Sir Shankar Sir	Positive	number superstar {XXX} superstar rajinikant {Mixed_feelings} rajinikant sir {Negative} sir shankar {XXX} 	1
ta_sent_2431	Vera level trailer padam masssa irukum confirm	Positive	vera level {Positive} level trailer {Positive} trailer padam {Positive} padam masssa {XXX} masssa irukum {XXX} 	1
ta_sent_2432	Ratho dha sauce Mari irukku mathapadi trailer Vera lvl	Positive	ratho dha {XXX} dha sauce {XXX} sauce mari {XXX} mari irukku {Negative} irukku mathapadi {XXX} mathapadi trailer {XXX} trailer vera {Positive} 	1
ta_sent_2433	Thala is always king in tamilnadu Pawan star always king tollywood	Positive	thala is {Positive} is always {Positive} always king {Positive} king in {Positive} in tamilnadu {Positive} tamilnadu pawan {XXX} pawan star {XXX} star always {Positive} always king {Positive} 	1
ta_sent_2434	Oruthar Mela viswasam kaatrathukaha innorthara yen asinga paduthiringa semmmaaaaa dialogue	Positive	oruthar mela {Positive} mela viswasam {Positive} viswasam kaatrathukaha {XXX} kaatrathukaha innorthara {XXX} innorthara yen {Positive} yen asinga {Positive} asinga paduthiringa {Positive} paduthiringa semmmaaaaa {XXX} 	1
ta_sent_2435	Kerala Sivakarthi Fans hit like here	Positive	kerala sivakarthi {XXX} sivakarthi fans {XXX} fans hit {Positive} hit like {Positive} 	1
ta_sent_2436	funny.... More copy cats	Positive	funny more {XXX} more copy {XXX} 	1
ta_sent_2437	Inniki yarukellam sivarathiri thala dharisanam sollunga	Positive	inniki yarukellam {XXX} yarukellam sivarathiri {XXX} sivarathiri thala {XXX} thala dharisanam {Positive} 	1
ta_sent_2438	Diwali release na semmaya irukkum..	Positive	diwali release {Positive} release na {XXX} na semmaya {XXX} 	1
ta_sent_2439	Semma semma semma waiting all Kerala sk fans	Positive	semma semma {Positive} semma semma {Positive} semma waiting {Positive} waiting all {XXX} all kerala {Positive} kerala sk {XXX} 	1
ta_sent_2440	I love you lokesh kanagaraj and karthi	Positive	i love {Positive} love you {Positive} you lokesh {XXX} lokesh kanagaraj {Positive} kanagaraj and {unknown_state} 	1
ta_sent_2441	Padam blockbuster aga poguthu massa iruku	Positive	padam blockbuster {Positive} blockbuster aga {Negative} aga poguthu {unknown_state} poguthu massa {XXX} 	1
ta_sent_2442	Semma sankar sir I love rajini	Positive	semma sankar {XXX} sankar sir {Positive} sir i {Positive} i love {Positive} 	1
ta_sent_2443	Valimai teaser 3M likes +60M views varumnu solravunga thatra like a	Positive	valimai teaser {Positive} teaser m {XXX} m likes {Positive} likes m {XXX} m views {Positive} views varumnu {XXX} varumnu solravunga {XXX} solravunga thatra {XXX} thatra like {unknown_state} 	1
ta_sent_2444	Ithu tha unmaiyana trailer aa romba sekirama vandhuchu	Positive	ithu tha {XXX} tha unmaiyana {XXX} unmaiyana trailer {XXX} trailer aa {Positive} aa romba {XXX} romba sekirama {XXX} 	1
ta_sent_2445	Nalikku kulla 7M views 1M likes 50K comments varumnu namburen🤩	Positive	nalikku kulla {XXX} kulla m {XXX} m views {Positive} views m {XXX} m likes {Positive} likes k {XXX} k comments {Positive} comments varumnu {XXX} 	1
ta_sent_2446	Real time views 24hrs la 11m petta pongal	Positive	real time {Positive} time views {XXX} views hrs {XXX} hrs la {Positive} la m {XXX} m petta {XXX} 	1
ta_sent_2447	I am chiti version 2.0 masss	Positive	i am {Positive} am chiti {XXX} chiti version {XXX} 	1
ta_sent_2448	Honestly saying yuvan bgm vera level	Positive	honestly saying {XXX} saying yuvan {XXX} yuvan bgm {Positive} bgm vera {Positive} 	1
ta_sent_2449	Karthi Fans Hit Like	Positive	karthi fans {unknown_state} fans hit {Positive} 	1
ta_sent_2450	Thala da mass Karnataka Ajit fans kannadiga !	Positive	thala da {Positive} da mass {Positive} mass karnataka {XXX} karnataka ajit {XXX} ajit fans {Positive} 	1
ta_sent_2451	Pakkum pothula thalivan Tony Stark niyabagam varuthu...   Athukkagave Dislike... Dislike... Dislike..	Positive	pakkum pothula {XXX} pothula thalivan {XXX} thalivan tony {XXX} tony stark {XXX} stark niyabagam {XXX} niyabagam varuthu {Positive} varuthu athukkagave {XXX} athukkagave dislike {XXX} dislike dislike {XXX} 	1
ta_sent_2452	Ajithku aprm support pannalam	Positive	ajithku aprm {XXX} aprm support {XXX} 	1
ta_sent_2453	dhanush veriyan da ! ! !	Positive	dhanush veriyan {Mixed_feelings} 	1
ta_sent_2454	GOOD FILM. GOOD BGM. BEST ACTING THALA AJITH.	Positive	good film {Positive} film good {XXX} good bgm {XXX} bgm best {XXX} best acting {XXX} acting thala {Positive} 	1
ta_sent_2455	Mokka sollravan laam poi thooku matti sethuru	Positive	mokka sollravan {XXX} sollravan laam {XXX} laam poi {XXX} poi thooku {Positive} thooku matti {Positive} 	1
ta_sent_2456	A girl says No it means no.....	Positive	a girl {XXX} girl says {XXX} says no {XXX} no it {XXX} it means {XXX} 	1
ta_sent_2457	Nadigara yavalo venumnalum rasikalam thalaivana illa. Makkal itha purinjikanum. All the best	Positive	nadigara yavalo {XXX} yavalo venumnalum {XXX} venumnalum rasikalam {XXX} rasikalam thalaivana {XXX} thalaivana illa {XXX} illa makkal {XXX} makkal itha {XXX} itha purinjikanum {XXX} purinjikanum all {XXX} all the {Positive} 	1
ta_sent_2458	50k views nd over 90k likes...?🤔🤔🤔	Positive	k views {Mixed_feelings} views nd {XXX} nd over {XXX} over k {XXX} 	1
ta_sent_2459	He is going to earn in 2019 national award pakka . And katta waiting	Positive	he is {Positive} is going {Positive} going to {Positive} to earn {XXX} earn in {XXX} in national {XXX} national award {Positive} award pakka {XXX} pakka and {XXX} and katta {XXX} 	1
ta_sent_2460	BGM is awesome awesome awesome	Positive	bgm is {Positive} is awesome {Positive} awesome awesome {Positive} 	1
ta_sent_2461	Paaa verithanama irukku kandippa  Hit aagum	Positive	paaa verithanama {XXX} verithanama irukku {Positive} irukku kandippa {Positive} kandippa hit {Positive} 	1
ta_sent_2462	Yan kadavula I love you thala	Positive	yan kadavula {XXX} kadavula i {XXX} i love {Positive} love you {Positive} 	1
ta_sent_2463	Plz hindi me v dubbed kijiye ....  For We all hindi fan .plzzzzzzzzzz	Positive	plz hindi {XXX} hindi me {not-Tamil} me v {XXX} v dubbed {XXX} dubbed kijiye {XXX} kijiye for {XXX} for we {XXX} we all {Positive} all hindi {XXX} hindi fan {Positive} 	1
ta_sent_2464	Paaa vera level mass thala vera level la irukare paa I'm weiting 🤭🤭	Positive	paaa vera {XXX} vera level {Positive} level mass {Positive} mass thala {Positive} thala vera {Positive} vera level {Positive} level la {Positive} la irukare {XXX} irukare paa {XXX} paa im {XXX} 	1
ta_sent_2465	Ini eavanavathu ithu eannoda katha sir sonninka mavanukazha avazhan	Positive	ini eavanavathu {XXX} eavanavathu ithu {XXX} ithu eannoda {XXX} eannoda katha {XXX} katha sir {XXX} sir sonninka {XXX} sonninka mavanukazha {XXX} 	1
ta_sent_2466	Dhanush - Vettri Maran sollava venum mass Tha	Positive	dhanush vettri {Positive} vettri maran {Positive} maran sollava {XXX} sollava venum {Positive} venum mass {XXX} 	1
ta_sent_2467	Padam disaster by Thala fan 🤧	Positive	padam disaster {XXX} disaster by {XXX} by thala {Positive} 	1
ta_sent_2468	Thala  naa Getthu Getthu naa Thala	Positive	thala naa {Positive} naa getthu {XXX} getthu getthu {XXX} getthu naa {XXX} 	1
ta_sent_2469	3M Views with 555k likes 🤘	Positive	m views {Positive} views with {Positive} with k {XXX} 	1
ta_sent_2470	Yenda paradesigala idhu oru trailer nu ellorum release pannirukengle,kayila matuna avlodhan,edho discovery channel partha madri irukudhu	Positive	yenda paradesigala {XXX} paradesigala idhu {XXX} idhu oru {Positive} oru trailer {Negative} trailer nu {XXX} nu ellorum {XXX} ellorum release {XXX} release pannirukenglekayila {XXX} pannirukenglekayila matuna {XXX} matuna avlodhanedho {XXX} avlodhanedho discovery {XXX} discovery channel {XXX} channel partha {XXX} partha madri {XXX} 	1
ta_sent_2471	Vijay Anna fans hit like here	Positive	vijay anna {Positive} anna fans {Positive} fans hit {Positive} hit like {Positive} 	1
ta_sent_2472	Arey Lucifer kaise dekhu??? Mil hi nhi rha hai	Positive	arey lucifer {XXX} lucifer kaise {XXX} kaise dekhu {XXX} dekhu mil {XXX} mil hi {XXX} hi nhi {not-Tamil} nhi rha {XXX} 	1
ta_sent_2473	Ennna koduma sir ithu views and likes 🤣🤣🤣🤣🤣🤣🤣🤣🤣🤣🤣🤣bigil poi paarunga likes and comment vera level poiturukku	Positive	ennna koduma {XXX} koduma sir {Mixed_feelings} sir ithu {XXX} ithu views {Positive} views and {Positive} and likes {Positive} likes bigil {XXX} bigil poi {XXX} poi paarunga {XXX} paarunga likes {XXX} likes and {Positive} and comment {Positive} comment vera {XXX} vera level {Positive} 	1
ta_sent_2474	Thalaya  pidichavanga like podunga ....	Positive	thalaya pidichavanga {XXX} pidichavanga like {Positive} 	1
ta_sent_2475	Rangaraj pandey sir fans like here	Positive	rangaraj pandey {Positive} pandey sir {Positive} sir fans {Positive} fans like {Positive} 	1
ta_sent_2476	Ahaaaaaa....thala ya  ..ipdi 1u character la pathadhe ilaye bayangaram ah irukare	Positive	ahaaaaaathala ya {XXX} ya ipdi {XXX} ipdi u {XXX} u character {XXX} character la {Positive} la pathadhe {XXX} pathadhe ilaye {XXX} ilaye bayangaram {XXX} bayangaram ah {XXX} 	1
ta_sent_2477	Heat like for Akshay and Rajnikant	Positive	heat like {XXX} like for {Positive} for akshay {Positive} akshay and {XXX} 	1
ta_sent_2478	Whatopened Innum 1m like varala innum therika vidunga Thala bloods	Positive	whatopened innum {XXX} innum m {XXX} m like {Positive} like varala {Positive} varala innum {XXX} innum therika {XXX} therika vidunga {Positive} vidunga thala {Positive} 	1
ta_sent_2479	MARANA mass aa irukid talaivar oda  style PETTA pongal than inda vasa  PETTA parak	Positive	marana mass {Positive} mass aa {Positive} aa irukid {XXX} irukid talaivar {XXX} talaivar oda {XXX} oda style {Positive} style petta {Positive} petta pongal {Positive} pongal than {XXX} than inda {XXX} inda vasa {XXX} vasa petta {XXX} 	1
ta_sent_2480	Last dialog vera vera level thala	Positive	last dialog {Positive} dialog vera {XXX} vera vera {Positive} vera level {Positive} 	1
ta_sent_2481	2019 deepavaliku #thala fans ku #thaladeepavali #kaithi than	Positive	deepavaliku thala {XXX} thala fans {Positive} fans ku {Positive} ku thaladeepavali {XXX} thaladeepavali kaithi {XXX} 	1
ta_sent_2482	Oru superstar ippadi oru nalla padam nadichi ippo dhaan paakuraen	Positive	oru superstar {XXX} superstar ippadi {XXX} ippadi oru {Positive} oru nalla {Positive} nalla padam {Positive} padam nadichi {XXX} nadichi ippo {XXX} ippo dhaan {Positive} 	1
ta_sent_2483	***Thaa  Tamil cinima Vera levela pudikka poguhtu	Positive	thaa tamil {XXX} tamil cinima {Positive} cinima vera {XXX} vera levela {Positive} levela pudikka {XXX} 	1
ta_sent_2484	1 M like varathukku help pannunga	Positive	m like {Positive} like varathukku {XXX} varathukku help {Positive} 	1
ta_sent_2485	vijay sethupathi.. andhra fans hit like	Positive	vijay sethupathi {Positive} sethupathi andhra {XXX} andhra fans {XXX} fans hit {Positive} 	1
ta_sent_2486	ajithkumar ippathan visuvasam padathappa un rasigargal romba kevalama nadanthukittanga puriyutha control pannunga illana ungamela ulla maryathai poidum pls ajithkumar	Positive	ajithkumar ippathan {XXX} ippathan visuvasam {XXX} visuvasam padathappa {XXX} padathappa un {XXX} un rasigargal {XXX} rasigargal romba {XXX} romba kevalama {XXX} kevalama nadanthukittanga {XXX} nadanthukittanga puriyutha {XXX} puriyutha control {XXX} control pannunga {Positive} pannunga illana {XXX} illana ungamela {XXX} ungamela ulla {XXX} ulla maryathai {XXX} maryathai poidum {XXX} poidum pls {XXX} 	1
ta_sent_2487	Voice quality konjam increase panni irukkalam..	Positive	voice quality {XXX} quality konjam {XXX} konjam increase {XXX} increase panni {XXX} 	1
ta_sent_2488	Dei idhula teejay ku ennada wela	Positive	dei idhula {XXX} idhula teejay {XXX} teejay ku {Positive} ku ennada {XXX} 	1
ta_sent_2489	Statue odaikalam but b.r. kolkai alika mudiyathu	Positive	statue odaikalam {XXX} odaikalam but {XXX} but br {XXX} br kolkai {XXX} kolkai alika {XXX} 	1
ta_sent_2490	Already 24 vanthapo yarum support panala nama makal nala try ku support pana matangale	Positive	already vanthapo {XXX} vanthapo yarum {XXX} yarum support {XXX} support panala {XXX} panala nama {XXX} nama makal {XXX} makal nala {XXX} nala try {XXX} try ku {XXX} ku support {Positive} support pana {Positive} 	1
ta_sent_2491	Vada chennai - Like     Asuran              -Comment	Positive	vada chennai {Negative} chennai like {XXX} like asuran {Positive} 	1
ta_sent_2492	Rajni kanth and Vijay sethupahi Maas.	Positive	rajni kanth {Positive} kanth and {XXX} and vijay {Positive} vijay sethupahi {unknown_state} 	1
ta_sent_2493	Paaaaah excepting more thala acting pichutenga ......padam tharu Maru...pink ah minjurum polaeya..... love you thank...by thalapathy fan	Positive	paaaaah excepting {XXX} excepting more {XXX} more thala {XXX} thala acting {Positive} acting pichutenga {XXX} pichutenga padam {XXX} padam tharu {Positive} tharu marupink {XXX} marupink ah {XXX} ah minjurum {XXX} minjurum polaeya {XXX} polaeya love {XXX} love you {Positive} you thankby {XXX} thankby thalapathy {XXX} 	1
ta_sent_2494	Oru appanuku poranthavan evan patathai pokkamatan	Positive	oru appanuku {XXX} appanuku poranthavan {XXX} poranthavan evan {XXX} evan patathai {XXX} 	1
ta_sent_2495	Bhai jaldi upload karo Hindi mai movies please bhai	Positive	bhai jaldi {XXX} jaldi upload {XXX} upload karo {unknown_state} karo hindi {XXX} hindi mai {not-Tamil} mai movies {XXX} movies please {XXX} 	1
ta_sent_2496	othinkirunka Da amais ilana adichu underwearoda oda vitruvom.... petta parak....	Positive	othinkirunka da {XXX} da amais {Mixed_feelings} amais ilana {XXX} ilana adichu {XXX} adichu underwearoda {Positive} underwearoda oda {Positive} oda vitruvom {XXX} vitruvom petta {XXX} 	1
ta_sent_2497	In the Talab polygon Dabang Nagar Pune	Positive	in the {Positive} the talab {XXX} talab polygon {XXX} polygon dabang {XXX} dabang nagar {XXX} 	1
ta_sent_2498	Enna innum trend list la varla	Positive	enna innum {Mixed_feelings} innum trend {XXX} trend list {XXX} list la {Positive} 	1
ta_sent_2499	Namba anna #sk annanoda anudha blockbuster varapugudhu	Positive	namba anna {XXX} anna sk {Positive} sk annanoda {XXX} annanoda anudha {XXX} anudha blockbuster {XXX} 	1
ta_sent_2500	Asuran joins 100 cr club	Positive	asuran joins {XXX} joins cr {XXX} 	1
ta_sent_2501	Thalaivar Vera level mass maranaa mass	Positive	thalaivar vera {Positive} vera level {Positive} level mass {Positive} mass maranaa {Positive} 	1
ta_sent_2502	Keel jaadhi mel jaadhi fight asusual	Positive	keel jaadhi {XXX} jaadhi mel {XXX} mel jaadhi {XXX} jaadhi fight {XXX} 	1
ta_sent_2503	Adchi Oda vidu ellarayum orama nadandhu varareda enga thala veerama  thala bloods hit like her	Positive	adchi oda {Positive} oda vidu {Positive} vidu ellarayum {Positive} ellarayum orama {Positive} orama nadandhu {Positive} nadandhu varareda {Positive} varareda enga {Positive} enga thala {Positive} thala veerama {Positive} veerama thala {Positive} thala bloods {Positive} bloods hit {Positive} hit like {Positive} 	1
ta_sent_2504	Super movie i love you karthi	Positive	super movie {Positive} movie i {Positive} i love {Positive} love you {Positive} 	1
ta_sent_2505	ithu tamil nadu ella ithu enga thala nadu	Positive	ithu tamil {Positive} tamil nadu {Positive} nadu ella {Positive} ella ithu {Positive} ithu enga {Positive} enga thala {Positive} 	1
ta_sent_2506	Caste base panni movie illana nalla irukkum	Positive	caste base {XXX} base panni {Negative} panni movie {XXX} movie illana {XXX} illana nalla {XXX} 	1
ta_sent_2507	Marana maasssss thala love  you #srilankan thala fansss	Positive	marana maasssss {XXX} maasssss thala {XXX} thala love {Positive} love you {Positive} you srilankan {XXX} srilankan thala {XXX} 	1
ta_sent_2508	Gv music sema valthukkal enrum thalapathy rasigan samayan maduraikaran	Positive	gv music {Positive} music sema {Positive} sema valthukkal {XXX} valthukkal enrum {Positive} enrum thalapathy {Positive} thalapathy rasigan {Positive} rasigan samayan {Mixed_feelings} 	1
ta_sent_2509	Thala Thala Thala Thala Thala Thala Thala Thala Thala Thala Thala Thala	Positive	thala thala {Positive} thala thala {Positive} thala thala {Positive} thala thala {Positive} thala thala {Positive} thala thala {Positive} thala thala {Positive} thala thala {Positive} thala thala {Positive} thala thala {Positive} 	1
ta_sent_2510	Tamil cinema ku international market ah aarambichathey enga thalaivar  da	Positive	tamil cinema {Positive} cinema ku {Positive} ku international {XXX} international market {XXX} market ah {XXX} ah aarambichathey {XXX} aarambichathey enga {XXX} enga thalaivar {Positive} 	1
ta_sent_2511	Sema mass thala neenga eppavum nalla irukanum god bless you thala	Positive	sema mass {Positive} mass thala {Positive} thala neenga {Positive} neenga eppavum {Mixed_feelings} eppavum nalla {XXX} nalla irukanum {Positive} irukanum god {XXX} god bless {Positive} bless you {Positive} 	1
ta_sent_2512	Thalaivar oda style ah thanni dan..  Sweet sapida poran	Positive	thalaivar oda {Positive} oda style {Positive} style ah {Positive} ah thanni {XXX} thanni dan {XXX} dan sweet {XXX} sweet sapida {Positive} 	1
ta_sent_2513	Ellam Avan Seyal Part 2 maari iruku 🤣🤣🤣	Positive	ellam avan {Negative} avan seyal {Positive} seyal part {Positive} part maari {XXX} 	1
ta_sent_2514	neraya neraya neraya neraya neraya neraya what a powerful performance.	Positive	neraya neraya {Positive} neraya neraya {Positive} neraya neraya {Positive} neraya neraya {Positive} neraya neraya {Positive} neraya what {Positive} what a {Positive} a powerful {Positive} 	1
ta_sent_2515	10,339,333 views\r Rocking \r 777K\r Likes \r 65K\r Dis L	Positive	viewsr rocking {XXX} rocking r {XXX} r kr {XXX} kr likes {XXX} likes r {XXX} r kr {XXX} kr dis {XXX} 	1
ta_sent_2516	Thalapathy record ah beat panna yarum illaiya	Positive	thalapathy record {Negative} record ah {Positive} ah beat {Positive} beat panna {Positive} panna yarum {XXX} 	1
ta_sent_2517	Mark my words tis movie trend set.	Positive	mark my {Positive} my words {Positive} words tis {XXX} tis movie {Positive} movie trend {XXX} 	1
ta_sent_2518	Thala thala thala.... .... Thala..	Positive	thala thala {Positive} thala thala {Positive} 	1
ta_sent_2519	Sema Vera level pa chance aye illa	Positive	sema vera {Positive} vera level {Positive} level pa {Positive} pa chance {XXX} chance aye {XXX} 	1
ta_sent_2520	Mass thalaiva Dhanush Anna vera level	Positive	mass thalaiva {Positive} thalaiva dhanush {Positive} dhanush anna {Positive} anna vera {Positive} 	1
ta_sent_2521	Thalaivar semma sirapanaa sambavam iruku	Positive	thalaivar semma {Positive} semma sirapanaa {XXX} sirapanaa sambavam {XXX} 	1
ta_sent_2522	climax la farmers ku neethi vangi kudukaroum	Positive	climax la {Positive} la farmers {XXX} farmers ku {XXX} ku neethi {XXX} neethi vangi {XXX} 	1
ta_sent_2523	You kena tunggu lebih lama lagi. Untuk tahu saya semma Vikram sir..  Malay le pinringaaa	not-malayalam/tamil	you kena {not-Tamil} kena tunggu {not-Tamil} tunggu lebih {not-Tamil} lebih lama {not-Tamil} lama lagi {not-Tamil} lagi untuk {not-Tamil} untuk tahu {not-Tamil} tahu saya {not-Tamil} saya semma {XXX} semma vikram {Positive} vikram sir {Positive} sir malay {XXX} malay le {XXX} 	4
ta_sent_2524	Sanda potu jeinga thaniya jeigathinga ... VJ sir	Positive	sanda potu {Positive} potu jeinga {XXX} jeinga thaniya {XXX} thaniya jeigathinga {XXX} jeigathinga vj {XXX} 	1
ta_sent_2525	Bro in just 21 hours 9.8 m views	Positive	bro in {XXX} in just {Positive} just hours {XXX} hours m {XXX} 	1
ta_sent_2526	Pink # amitab bachhan but ajit sir is gr8	Positive	pink amitab {XXX} amitab bachhan {XXX} bachhan but {XXX} but ajit {Positive} ajit sir {Positive} sir is {Positive} 	1
ta_sent_2527	Ghatiya just like cartoon movie ......	Negative	ghatiya just {XXX} just like {Negative} like cartoon {Negative} 	0
ta_sent_2528	Ommala Deiii Ennada Panni Vachurukinga	Positive	ommala deiii {XXX} deiii ennada {XXX} ennada panni {Positive} 	1
ta_sent_2529	Na comment like poda mata thn varn nu sollurvnga #like podungapa	Positive	na comment {Positive} comment like {Positive} like poda {Positive} poda mata {XXX} mata thn {XXX} thn varn {XXX} varn nu {XXX} nu sollurvnga {XXX} sollurvnga like {XXX} 	1
