id	text	category	newtext	label
ta_sent_720	BGM Therikkidhu.. Yuvan Da HERO	Positive	bgm therikkidhu {XXX} therikkidhu yuvan {XXX} yuvan da {XXX} 	1
ta_sent_721	Yevlo azhagaa mass ah iruparu nu konjam kuda expect panla. Super Star RAJNIKANTH IN PETTA.	Positive	yevlo azhagaa {XXX} azhagaa mass {XXX} mass ah {Positive} ah iruparu {XXX} iruparu nu {XXX} nu konjam {Mixed_feelings} konjam kuda {Positive} kuda expect {XXX} expect panla {XXX} panla super {XXX} super star {Positive} star rajnikanth {Positive} rajnikanth in {XXX} 	1
ta_sent_722	Thala nenga vethalam & veram maripadam yedunga thala	Positive	thala nenga {Positive} nenga vethalam {XXX} vethalam veram {XXX} veram maripadam {XXX} maripadam yedunga {XXX} 	1
ta_sent_723	Just like english movie point blank	Positive	just like {Negative} like english {XXX} english movie {Positive} movie point {XXX} 	1
ta_sent_724	1 million like varanum pls ellarum like podunga	Positive	million like {Positive} like varanum {Positive} varanum pls {XXX} pls ellarum {XXX} ellarum like {Positive} 	1
ta_sent_725	What ** did  you say, thala masss	Positive	what did {Positive} did you {Positive} you say {Positive} say thala {Positive} 	1
ta_sent_726	22k dislikes pota devangala. Neenga paaka indha trailer illa. Naanga paaka. Ungaluku pidikalana paakama Iruka vendiyadhu thaane.	Positive	k dislikes {Positive} dislikes pota {XXX} pota devangala {XXX} devangala neenga {XXX} neenga paaka {XXX} paaka indha {XXX} indha trailer {Positive} trailer illa {Positive} illa naanga {XXX} naanga paaka {XXX} paaka ungaluku {XXX} ungaluku pidikalana {XXX} pidikalana paakama {XXX} paakama iruka {XXX} iruka vendiyadhu {XXX} 	1
ta_sent_727	Marana waiting chiyaan screen la pakka poren	Positive	marana waiting {Positive} waiting chiyaan {XXX} chiyaan screen {XXX} screen la {Positive} la pakka {Positive} 	1
ta_sent_728	Innu neraya neraya neraya neraya....dhadava paakanum Pola  irukku .	Positive	innu neraya {Positive} neraya neraya {Positive} neraya neraya {Positive} neraya nerayadhadava {XXX} nerayadhadava paakanum {XXX} paakanum pola {Positive} 	1
ta_sent_729	sathima solra adicha underware odda vitarava	Positive	sathima solra {XXX} solra adicha {XXX} adicha underware {XXX} underware odda {XXX} 	1
ta_sent_730	Repeat mode la irukkuravanga hit like....	Positive	repeat mode {Positive} mode la {Positive} la irukkuravanga {XXX} irukkuravanga hit {XXX} 	1
ta_sent_731	Omg  Vera level ...last dailog omg awesome dis gone a next viral dailog in tiktok love from #Kuwait	Positive	omg vera {XXX} vera level {Positive} level last {Positive} last dailog {Positive} dailog omg {XXX} omg awesome {Positive} awesome dis {XXX} dis gone {XXX} gone a {XXX} a next {XXX} next viral {XXX} viral dailog {XXX} dailog in {XXX} in tiktok {XXX} tiktok love {XXX} love from {Positive} 	1
ta_sent_732	dislike potta parathesi naya ellaam seruppaala adikanum	Positive	dislike potta {Negative} potta parathesi {XXX} parathesi naya {XXX} naya ellaam {XXX} ellaam seruppaala {XXX} 	1
ta_sent_733	Oruthar mela visvaasam kaatradhukaga inoruthara yen asinga paduthuringa sema	Positive	oruthar mela {Positive} mela visvaasam {XXX} visvaasam kaatradhukaga {XXX} kaatradhukaga inoruthara {XXX} inoruthara yen {Positive} yen asinga {Positive} asinga paduthuringa {Positive} 	1
ta_sent_734	Yov vetri scene by scene sethukiruka vera level ya	Positive	yov vetri {XXX} vetri scene {XXX} scene by {XXX} by scene {XXX} scene sethukiruka {XXX} sethukiruka vera {XXX} vera level {Positive} 	1
ta_sent_735	Awesome.. Vikram gonna  rock again..	Positive	awesome vikram {not-Tamil} vikram gonna {XXX} gonna rock {XXX} 	1
ta_sent_736	Thee Mugam than pakka music yuvan pinnittaru sema mass irukku	Positive	thee mugam {Positive} mugam than {Positive} than pakka {Positive} pakka music {XXX} music yuvan {Positive} yuvan pinnittaru {XXX} pinnittaru sema {XXX} sema mass {Positive} 	1
ta_sent_737	Intha filmla suriya na nadichiruntha epdi irunthurukum	Positive	intha filmla {XXX} filmla suriya {XXX} suriya na {XXX} na nadichiruntha {XXX} nadichiruntha epdi {XXX} 	1
ta_sent_738	aniruth serivara mattan trailer Ra namma pasanga massu maranam theme & ullallaa theme potu upload pannunga	Positive	aniruth serivara {XXX} serivara mattan {XXX} mattan trailer {XXX} trailer ra {Positive} ra namma {XXX} namma pasanga {Positive} pasanga massu {XXX} massu maranam {Positive} maranam theme {XXX} theme ullallaa {XXX} ullallaa theme {XXX} theme potu {Negative} potu upload {XXX} 	1
ta_sent_739	Hit Like For Thala Nerkonda Paarvai	Positive	hit like {Positive} like for {Positive} for thala {Positive} thala nerkonda {Positive} 	1
ta_sent_740	Telugu Rajini Fans hit here	Positive	telugu rajini {Positive} rajini fans {Positive} fans hit {Positive} 	1
ta_sent_741	Ayioooooo vera vera vera vera level	Positive	ayioooooo vera {XXX} vera vera {Positive} vera vera {Positive} vera vera {Positive} 	1
ta_sent_742	Meratitiye Thala  #Nerkonda Paarvai Marana Waiting.....	Positive	meratitiye thala {XXX} thala nerkonda {Positive} nerkonda paarvai {Positive} paarvai marana {XXX} 	1
ta_sent_743	duniya ka sabse bda admi shah rukh khan zero best 2.0 bekar	Positive	duniya ka {XXX} ka sabse {XXX} sabse bda {XXX} bda admi {XXX} admi shah {XXX} shah rukh {XXX} rukh khan {XXX} khan zero {XXX} zero best {Positive} 	1
ta_sent_744	1:20 Teejay va yaarellam notice paneenga?	Positive	teejay va {Positive} va yaarellam {XXX} yaarellam notice {XXX} 	1
ta_sent_745	Yenada Likes, Views ivlo kammiya iruku  Bigil trailer poi parungada epdi iruku nu	Positive	yenada likes {XXX} likes views {Positive} views ivlo {Positive} ivlo kammiya {Positive} kammiya iruku {Mixed_feelings} iruku bigil {Negative} bigil trailer {Positive} trailer poi {Positive} poi parungada {Positive} parungada epdi {XXX} epdi iruku {XXX} 	1
ta_sent_746	Thala maranam mass waiting from Karnataka  thala fans	Positive	thala maranam {XXX} maranam mass {Positive} mass waiting {Positive} waiting from {Positive} from karnataka {Positive} karnataka thala {XXX} 	1
ta_sent_747	Isai puyal fans hit like	Positive	isai puyal {Positive} puyal fans {XXX} fans hit {Positive} 	1
ta_sent_748	Y1 king of BGM marana mass	Positive	y king {XXX} king of {Positive} of bgm {Positive} bgm marana {Positive} 	1
ta_sent_749	Super super super super super super	Positive	super super {Positive} super super {Positive} super super {Positive} super super {Positive} 	1
ta_sent_750	Vikram Fan's Anna unga Movie ku Waiting	Positive	vikram fans {Positive} fans anna {XXX} anna unga {Positive} unga movie {XXX} movie ku {Positive} 	1
ta_sent_751	Paddipa onnu mattum namba kitta avanuga pudunga mudyathu da chidambaram	Positive	paddipa onnu {XXX} onnu mattum {XXX} mattum namba {Positive} namba kitta {Positive} kitta avanuga {XXX} avanuga pudunga {XXX} pudunga mudyathu {XXX} mudyathu da {XXX} 	1
ta_sent_752	ennada ithu oru phone 0:23 kooraya pichikkittu pohuthu	Positive	ennada ithu {Positive} ithu oru {Positive} oru phone {XXX} phone kooraya {XXX} kooraya pichikkittu {XXX} 	1
ta_sent_753	Dislike panravan lam note panni vachuko itha Vida double madanga ungaluku kodupom	Positive	dislike panravan {Negative} panravan lam {XXX} lam note {XXX} note panni {XXX} panni vachuko {XXX} vachuko itha {XXX} itha vida {Positive} vida double {XXX} double madanga {XXX} madanga ungaluku {XXX} 	1
ta_sent_754	Padam pathuduvanthu trailer pathavaga like panunaga	Positive	padam pathuduvanthu {XXX} pathuduvanthu trailer {XXX} trailer pathavaga {unknown_state} pathavaga like {unknown_state} 	1
ta_sent_755	For A r rahman Hit like	Positive	for a {Positive} a r {Positive} r rahman {Positive} rahman hit {XXX} 	1
ta_sent_756	Viswasam jettyoda oda poguthu manam kapal yera poguthu thalaivar comeback	Positive	viswasam jettyoda {XXX} jettyoda oda {XXX} oda poguthu {XXX} poguthu manam {XXX} manam kapal {XXX} kapal yera {XXX} yera poguthu {XXX} poguthu thalaivar {XXX} 	1
ta_sent_757	sema mass super star petta 365 days hit	Positive	sema mass {Positive} mass super {Positive} super star {Positive} star petta {unknown_state} petta days {XXX} 	1
ta_sent_758	1 million views and 100k likes  🤸🤸🤸	Positive	million views {Positive} views and {Positive} and k {XXX} 	1
ta_sent_759	sema but aniruth music sumara irukku ,,,yuvan best ah oottruparu ,,,	Mixed_feelings	sema but {Mixed_feelings} but aniruth {Mixed_feelings} aniruth music {Mixed_feelings} music sumara {Mixed_feelings} sumara irukku {Mixed_feelings} irukku yuvan {Mixed_feelings} yuvan best {Mixed_feelings} best ah {Mixed_feelings} 	3
ta_sent_760	yenda indha viswasam trailer varuma varatha mudiyala	Positive	yenda indha {XXX} indha viswasam {XXX} viswasam trailer {unknown_state} trailer varuma {XXX} varuma varatha {Positive} 	1
ta_sent_761	Dey innum 10mil kudam varalaya 🤣🤣	Negative	dey innum {XXX} innum mil {XXX} mil kudam {Negative} 	0
ta_sent_762	Dislikers are not a human being....	Positive	dislikers are {XXX} are not {Negative} not a {Positive} a human {Negative} 	1
ta_sent_763	PROUD TO BE TAMILIAN  TAMILIANS POWER IN THE MOVIE	Positive	proud to {Positive} to be {Positive} be tamilian {XXX} tamilian tamilians {XXX} tamilians power {XXX} power in {XXX} in the {Positive} 	1
ta_sent_764	gokka makka....fully Rajinism...athuvum last touch...semmma... adichu underwear oda vitruven...yaruku sollirukaro....	Positive	gokka makkafully {XXX} makkafully rajinismathuvum {XXX} rajinismathuvum last {XXX} last touchsemmma {XXX} touchsemmma adichu {XXX} adichu underwear {Positive} underwear oda {Positive} oda vitruvenyaruku {XXX} 	1
ta_sent_765	1:06 Yuvan BGM Vera level 🥳	Positive	yuvan bgm {Positive} bgm vera {Positive} 	1
ta_sent_766	kolakandula irukken kollama vidamatten thalaivar mAaAaaaaaaaas	Positive	kolakandula irukken {XXX} irukken kollama {Positive} kollama vidamatten {Positive} vidamatten thalaivar {XXX} 	1
ta_sent_767	PETTA fdfs booked....waiting thalaivaaaa.....vaa thalaivaaa.....PETTA PARAAK....	Positive	petta fdfs {XXX} fdfs bookedwaiting {XXX} bookedwaiting thalaivaaaavaa {XXX} thalaivaaaavaa thalaivaaapetta {XXX} 	1
ta_sent_768	Yedraaaaaaa anda ascaar award ah this film will sure gonna a huge one of Dhanush	Positive	yedraaaaaaa anda {XXX} anda ascaar {XXX} ascaar award {XXX} award ah {Positive} ah this {XXX} this film {Positive} film will {XXX} will sure {XXX} sure gonna {XXX} gonna a {XXX} a huge {XXX} huge one {XXX} one of {Positive} 	1
ta_sent_769	Thala nenga neraya neraya nerayanu dialogue pesum pothu unga voice apadi oru gambhirama iruku.	Positive	thala nenga {Positive} nenga neraya {XXX} neraya neraya {Positive} neraya nerayanu {XXX} nerayanu dialogue {XXX} dialogue pesum {XXX} pesum pothu {Negative} pothu unga {XXX} unga voice {XXX} voice apadi {XXX} apadi oru {Mixed_feelings} oru gambhirama {XXX} 	1
ta_sent_770	Likeskaga inga Pichai edukradhuku poyi signalla eduthalachu konjam roobai therum	Positive	likeskaga inga {XXX} inga pichai {XXX} pichai edukradhuku {XXX} edukradhuku poyi {XXX} poyi signalla {XXX} signalla eduthalachu {XXX} eduthalachu konjam {XXX} konjam roobai {XXX} 	1
ta_sent_771	Oruthar mela neenga viswasam katrudhukaga, inoruthar ah en asinga paduthureenga  Love from Thalapathy Fans	Positive	oruthar mela {Positive} mela neenga {Positive} neenga viswasam {Positive} viswasam katrudhukaga {Positive} katrudhukaga inoruthar {XXX} inoruthar ah {Positive} ah en {Positive} en asinga {Positive} asinga paduthureenga {Positive} paduthureenga love {XXX} love from {Positive} from thalapathy {Positive} 	1
ta_sent_772	Trailer ivlo nalla irukunna , கண்டிப்பா U1 music ah kanna muditu kelunga Vera level	Positive	trailer ivlo {XXX} ivlo nalla {Positive} nalla irukunna {XXX} irukunna u {XXX} u music {XXX} music ah {Negative} ah kanna {XXX} kanna muditu {XXX} muditu kelunga {XXX} kelunga vera {XXX} 	1
ta_sent_773	Man Of Steel Bgm Oda influence irukura madiri iruku🤔	Positive	man of {Positive} of steel {Positive} steel bgm {Positive} bgm oda {Negative} oda influence {XXX} influence irukura {XXX} irukura madiri {XXX} 	1
ta_sent_774	Thala da... Thala veriyan  ...i am waiting for you	Positive	thala da {Positive} da thala {Positive} thala veriyan {Positive} veriyan i {XXX} i am {Positive} am waiting {Positive} waiting for {Positive} 	1
ta_sent_775	Ilamai inimel pogadhu mudumai unaku vaaradhu theivame.....	Positive	ilamai inimel {XXX} inimel pogadhu {XXX} pogadhu mudumai {XXX} mudumai unaku {XXX} unaku vaaradhu {XXX} 	1
ta_sent_776	I am waiting vetri maran. sir ...	Positive	i am {Positive} am waiting {Positive} waiting vetri {XXX} vetri maran {Positive} 	1
ta_sent_777	Teaserea verithanama irukku   ,appo padam .. .....	Positive	teaserea verithanama {XXX} verithanama irukku {Positive} irukku appo {Negative} 	1
ta_sent_778	Ean Anna Unaku ena achi ean engala ipdi savadekura pls nee ine padam nadekatha anna #Sk	Positive	ean anna {XXX} anna unaku {XXX} unaku ena {XXX} ena achi {XXX} achi ean {XXX} ean engala {XXX} engala ipdi {XXX} ipdi savadekura {XXX} savadekura pls {XXX} pls nee {XXX} nee ine {XXX} ine padam {XXX} padam nadekatha {XXX} nadekatha anna {XXX} 	1
ta_sent_779	Romba Nalaiku Apram Palaya Rajiniya Pakkura Madhri Oru Feeling ..	Positive	romba nalaiku {Positive} nalaiku apram {Positive} apram palaya {XXX} palaya rajiniya {XXX} rajiniya pakkura {XXX} pakkura madhri {XXX} madhri oru {XXX} 	1
ta_sent_780	ಕೆಲ್ಗಡೆ ಅಷ್ಟೊಂದ್ ಜನ ಇದ್ದಾರೆ ನೀನ್ ಯೆಂಗ್ ಮೆಲ್ಬಂದೆ.ಅದನ್ನ ಹೋಗಿ ಕೆಲ್ಗಾಡೆ ಇರೋರ್ನ ಕೇಳು .ಮೇಲ್ ಬಂದವ್ನಾತ್ರ ಕೇಳಬೇಡ super dailog	Positive		1
ta_sent_781	I bet it's gonna be very big hit.	Positive	i bet {XXX} bet its {XXX} its gonna {XXX} gonna be {Positive} be very {XXX} very big {XXX} 	1
ta_sent_782	Avara control pannunga plz semma ......... dialogue	Positive	avara control {Positive} control pannunga {Positive} pannunga plz {XXX} plz semma {XXX} 	1
ta_sent_783	Eppadi pa ithukku dislike kodukkareenga.. Thiramai enga irunthalum mathikkanum.. waiting to see on screen	Positive	eppadi pa {XXX} pa ithukku {XXX} ithukku dislike {XXX} dislike kodukkareenga {XXX} kodukkareenga thiramai {XXX} thiramai enga {XXX} enga irunthalum {XXX} irunthalum mathikkanum {XXX} mathikkanum waiting {XXX} waiting to {Positive} to see {Positive} see on {XXX} 	1
ta_sent_784	Kaali ....coming soon....marana kattu eruku .....thalaivaaaaaaa 90s kinds Rajini fansku semma mass....I love u thalaivaaaaaa	Positive	kaali coming {XXX} coming soonmarana {XXX} soonmarana kattu {XXX} kattu eruku {XXX} eruku thalaivaaaaaaa {XXX} thalaivaaaaaaa s {XXX} s kinds {XXX} kinds rajini {XXX} rajini fansku {XXX} fansku semma {XXX} semma massi {XXX} massi love {XXX} love u {Positive} 	1
ta_sent_785	Dei trailer vanthu rendu naal aachi innum trending laye varala.   Enanga da nadakuthu.	Positive	dei trailer {XXX} trailer vanthu {Positive} vanthu rendu {XXX} rendu naal {XXX} naal aachi {Positive} aachi innum {XXX} innum trending {Mixed_feelings} trending laye {Positive} laye varala {XXX} varala enanga {XXX} enanga da {XXX} 	1
ta_sent_786	South ki sabse jada movie dekhne wale like karo.	Positive	south ki {XXX} ki sabse {XXX} sabse jada {XXX} jada movie {XXX} movie dekhne {XXX} dekhne wale {XXX} wale like {XXX} 	1
ta_sent_787	Yaru Ethu Katthu Kututhalum Odane Kathupen....vera level Naanum Aptiye....	Positive	yaru ethu {XXX} ethu katthu {XXX} katthu kututhalum {XXX} kututhalum odane {XXX} odane kathupenvera {XXX} kathupenvera level {XXX} level naanum {XXX} 	1
ta_sent_788	Comment neraya varanumnu orey aalu naalu vatti comment pennutanga  ...........soo pathetic	Positive	comment neraya {XXX} neraya varanumnu {XXX} varanumnu orey {XXX} orey aalu {XXX} aalu naalu {XXX} naalu vatti {XXX} vatti comment {XXX} comment pennutanga {XXX} pennutanga soo {XXX} 	1
ta_sent_789	Thala vera leval trailer semma massa iruku	Positive	thala vera {Positive} vera leval {Positive} leval trailer {Positive} trailer semma {Positive} semma massa {Positive} 	1
ta_sent_790	Chiyan Vikram super hero hai ,world ka	Positive	chiyan vikram {Positive} vikram super {XXX} super hero {Positive} hero hai {XXX} hai world {XXX} 	1
ta_sent_791	Thala pola varuma  Thala eppavume mass Vera level	Positive	thala pola {Positive} pola varuma {Positive} varuma thala {Positive} thala eppavume {Positive} eppavume mass {Positive} mass vera {Positive} 	1
ta_sent_792	The king of Indian cinema daw..vanga vanga	Positive	the king {Positive} king of {Positive} of indian {Positive} indian cinema {Positive} cinema dawvanga {XXX} 	1
ta_sent_793	Kaithi  Diwali  Karthi Anna	Positive	kaithi diwali {Mixed_feelings} diwali karthi {unknown_state} 	1
ta_sent_794	Awesome Vikram Anna Chance ye illa Pakkah	Positive	awesome vikram {not-Tamil} vikram anna {Positive} anna chance {XXX} chance ye {XXX} ye illa {XXX} 	1
ta_sent_795	Friends yalaru Link  Share panuge	Positive	friends yalaru {XXX} yalaru link {XXX} link share {Positive} 	1
ta_sent_796	Sema vera level epayum pola hit dhan	Positive	sema vera {Positive} vera level {Positive} level epayum {XXX} epayum pola {XXX} pola hit {XXX} 	1
ta_sent_797	Diwali list la indha movie dhaan win pannum	Positive	diwali list {XXX} list la {Positive} la indha {XXX} indha movie {Positive} movie dhaan {XXX} dhaan win {XXX} 	1
ta_sent_798	Thalla neenga veera level thala .	Positive	thalla neenga {XXX} neenga veera {XXX} veera level {Positive} 	1
ta_sent_799	Nala vella nan pink pakkla parthu irundha indha padam enaku impactfull iruthurukadhu Ajith Who all didn't watch pink like here	Positive	nala vella {XXX} vella nan {XXX} nan pink {XXX} pink pakkla {XXX} pakkla parthu {XXX} parthu irundha {XXX} irundha indha {XXX} indha padam {Positive} padam enaku {XXX} enaku impactfull {XXX} impactfull iruthurukadhu {XXX} iruthurukadhu ajith {XXX} ajith who {XXX} who all {unknown_state} all didnt {XXX} didnt watch {XXX} watch pink {XXX} pink like {XXX} 	1
ta_sent_800	Na Vijay fan but thala thappa edhum peasala and sollala y dislike pandringa	Positive	na vijay {Positive} vijay fan {Positive} fan but {Positive} but thala {Positive} thala thappa {XXX} thappa edhum {XXX} edhum peasala {XXX} peasala and {XXX} and sollala {XXX} sollala y {XXX} y dislike {XXX} 	1
ta_sent_801	Sivakarthikeyana vida Action king than neraiya edathula vararu	Positive	sivakarthikeyana vida {XXX} vida action {XXX} action king {Positive} king than {Positive} than neraiya {Positive} neraiya edathula {XXX} 	1
ta_sent_802	Hope it is not Rekka 2	Positive	hope it {XXX} it is {Positive} is not {Negative} 	1
ta_sent_803	PETA super film Kali Ida vata thudagi aaa aaa peeta	Positive	peta super {XXX} super film {not-Tamil} film kali {XXX} kali ida {XXX} ida vata {XXX} vata thudagi {XXX} thudagi aaa {XXX} aaa aaa {XXX} 	1
ta_sent_804	Namaku thevaiyanatha namma than adichu vanganum(asuran)........ Namala kapathiga nama pandrathu rowdisum na rowdisum pannuvom(vada chennai)	Positive	namaku thevaiyanatha {Positive} thevaiyanatha namma {XXX} namma than {Positive} than adichu {Positive} adichu vanganumasuran {XXX} vanganumasuran namala {XXX} namala kapathiga {XXX} kapathiga nama {XXX} nama pandrathu {XXX} pandrathu rowdisum {XXX} rowdisum na {XXX} na rowdisum {XXX} rowdisum pannuvomvada {XXX} 	1
ta_sent_805	movie block buster hit aagum	Positive	movie block {XXX} block buster {Positive} buster hit {Positive} 	1
ta_sent_806	AMAZING    RAJINI ANTEY RAJINI EY DAAW   WAITING FOR MOVIE	Positive	amazing rajini {Positive} rajini antey {XXX} antey rajini {XXX} rajini ey {XXX} ey daaw {XXX} daaw waiting {XXX} waiting for {Positive} 	1
ta_sent_807	ennaya  ithu, Evla time paathalum salikkave matinguthu, 100 time ku Mela pathasu trailer ha, Thalaivar maasss tha eppavume	Positive	ennaya ithu {XXX} ithu evla {XXX} evla time {XXX} time paathalum {XXX} paathalum salikkave {XXX} salikkave matinguthu {XXX} matinguthu time {XXX} time ku {Positive} ku mela {Positive} mela pathasu {XXX} pathasu trailer {XXX} trailer ha {Mixed_feelings} ha thalaivar {XXX} thalaivar maasss {XXX} maasss tha {XXX} 	1
ta_sent_808	Krish1 2 mugamuthi daiii apdiya iruki	Positive	krish mugamuthi {XXX} mugamuthi daiii {XXX} daiii apdiya {XXX} 	1
ta_sent_809	Ovvaru sternum, thalaivaa unakaluggu Niger neengathaan,i love u thalivaa	Positive	ovvaru sternum {XXX} sternum thalaivaa {XXX} thalaivaa unakaluggu {XXX} unakaluggu niger {XXX} niger neengathaani {XXX} neengathaani love {XXX} love u {Positive} 	1
ta_sent_810	You kena tunggu Lebih lama lagi untuk tahu Saya!!!	not-malayalam/tamil	you kena {not-Tamil} kena tunggu {not-Tamil} tunggu lebih {not-Tamil} lebih lama {not-Tamil} lama lagi {not-Tamil} lagi untuk {not-Tamil} untuk tahu {not-Tamil} 	4
ta_sent_811	Thala last punch true true true ....	Positive	thala last {Positive} last punch {not-Tamil} punch true {XXX} true true {XXX} 	1
ta_sent_812	Shivaaaaaaaa marana waiting, kadharalls la kannudukkadhinga nama munnukka poitte irukkanum	Positive	shivaaaaaaaa marana {XXX} marana waiting {Positive} waiting kadharalls {XXX} kadharalls la {XXX} la kannudukkadhinga {XXX} kannudukkadhinga nama {XXX} nama munnukka {XXX} munnukka poitte {XXX} 	1
ta_sent_813	Otha padam vera level ah irukum pola .thala mass	Positive	otha padam {Positive} padam vera {Positive} vera level {Positive} level ah {Positive} ah irukum {Positive} irukum pola {Positive} pola thala {XXX} 	1
ta_sent_814	good message movie awesome AJITH SIR	Positive	good message {XXX} message movie {Positive} movie awesome {XXX} awesome ajith {XXX} 	1
ta_sent_815	Movie patutu vanthu patavanga la like podunga	Positive	movie patutu {XXX} patutu vanthu {XXX} vanthu patavanga {XXX} patavanga la {XXX} la like {Positive} 	1
ta_sent_816	Epdi mela vandhanu mela vandhavana dhaan da keka mudiyum! Enada dialog idhu chaiii	Positive	epdi mela {XXX} mela vandhanu {XXX} vandhanu mela {XXX} mela vandhavana {XXX} vandhavana dhaan {XXX} dhaan da {Positive} da keka {XXX} keka mudiyum {XXX} mudiyum enada {XXX} enada dialog {XXX} dialog idhu {XXX} 	1
ta_sent_817	Thala pola varuma neengatha thala mass	Positive	thala pola {Positive} pola varuma {Positive} varuma neengatha {XXX} neengatha thala {XXX} 	1
ta_sent_818	As usual vijay fans started disliking the trailer.   Avangala thavira yaarum munnera koodathunu ninaikiranga	Positive	as usual {Positive} usual vijay {XXX} vijay fans {Positive} fans started {XXX} started disliking {XXX} disliking the {XXX} the trailer {Positive} trailer avangala {XXX} avangala thavira {XXX} thavira yaarum {XXX} yaarum munnera {XXX} munnera koodathunu {XXX} 	1
ta_sent_819	Rajinikanth vera level wating to watching	Positive	rajinikanth vera {XXX} vera level {Positive} level wating {XXX} wating to {XXX} 	1
ta_sent_820	Mujha àcha nai laga trailer bakwaas hai akshay Kumar acting is best	Positive	mujha cha {XXX} cha nai {XXX} nai laga {XXX} laga trailer {not-Tamil} trailer bakwaas {XXX} bakwaas hai {XXX} hai akshay {XXX} akshay kumar {Positive} kumar acting {Positive} acting is {Positive} 	1
ta_sent_821	Rajani sir's akshay gi fans put ur like here	Positive	rajani sirs {XXX} sirs akshay {XXX} akshay gi {XXX} gi fans {XXX} fans put {XXX} put ur {XXX} ur like {XXX} 	1
ta_sent_822	Yena aga pore sakthiman ..periya ooollll	Positive	yena aga {XXX} aga pore {XXX} pore sakthiman {XXX} sakthiman periya {XXX} 	1
ta_sent_823	Hit like if 2.0 breaks bahubali's record,if no hit dislike	Positive	hit like {Positive} like if {Positive} if breaks {XXX} breaks bahubalis {XXX} bahubalis recordif {XXX} recordif no {XXX} no hit {XXX} 	1
ta_sent_824	Gotha epo dhan da bigil trailer viduvinga	Positive	gotha epo {XXX} epo dhan {Positive} dhan da {Positive} da bigil {XXX} bigil trailer {Positive} 	1
ta_sent_825	Kisne 2 bhar dekha yeh trailer	Positive	kisne bhar {XXX} bhar dekha {XXX} dekha yeh {XXX} 	1
ta_sent_826	Kola kandla iruken mavane kollama vida maten what a punch!	Positive	kola kandla {XXX} kandla iruken {XXX} iruken mavane {Positive} mavane kollama {Positive} kollama vida {Positive} vida maten {Positive} maten what {XXX} what a {Positive} 	1
ta_sent_827	G***mala thala tucker doi!!!! Film blockbuster!!	Positive	gmala thala {XXX} thala tucker {Positive} tucker doi {Positive} doi film {XXX} 	1
ta_sent_828	thala level .. pink ..	Positive	thala level {XXX} 	1
ta_sent_829	No. 1 trending wow.... Thala takkaru doii	Positive	no trending {Mixed_feelings} trending wow {XXX} wow thala {Positive} thala takkaru {Positive} 	1
ta_sent_830	Yaarellam Vadachennai movie alavuku asuran illanu feel panreenga	Positive	yaarellam vadachennai {XXX} vadachennai movie {Positive} movie alavuku {XXX} alavuku asuran {XXX} asuran illanu {XXX} illanu feel {XXX} 	1
ta_sent_831	Saavatha iruntha sanda poottu saavanu sir Payanthu kaala vilunthu saava koodathu	Positive	saavatha iruntha {XXX} iruntha sanda {Positive} sanda poottu {XXX} poottu saavanu {XXX} saavanu sir {XXX} sir payanthu {Positive} payanthu kaala {XXX} kaala vilunthu {XXX} vilunthu saava {Positive} 	1
ta_sent_832	T H A L A	Positive	t h {Positive} h a {Positive} a l {Positive} 	1
ta_sent_833	ksubaraj ovoru scenayum katha vitruvaru polaye oh my god	Positive	ksubaraj ovoru {XXX} ovoru scenayum {XXX} scenayum katha {XXX} katha vitruvaru {XXX} vitruvaru polaye {XXX} polaye oh {XXX} oh my {Positive} 	1
ta_sent_834	Saavanumna santta pottu savanum   Aduthavan kalla pudichu savakudathu   semma  dilogue	Positive	saavanumna santta {XXX} santta pottu {XXX} pottu savanum {unknown_state} savanum aduthavan {XXX} aduthavan kalla {XXX} kalla pudichu {XXX} pudichu savakudathu {XXX} savakudathu semma {XXX} 	1
ta_sent_835	Lokesh Kanna ennada panni vachi iruka, semaya iruku po. Unnala onnum panna mudiyathu apdiye poite iru	Positive	lokesh kanna {XXX} kanna ennada {XXX} ennada panni {Positive} panni vachi {Positive} vachi iruka {XXX} iruka semaya {XXX} semaya iruku {Positive} iruku po {XXX} po unnala {XXX} unnala onnum {XXX} onnum panna {Positive} panna mudiyathu {Positive} mudiyathu apdiye {XXX} apdiye poite {XXX} 	1
