id	text	category	newtext	label
ta_sent_1556	Kathi,mersal,Veeram,Vengai,etc..ellathaiyum oru jar la potu mixie la potu oru adi ...sangathamizhan ready...	Positive	kathimersalveeramvengaietcellathaiyum oru {XXX} oru jar {XXX} jar la {XXX} la potu {Negative} potu mixie {XXX} mixie la {XXX} la potu {Negative} potu oru {XXX} oru adi {Mixed_feelings} adi sangathamizhan {XXX} 	1
ta_sent_1557	Go an fuck an few man hasan	Positive	go an {XXX} an fuck {XXX} fuck an {XXX} an few {XXX} few man {XXX} 	1
ta_sent_1558	en agam mahizhum en aatharshana naayaganeaaa	Positive	en agam {XXX} agam mahizhum {XXX} mahizhum en {XXX} en aatharshana {XXX} 	1
ta_sent_1559	My super  Rajinikanth hi thaliva supar	Positive	my super {Positive} super rajinikanth {Positive} rajinikanth hi {XXX} hi thaliva {XXX} 	1
ta_sent_1560	Oruthar meela neegga viswasham katrathala.....innoruthara yeen asinggappaduthuregga........	Positive	oruthar meela {Positive} meela neegga {XXX} neegga viswasham {XXX} viswasham katrathalainnoruthara {XXX} katrathalainnoruthara yeen {XXX} 	1
ta_sent_1561	enadaa views ah vida likes adhigama iruku	Positive	enadaa views {XXX} views ah {Positive} ah vida {Positive} vida likes {Positive} likes adhigama {Negative} 	1
ta_sent_1562	is movie me rajnikant ki trik & planning bahut achhi lagi  Blockbuster movie	Positive	is movie {not-Tamil} movie me {not-Tamil} me rajnikant {XXX} rajnikant ki {XXX} ki trik {XXX} trik planning {XXX} planning bahut {XXX} bahut achhi {XXX} achhi lagi {XXX} lagi blockbuster {XXX} 	1
ta_sent_1563	world wise big superstar  rajinikanth talaiva	Positive	world wise {XXX} wise big {XXX} big superstar {unknown_state} superstar rajinikanth {Positive} 	1
ta_sent_1564	Teejay va yaru lam note paninga	Positive	teejay va {Positive} va yaru {XXX} yaru lam {XXX} lam note {XXX} 	1
ta_sent_1565	Epo Thanya release ah aaiyiruku, adhukulla meme creator start pannitangaley da.... I came here after meme	Positive	epo thanya {XXX} thanya release {XXX} release ah {XXX} ah aaiyiruku {XXX} aaiyiruku adhukulla {XXX} adhukulla meme {XXX} meme creator {XXX} creator start {XXX} start pannitangaley {XXX} pannitangaley da {XXX} da i {Positive} i came {XXX} came here {XXX} here after {Positive} 	1
ta_sent_1566	Marana mass  Love u தலைவா	Positive	marana mass {Positive} mass love {Positive} 	1
ta_sent_1567	Movie epdi irunthalum kandippa Vikram sir lookkuga movie fdfs Papen... because July 19 my birthday also......	Positive	movie epdi {Positive} epdi irunthalum {XXX} irunthalum kandippa {XXX} kandippa vikram {XXX} vikram sir {Positive} sir lookkuga {XXX} lookkuga movie {XXX} movie fdfs {XXX} fdfs papen {XXX} papen because {XXX} because july {XXX} july my {XXX} my birthday {Mixed_feelings} 	1
ta_sent_1568	Enkuda yaarum varlana kuda Parava illa... Naa theatre ku Thaniya Poi Paapen da indha padatha..	Positive	enkuda yaarum {XXX} yaarum varlana {XXX} varlana kuda {XXX} kuda parava {XXX} parava illa {XXX} illa naa {XXX} naa theatre {Positive} theatre ku {Positive} ku thaniya {XXX} thaniya poi {XXX} poi paapen {XXX} paapen da {XXX} da indha {Positive} 	1
ta_sent_1569	A one day will be Hollywood defeated by Bollywood	Positive	a one {XXX} one day {unknown_state} day will {XXX} will be {unknown_state} be hollywood {XXX} hollywood defeated {XXX} defeated by {XXX} 	1
ta_sent_1570	pakkathana pora intha Kali Oda addatha	Positive	pakkathana pora {XXX} pora intha {Positive} intha kali {Positive} kali oda {Positive} 	1
ta_sent_1571	last dance vera level remembering veera rajini sir!!!!	Positive	last dance {Positive} dance vera {Positive} vera level {Positive} level remembering {XXX} remembering veera {XXX} veera rajini {XXX} 	1
ta_sent_1572	Spider man Bat man Super man And u herooooo (mugamudi)🤔🤔🤔🤔	Positive	spider man {Positive} man bat {XXX} bat man {Positive} man super {XXX} super man {Positive} man and {Positive} and u {XXX} u herooooo {XXX} 	1
ta_sent_1573	makkal selvana ?  ivanellam makkal selvana irundha vijay ajith vikram  arun vijay ku ellam enna solluvaga ?	Positive	makkal selvana {XXX} selvana ivanellam {XXX} ivanellam makkal {XXX} makkal selvana {XXX} selvana irundha {XXX} irundha vijay {XXX} vijay ajith {Negative} ajith vikram {XXX} vikram arun {XXX} arun vijay {Negative} vijay ku {Positive} ku ellam {Positive} ellam enna {XXX} 	1
ta_sent_1574	saaho veta kammi views poi iruku	Positive	saaho veta {XXX} veta kammi {XXX} kammi views {Positive} views poi {XXX} 	1
ta_sent_1575	Superb movie... Rajani is back with a bang	Positive	superb movie {Positive} movie rajani {XXX} rajani is {Positive} is back {Positive} back with {Positive} with a {Positive} 	1
ta_sent_1576	Like - SURIYA (Kaappan) CMD - Dhanush (Asuran)	Positive	like suriya {XXX} suriya kaappan {XXX} kaappan cmd {XXX} cmd dhanush {XXX} 	1
ta_sent_1577	Not worthy vfx illana shakthi man pakkura mathiri than irukkum	Positive	not worthy {XXX} worthy vfx {XXX} vfx illana {XXX} illana shakthi {XXX} shakthi man {Positive} man pakkura {XXX} pakkura mathiri {XXX} mathiri than {Positive} 	1
ta_sent_1578	Point break konjam real la irrukum	Positive	point break {Positive} break konjam {XXX} konjam real {XXX} real la {XXX} 	1
ta_sent_1579	10m views varathukay 5 naal aagudhu..IPO varaikum kooda 775k likes dhan...idhula ivaru thalapathyku competitorahm..	Positive	m views {Positive} views varathukay {XXX} varathukay naal {XXX} naal aagudhuipo {XXX} aagudhuipo varaikum {XXX} varaikum kooda {XXX} kooda k {XXX} k likes {Positive} likes dhanidhula {XXX} dhanidhula ivaru {XXX} ivaru thalapathyku {XXX} 	1
ta_sent_1580	Vijay fans varuvanga ....ithu remakenu yaarkum theriyatha unmaiya solluvanga	Positive	vijay fans {Positive} fans varuvanga {XXX} varuvanga ithu {XXX} ithu remakenu {XXX} remakenu yaarkum {XXX} yaarkum theriyatha {XXX} theriyatha unmaiya {XXX} 	1
ta_sent_1581	Teaser konjam tha purium...main picture vera leval la irukumla....	Positive	teaser konjam {XXX} konjam tha {XXX} tha puriummain {XXX} puriummain picture {XXX} picture vera {XXX} vera leval {Positive} leval la {Mixed_feelings} 	1
ta_sent_1582	Thalaivarr  kerala fans irukka keri oru like tharoooo	Positive	thalaivarr kerala {XXX} kerala fans {unknown_state} fans irukka {XXX} irukka keri {XXX} keri oru {XXX} oru like {Positive} 	1
ta_sent_1583	Petta is more than annamalai, padayappaa...thalaiva second entry started...super ah kamichirkanga ...thanks karthik sir	Positive	petta is {XXX} is more {XXX} more than {Positive} than annamalai {XXX} annamalai padayappaathalaiva {XXX} padayappaathalaiva second {XXX} second entry {XXX} entry startedsuper {XXX} startedsuper ah {XXX} ah kamichirkanga {XXX} kamichirkanga thanks {XXX} thanks karthik {Positive} 	1
ta_sent_1584	Mass #Thala  #NerkondaPaarvai  #Thala #VickyEdits  #Thalapolavaruma	Positive	mass thala {Positive} thala nerkondapaarvai {Positive} nerkondapaarvai thala {XXX} thala vickyedits {XXX} 	1
ta_sent_1585	Different aana thala epo paaka porom	Positive	different aana {Positive} aana thala {Positive} thala epo {XXX} epo paaka {XXX} 	1
ta_sent_1586	Enna Da comedy ah eruku 🤣	Positive	enna da {Positive} da comedy {Positive} comedy ah {Positive} 	1
ta_sent_1587	Veera level super anna srilangkan thala fans	Positive	veera level {Positive} level super {Positive} super anna {Positive} anna srilangkan {XXX} srilangkan thala {XXX} 	1
ta_sent_1588	Bgm mass na like click pannungha 🤩	Positive	bgm mass {Positive} mass na {Positive} na like {Positive} like click {XXX} 	1
ta_sent_1589	U always look young . . . Thalaiva	Positive	u always {Positive} always look {XXX} look young {Positive} 	1
ta_sent_1590	Thala Semma Thala nerayaaa nerayaaa nerayaaa	Positive	thala semma {Positive} semma thala {Positive} thala nerayaaa {XXX} nerayaaa nerayaaa {XXX} 	1
ta_sent_1591	1 lakh likes in just 40 minutes	Positive	lakh likes {XXX} likes in {Positive} in just {Positive} 	1
ta_sent_1592	Ipa vara padamla vivasayam pathi varudhu ellam trend aachi	Positive	ipa vara {XXX} vara padamla {XXX} padamla vivasayam {XXX} vivasayam pathi {XXX} pathi varudhu {XXX} varudhu ellam {XXX} ellam trend {XXX} 	1
ta_sent_1593	Look like malayalam movie Chinthamani kola case🤔  But Tala act	Mixed_feelings	look like {Positive} like malayalam {XXX} malayalam movie {Mixed_feelings} movie chinthamani {Negative} chinthamani kola {Mixed_feelings} kola case {Negative} case but {XXX} but tala {XXX} 	3
ta_sent_1594	Kamala song sema . Video vitingna jolly ah poiruven	Positive	kamala song {XXX} song sema {XXX} sema video {XXX} video vitingna {XXX} vitingna jolly {XXX} jolly ah {XXX} 	1
ta_sent_1595	Sweet Sapda porom. Yes engaluku Jan 10 annaike pongal than.	Positive	sweet sapda {Positive} sapda porom {Positive} porom yes {XXX} yes engaluku {XXX} engaluku jan {XXX} jan annaike {XXX} annaike pongal {XXX} 	1
ta_sent_1596	Enga Tamil  layum bramanda movies eduka all iruku da	Positive	enga tamil {Mixed_feelings} tamil layum {XXX} layum bramanda {XXX} bramanda movies {XXX} movies eduka {XXX} eduka all {XXX} all iruku {XXX} 	1
ta_sent_1597	Trending la varamaley 250k likes	Positive	trending la {Positive} la varamaley {XXX} varamaley k {XXX} 	1
ta_sent_1598	7hrs munnadiye 11M views vanthuttu ippavum 11M views kattuthu you tube karan yethum sathi panraano?	Positive	hrs munnadiye {XXX} munnadiye m {XXX} m views {Positive} views vanthuttu {XXX} vanthuttu ippavum {XXX} ippavum m {XXX} m views {Positive} views kattuthu {XXX} kattuthu you {XXX} you tube {not-Tamil} tube karan {XXX} karan yethum {XXX} yethum sathi {XXX} 	1
ta_sent_1599	Nalla irukku trailer Semmma dialog delivery Makkal Selva  Waiting for uu	Positive	nalla irukku {Positive} irukku trailer {Positive} trailer semmma {XXX} semmma dialog {XXX} dialog delivery {Positive} delivery makkal {XXX} makkal selva {Positive} selva waiting {XXX} waiting for {Positive} 	1
ta_sent_1600	Thalivaa thalivaa da aa style is unique to thalivaa	Positive	thalivaa thalivaa {XXX} thalivaa da {XXX} da aa {XXX} aa style {Positive} style is {Positive} is unique {Positive} unique to {XXX} 	1
ta_sent_1601	last bgm un azhaigil en idhayam than nilayail kathi song ah copy adichtan	Positive	last bgm {unknown_state} bgm un {XXX} un azhaigil {XXX} azhaigil en {XXX} en idhayam {Positive} idhayam than {Positive} than nilayail {XXX} nilayail kathi {XXX} kathi song {XXX} song ah {Negative} ah copy {Negative} 	1
ta_sent_1602	Super star ah eapdi kamikanumnu karthiku therinjurku vera legal thalaivar	Positive	super star {Positive} star ah {Positive} ah eapdi {XXX} eapdi kamikanumnu {XXX} kamikanumnu karthiku {XXX} karthiku therinjurku {XXX} therinjurku vera {XXX} vera legal {Mixed_feelings} 	1
ta_sent_1603	thala yuvan combo  dheena, poo ellam un vaasam , billa, billa2, aegan, arrambam, now nkp #ajith kumar	Positive	thala yuvan {Positive} yuvan combo {Positive} combo dheena {XXX} dheena poo {XXX} poo ellam {XXX} ellam un {XXX} un vaasam {XXX} vaasam billa {XXX} billa billa {XXX} billa aegan {XXX} aegan arrambam {XXX} arrambam now {XXX} now nkp {XXX} nkp ajith {XXX} 	1
ta_sent_1604	You kena tunggu lebih lama lagi untuk tahu saya Savadi	not-malayalam/tamil	you kena {not-Tamil} kena tunggu {not-Tamil} tunggu lebih {not-Tamil} lebih lama {not-Tamil} lama lagi {not-Tamil} lagi untuk {not-Tamil} untuk tahu {not-Tamil} tahu saya {not-Tamil} 	4
ta_sent_1605	Ethulayachum getup mathama erukkuraru athuthan konjam feel la erukku	Positive	ethulayachum getup {XXX} getup mathama {XXX} mathama erukkuraru {XXX} erukkuraru athuthan {XXX} athuthan konjam {XXX} konjam feel {XXX} feel la {Mixed_feelings} 	1
ta_sent_1606	CHiyaan Vikram fans hit like semmaya irukku	Positive	chiyaan vikram {Positive} vikram fans {Positive} fans hit {Positive} hit like {Positive} like semmaya {XXX} 	1
ta_sent_1607	Nalaiku parunga..... trailer evvalvo iruku...ana nallu Peru kelumpuvanga ..coke kudika solluranganu	Positive	nalaiku parunga {XXX} parunga trailer {XXX} trailer evvalvo {XXX} evvalvo irukuana {XXX} irukuana nallu {XXX} nallu peru {XXX} peru kelumpuvanga {XXX} kelumpuvanga coke {XXX} coke kudika {XXX} 	1
ta_sent_1608	India may peheli bar Hollywood jaisa usse bhi a66a kuch dekhne ko mila	Positive	india may {XXX} may peheli {XXX} peheli bar {XXX} bar hollywood {XXX} hollywood jaisa {XXX} jaisa usse {XXX} usse bhi {XXX} bhi aa {XXX} aa kuch {XXX} kuch dekhne {XXX} dekhne ko {XXX} 	1
ta_sent_1609	Yeh pink movie ki remake hai .	Positive	yeh pink {XXX} pink movie {Positive} movie ki {Positive} ki remake {Positive} 	1
ta_sent_1610	I didn't understand Tamil but talaiva movies da super.	Positive	i didnt {Negative} didnt understand {XXX} understand tamil {XXX} tamil but {Negative} but talaiva {XXX} talaiva movies {XXX} movies da {XXX} 	1
ta_sent_1611	Carthi Annaaaaaaa Trailer Semma Maaasssss Semmaaaaa Bro	Positive	carthi annaaaaaaa {XXX} annaaaaaaa trailer {XXX} trailer semma {Positive} semma maaasssss {XXX} maaasssss semmaaaaa {XXX} 	1
ta_sent_1612	Vera level is also not enough its unbelievable	Positive	vera level {Positive} level is {XXX} is also {XXX} also not {XXX} not enough {XXX} enough its {XXX} 	1
ta_sent_1613	Jithu Vs Kali ...Petta paarakk...Jithu fans hit like..	Positive	jithu vs {XXX} vs kali {XXX} kali petta {XXX} petta paarakkjithu {XXX} paarakkjithu fans {XXX} fans hit {Positive} 	1
ta_sent_1614	Wow! Back to Baasha mode..thalaivaaaa.petta paraakkkkk	Positive	wow back {XXX} back to {Positive} to baasha {XXX} baasha modethalaivaaaapetta {XXX} 	1
ta_sent_1615	Wish u to  Surya Anna fanse	Positive	wish u {XXX} u to {XXX} to surya {XXX} surya anna {Positive} 	1
ta_sent_1616	Thala and u1 Vera level	Positive	thala and {Positive} and u {XXX} u vera {Positive} 	1
ta_sent_1617	Rajni sir looking so handsome and young..	Positive	rajni sir {Positive} sir looking {Positive} looking so {Positive} so handsome {Positive} handsome and {Positive} 	1
ta_sent_1618	ARR kitta irunthu best music Shankar nala tha vaanga mudiyum	Positive	arr kitta {XXX} kitta irunthu {Positive} irunthu best {XXX} best music {Positive} music shankar {XXX} shankar nala {XXX} nala tha {XXX} tha vaanga {XXX} 	1
ta_sent_1619	Awesome trailor...rajini sir neenga taan sir eppavum stylish superstar...love u thalaiva...	Positive	awesome trailorrajini {XXX} trailorrajini sir {XXX} sir neenga {Positive} neenga taan {XXX} taan sir {XXX} sir eppavum {XXX} eppavum stylish {XXX} stylish superstarlove {XXX} superstarlove u {XXX} 	1
ta_sent_1620	Wishes from nadippin Nayagan suriya Anna fans	Positive	wishes from {Positive} from nadippin {Negative} nadippin nayagan {Positive} nayagan suriya {Negative} suriya anna {Positive} 	1
ta_sent_1621	Thalaivaaaaaaa i am waiting .....thaa yenna acting	Positive	thalaivaaaaaaa i {XXX} i am {Positive} am waiting {Positive} waiting thaa {XXX} thaa yenna {XXX} 	1
ta_sent_1622	Makkal Selvan fans Get ready daa......  🤙	Positive	makkal selvan {Positive} selvan fans {Positive} fans get {Positive} get ready {Positive} 	1
ta_sent_1623	Yo Karthik subburaj yaruya ne yaru Therigavittuda	Positive	yo karthik {XXX} karthik subburaj {Positive} subburaj yaruya {XXX} yaruya ne {XXX} ne yaru {XXX} 	1
ta_sent_1624	Nammakku tevayanadhu Namma Da adicchichi vanguna Dhanush	Positive	nammakku tevayanadhu {XXX} tevayanadhu namma {XXX} namma da {XXX} da adicchichi {XXX} adicchichi vanguna {XXX} 	1
ta_sent_1625	Thala vera level acting neriya neriya	Positive	thala vera {Positive} vera level {Positive} level acting {Positive} acting neriya {XXX} 	1
ta_sent_1626	SK powlichu Onnu parayanilla semma mass	Positive	sk powlichu {XXX} powlichu onnu {XXX} onnu parayanilla {XXX} parayanilla semma {XXX} 	1
ta_sent_1627	Thala  always gethu dha	Positive	thala always {Positive} always gethu {XXX} 	1
ta_sent_1628	thala vs pandey argument scene lam vera level la irukum nu ninaikiren 🤘🤘🤘	Positive	thala vs {Positive} vs pandey {Positive} pandey argument {XXX} argument scene {XXX} scene lam {Positive} lam vera {XXX} vera level {Positive} level la {Positive} la irukum {Positive} irukum nu {Positive} 	1
ta_sent_1629	Vera level trailer apppam 2.0 padam	Positive	vera level {Positive} level trailer {Positive} trailer apppam {XXX} 	1
ta_sent_1630	Vera lvl SK by Suriya Anna fans 🥰	Positive	vera lvl {Positive} lvl sk {XXX} sk by {XXX} by suriya {Positive} suriya anna {Positive} 	1
ta_sent_1631	Kolaaaaa maaasuuuu thalaivaaaaaa!!!! Chanceyyy illaaaa thalaivaaaaa!! Vera Vera veraaaaaaa !!!   🤘	Positive	kolaaaaa maaasuuuu {XXX} maaasuuuu thalaivaaaaaa {XXX} thalaivaaaaaa chanceyyy {XXX} chanceyyy illaaaa {XXX} illaaaa thalaivaaaaa {XXX} thalaivaaaaa vera {XXX} vera vera {Positive} 	1
ta_sent_1632	I am freeze.. feeling just wow!!!!!!!!!!	Positive	i am {Positive} am freeze {XXX} freeze feeling {XXX} feeling just {XXX} 	1
ta_sent_1633	Bigil like.. kaithi dislike my comment	Positive	bigil like {unknown_state} like kaithi {Negative} kaithi dislike {XXX} dislike my {XXX} 	1
ta_sent_1634	Sirapana tharamana sambavam paka waiting thalaiava....	Positive	sirapana tharamana {Positive} tharamana sambavam {Positive} sambavam paka {XXX} paka waiting {XXX} 	1
ta_sent_1635	Youtube pakkam vantha intha trailer oru time paathuttu poirathu	Positive	youtube pakkam {Positive} pakkam vantha {XXX} vantha intha {XXX} intha trailer {Positive} trailer oru {XXX} oru time {XXX} time paathuttu {XXX} 	1
ta_sent_1636	Suyama sindikka therinjavan thaan hero nu sollitu mask design ah aataiya pootingale boss	Positive	suyama sindikka {XXX} sindikka therinjavan {XXX} therinjavan thaan {XXX} thaan hero {XXX} hero nu {Negative} nu sollitu {Positive} sollitu mask {XXX} mask design {XXX} design ah {XXX} ah aataiya {XXX} aataiya pootingale {XXX} 	1
ta_sent_1637	Namazudin ko dikhaiya hi nhi.. Kia nam se kam chalte ho bhai...	Positive	namazudin ko {XXX} ko dikhaiya {XXX} dikhaiya hi {XXX} hi nhi {not-Tamil} nhi kia {XXX} kia nam {XXX} nam se {XXX} se kam {XXX} kam chalte {XXX} chalte ho {XXX} 	1
ta_sent_1638	Ellam Avan Seyal - version 2.0	Negative	ellam avan {Negative} avan seyal {Positive} 	0
ta_sent_1639	saakabothu sandapottu saganum that mean ethavathu nallathu senchittu saganum.. i like dialogue!	Positive	saakabothu sandapottu {XXX} sandapottu saganum {XXX} saganum that {XXX} that mean {XXX} mean ethavathu {XXX} ethavathu nallathu {XXX} nallathu senchittu {XXX} senchittu saganum {XXX} saganum i {XXX} i like {Positive} 	1
ta_sent_1640	Who is Diwali winner ?  Like - kaithi  Comment - Bigil	Positive	who is {Positive} is diwali {XXX} diwali winner {Positive} winner like {XXX} like kaithi {Negative} kaithi comment {Negative} 	1
ta_sent_1641	Dislike panavangalaukula nalla vairu earithu polaaa......aduthava vanzhtha ungaluku porukathe...ne va thalaivaaaa	Positive	dislike panavangalaukula {XXX} panavangalaukula nalla {XXX} nalla vairu {XXX} vairu earithu {XXX} earithu polaaaaduthava {XXX} polaaaaduthava vanzhtha {XXX} vanzhtha ungaluku {XXX} ungaluku porukathene {XXX} porukathene va {XXX} 	1
ta_sent_1642	Veli naat  la Vera bike keadikalaya Duke thana	Positive	veli naat {XXX} naat la {XXX} la vera {Positive} vera bike {Mixed_feelings} bike keadikalaya {XXX} keadikalaya duke {XXX} 	1
ta_sent_1643	Thalaiva semma mass 2.0 Sama super mass	Positive	thalaiva semma {Positive} semma mass {Positive} mass sama {XXX} sama super {XXX} 	1
ta_sent_1644	Ayyo Thalaiva  THA VEDIYA ONNU PODU THILLALE  Karthik subbaraj mass	Positive	ayyo thalaiva {Positive} thalaiva tha {XXX} tha vediya {XXX} vediya onnu {XXX} onnu podu {XXX} podu thillale {XXX} thillale karthik {XXX} karthik subbaraj {Positive} 	1
ta_sent_1645	Thala I love you mass ah eruku	Positive	thala i {Positive} i love {Positive} love you {Positive} you mass {XXX} mass ah {Positive} 	1
ta_sent_1646	Epo yaralaa trailer pathuttu erukinge like podunge	Positive	epo yaralaa {Positive} yaralaa trailer {Positive} trailer pathuttu {Positive} pathuttu erukinge {Positive} erukinge like {Positive} 	1
ta_sent_1647	Friends..1:07 la vara scene movie la epa varum..padam pathavanga sollunga yaravadhu	Positive	friends la {XXX} la vara {Positive} vara scene {XXX} scene movie {XXX} movie la {Positive} la epa {XXX} epa varumpadam {XXX} varumpadam pathavanga {XXX} pathavanga sollunga {XXX} 	1
ta_sent_1648	Simran Rajini romance scence innum addpaneerukkalam	Positive	simran rajini {XXX} rajini romance {XXX} romance scence {XXX} scence innum {XXX} 	1
ta_sent_1649	Thala vanga thala I am waiting	Positive	thala vanga {XXX} vanga thala {Mixed_feelings} thala i {Positive} i am {Positive} 	1
ta_sent_1650	Vantha mass,pona mass,ninna mass, patha  mass,pattum mass,r est f all actors please odirungaaaa........yenaa intha pongal engal masss	Positive	vantha masspona {XXX} masspona massninna {XXX} massninna mass {XXX} mass patha {XXX} patha masspattum {XXX} masspattum massr {XXX} massr est {XXX} est f {XXX} f all {XXX} all actors {Positive} actors please {XXX} please odirungaaaayenaa {XXX} odirungaaaayenaa intha {XXX} intha pongal {Positive} pongal engal {XXX} 	1
ta_sent_1651	Vijay fans ku double treat Diwali	Positive	vijay fans {Positive} fans ku {Positive} ku double {XXX} double treat {unknown_state} 	1
ta_sent_1652	Action king fans irukingla.... Hit Like	Positive	action king {Positive} king fans {Positive} fans irukingla {Positive} irukingla hit {XXX} 	1
ta_sent_1653	Semma PA.. But ennaku Indha costume LA pakkum bodhu.. POWER RANGER THAN NAYABAGAM VARUDHU	Positive	semma pa {XXX} pa but {XXX} but ennaku {XXX} ennaku indha {XXX} indha costume {XXX} costume la {XXX} la pakkum {Positive} pakkum bodhu {XXX} bodhu power {XXX} power ranger {Negative} ranger than {XXX} than nayabagam {XXX} 	1
ta_sent_1654	August 10 kaga yaru ellam wait panriga like pannuga	Positive	august kaga {XXX} kaga yaru {XXX} yaru ellam {Positive} ellam wait {XXX} wait panriga {Positive} panriga like {Positive} 	1
ta_sent_1655	Best Wishes From MAMMOOTTY FANS KERALA	Positive	best wishes {Positive} wishes from {Positive} from mammootty {Mixed_feelings} mammootty fans {Positive} 	1
ta_sent_1656	Mercury padam set mari iruku entry	Positive	mercury padam {XXX} padam set {Positive} set mari {Positive} mari iruku {Positive} 	1
ta_sent_1657	Dei remake panna enna? Ithu THALA version daww...enjoy...🤟🤟	Positive	dei remake {XXX} remake panna {Positive} panna enna {Positive} enna ithu {Positive} ithu thala {Positive} thala version {Positive} 	1
ta_sent_1658	semmmaaaa thalaivaaaa karthick sbburaj meratal waiting fot petta parak	Positive	semmmaaaa thalaivaaaa {XXX} thalaivaaaa karthick {XXX} karthick sbburaj {XXX} sbburaj meratal {XXX} meratal waiting {XXX} waiting fot {XXX} fot petta {XXX} 	1
ta_sent_1659	1 mil likes adingada ammai kunjuzz	Positive	mil likes {XXX} likes adingada {XXX} adingada ammai {XXX} 	1
ta_sent_1660	Karumam... Indha VFX'kaga thaan ivlo naal uruvittu irundhanungala?	Positive	karumam indha {XXX} indha vfxkaga {XXX} vfxkaga thaan {XXX} thaan ivlo {XXX} ivlo naal {Mixed_feelings} naal uruvittu {XXX} 	1
ta_sent_1661	2:19 - evanda dhanush udambula rajini face morph pannathu.....	Positive	evanda dhanush {XXX} dhanush udambula {XXX} udambula rajini {XXX} rajini face {XXX} face morph {XXX} 	1
ta_sent_1662	Padathukaga marna waiting. . Tralier pakka. Wauting for FDFS	Positive	padathukaga marna {XXX} marna waiting {Positive} waiting tralier {XXX} tralier pakka {XXX} pakka wauting {XXX} wauting for {XXX} 	1
ta_sent_1663	Padipa mattum  eduthuka  mudiyathu.....	Positive	padipa mattum {Positive} mattum eduthuka {XXX} 	1
ta_sent_1664	Pink movie bollywood remake I think so	Positive	pink movie {Positive} movie bollywood {XXX} bollywood remake {XXX} remake i {XXX} i think {Positive} 	1
ta_sent_1665	Thala mrg mutha unatha first pakura gud mrg	Positive	thala mrg {XXX} mrg mutha {XXX} mutha unatha {XXX} unatha first {XXX} first pakura {XXX} pakura gud {XXX} 	1
ta_sent_1666	43k haters enga da irundhu varinga	Positive	k haters {XXX} haters enga {XXX} enga da {Positive} da irundhu {XXX} 	1
ta_sent_1667	AIDSPATHY Visai pans Inga vanthu aluguranunga naalaikku school iruku poi thoongungada	Positive	aidspathy visai {XXX} visai pans {XXX} pans inga {XXX} inga vanthu {Negative} vanthu aluguranunga {XXX} aluguranunga naalaikku {XXX} naalaikku school {XXX} school iruku {XXX} iruku poi {XXX} 	1
ta_sent_1668	Innoru raw aana trailer after vada Chennai.. mass mass mass....	Positive	innoru raw {XXX} raw aana {XXX} aana trailer {XXX} trailer after {unknown_state} after vada {XXX} vada chennai {Negative} chennai mass {XXX} mass mass {Positive} 	1
ta_sent_1669	Thala ya pudikura thalapathy fans like podunga pa	Positive	thala ya {Positive} ya pudikura {XXX} pudikura thalapathy {XXX} thalapathy fans {Positive} fans like {Positive} like podunga {Positive} 	1
ta_sent_1670	intha diwali namma....panam ellam  padathukaa(Bigil & kaithi ) kaali aedum pola...	Positive	intha diwali {unknown_state} diwali nammapanam {XXX} nammapanam ellam {XXX} ellam padathukaabigil {XXX} padathukaabigil kaithi {XXX} kaithi kaali {XXX} kaali aedum {XXX} 	1
ta_sent_1671	Vera level  Thalaiva and master Shankar	Positive	vera level {Positive} level thalaiva {Positive} thalaiva and {Positive} and master {XXX} 	1
ta_sent_1672	Sivajiku appram intha petta padam than pakka commercial Iruka povathu	Positive	sivajiku appram {XXX} appram intha {XXX} intha petta {Positive} petta padam {Mixed_feelings} padam than {Positive} than pakka {Positive} pakka commercial {Positive} commercial iruka {XXX} 	1
ta_sent_1673	Neraya Neraya Neraya Neraya Fans Wait pandrom ''NER KONDAPARVAI'' kaga...	Positive	neraya neraya {Positive} neraya neraya {Positive} neraya neraya {Positive} neraya fans {XXX} fans wait {XXX} wait pandrom {XXX} pandrom ner {XXX} ner kondaparvai {XXX} 	1
ta_sent_1674	Aduchu underwwaroda oda vitruven...mass thalaivaa	Positive	aduchu underwwaroda {XXX} underwwaroda oda {XXX} oda vitruvenmass {XXX} 	1
ta_sent_1675	Dei intha soori innum intha comedyellam vidalayaada	Positive	dei intha {XXX} intha soori {XXX} soori innum {XXX} innum intha {Negative} intha comedyellam {XXX} 	1
ta_sent_1676	Devendhira da....Suma va yaru history ithu devadhiran...la	Positive	devendhira dasuma {XXX} dasuma va {XXX} va yaru {XXX} yaru history {XXX} history ithu {XXX} 	1
