id	text	category	newtext	label
ta_sent_2241	Real-time eppdi pakurathu likes and views ...	Positive	Positive Positive Positive Positive Positive Positive  	1
ta_sent_2242	BEST WISHES FROM THALAPATHY ANNA FANS FOR DHANUSH	Positive	Positive Positive Positive Positive Positive Positive Positive Positive 	1
ta_sent_2243	After long Rajini daa full energetic, full happy	Positive	Positive Positive Positive Positive Positive Positive Positive Positive 	1
ta_sent_2244	super star	Positive	Positive Positive 	1
ta_sent_2245	Kaithi must watch movie...worth enaa gripda movie	Positive	Positive Positive Positive movieworth Positive gripda Positive 	1
ta_sent_2246	@Dhanush Anna Vera Level uhhh @Manju Warriar #Phaaa  Vera Level	Positive	Positive Positive Positive Positive uhhh Positive warriar phaaa  Positive Positive 	1
ta_sent_2247	Meru Telugu vallaku Kuda paricham inaru sir	Positive	meru Positive vallaku Positive paricham inaru Positive 	1
ta_sent_2248	213 dislike idhuku enna korachal 🤷‍🤷‍🤷‍🤷‍🤷‍mass Kaidhi	Positive	 Positive Positive Positive korachal Mixed_feelings Positive 	1
ta_sent_2249	Thala all get up laium sema gethu dha....	Positive	1Positive Positive Positive Positive laium Positive Positive Positive 	1
ta_sent_2250	@ 01:35 Enna Bladerunner 1982 vaa...	Positive	  Positive bladerunner  Positive 	1
ta_sent_2251	Oruthavar mela viswasam kaatrathukaga inneruthavar mela yaan asingapaduthuringa	Positive	oruthavar Positive Positive Positive inneruthavar Positive Positive Positive 	1
ta_sent_2252	Trailer  Bgm vera level ... Padam pakkava irukapothu Diwalikulaa fdfs	Positive	Positive  Positive Positive Positive  Positive Positive irukapothu diwalikulaa Positive 	1
ta_sent_2253	Uthungada pongaluku viswasathuku SANGU. Petta Paraak	Positive	Positive Positive Mixed_feelings unknown_state Positive Positive 	1
ta_sent_2254	01:40 intha oru scene kaagave padam pakkanum......	Positive	 Positive Positive Positive Positive Positive Positive 	1
ta_sent_2255	Get rajinified..... Osm	Positive	Positive Positive Positive 	1
ta_sent_2256	Thala takkkkaer doiiii... Thala daaa..... Masss thala... Vera level thala.... Love u thala	Positive	1Positive takkkkaer doiiii 1Positive daaa masss 1Positive Positive Positive 1Positive Positive Positive 1Positive 	1
ta_sent_2257	Thala bloods speed pathalaaaaa make it fast....	Positive	1Positive Positive Positive pathalaaaaa Positive Positive Positive 	1
ta_sent_2258	No 1 Trending in Sri Lanka	Positive	Positive  Positive Positive Positive Positive 	1
ta_sent_2259	Hyhyhyhy sathiyama soldren adichi underwear oda vitruven manam pona varadhu pathuko	Positive	hyhyhyhy Positive Mixed_feelings Positive Positive Positive Positive Positive Positive Positive Negative 	1
ta_sent_2260	Ithula ak hero mariye theriyala yennaku     Bad dialogue wishvasam....	Positive	Positive Positive Positive Positive Positive Positive     Positive Positive wishvasam 	1
ta_sent_2261	Ellam avan seyal padam mathiri iruku	Negative	Positive Negative Negative Positive Positive Positive 	0
ta_sent_2262	Nee vaa thalaivaa ponggalukku naaga erukko	Positive	Positive Positive Positive ponggalukku Positive erukko 	1
ta_sent_2263	Nala thriller movie ah irkum polayae	Positive	Positive Positive Positive Positive Positive Negative 	1
ta_sent_2264	Trailer la kooda avlo effect therla  Padam paathadhuku apram	Positive	Positive Positive Positive Positive Positive Positive  Positive paathadhuku Positive 	1
ta_sent_2265	Eppudi pathalum Padam mokaya than irukum	Positive	Positive Positive Positive Positive Positive Positive 	1
ta_sent_2266	o my God  sk rocking trailer vara level	Positive	Positive Positive Positive  Positive Positive Positive Positive Positive 	1
ta_sent_2267	Enna macha trailor...ellaru mind blocks 🤘	Positive	Positive Positive trailorellaru Positive blocks  	1
ta_sent_2268	Vikram's voice is like a roaring lion	Positive	Positive Positive Positive Negative Positive roaring Positive 	1
ta_sent_2269	If u like trailer then like	Negative	Positive Positive Negative Positive Positive Negative 	0
ta_sent_2270	Fdfs paathathan pongal diwaliya irukka mudiyum	Positive	Positive paathathan Positive diwaliya Positive Positive 	1
ta_sent_2271	Thalaivar mass vera level thalaivar fans hit like	Positive	Positive Mixed_feelings Positive Positive Positive Positive Positive Negative 	1
ta_sent_2272	Thalaivaa  last dialogue hmm nee periya manushan yaa... Love u thala...	Positive	Positive  Positive Positive Positive Positive Positive Positive Positive Positive Positive 1Positive 	1
ta_sent_2273	Oh Arjun movie la tha sivakarthikeyen nadichurukara🤓	Positive	Positive Positive Positive Positive Positive Mixed_feelings Mixed_feelings 	1
ta_sent_2274	Mela vanthavan ta kekura Kela poi keluda Crt dialogue for vjs	Positive	Positive unknown_state Positive Positive kela Positive unknown_state Positive Positive Positive Positive 	1
ta_sent_2275	last 3days  trending no 1	Positive	Positive Positive  Positive Positive  	1
ta_sent_2276	yeserday no 2 treanding srilanka today no 5 #thala	Positive	yeserday Positive  treanding Positive Positive Positive  1Positive 	1
ta_sent_2277	Thala ipadi pathu avalo naal achu ....thala I love youuuu	Positive	1Positive Positive Positive Negative Positive Positive 1Positive Positive Positive youuuu 	1
ta_sent_2278	Habbadi tamil cinema la ipovadhu oru super hero movie vandhrukeeeee	Positive	habbadi Positive Positive Positive ipovadhu Positive Positive Positive Positive vandhrukeeeee 	1
ta_sent_2279	Ajith oru kelatu baadu da avanuku poolu kelambathu Ne poi kelapi vidu	Positive	Positive Positive Negative Positive Positive avanuku Negative kelambathu Positive Positive kelapi Positive 	1
ta_sent_2280	Views 56k  Likes 100k ya yenga yo idikkuthe	Positive	Positive Positive  Positive Positive Positive Positive Positive idikkuthe 	1
ta_sent_2281	Coming soon ah apa August 10 release ilaya	Positive	Positive Positive Positive Positive Positive  Positive Positive 	1
ta_sent_2282	Pliz Pliz Hindi dubbed movie sir	Positive	pliz pliz Positive not-Tamil Positive Positive 	1
ta_sent_2283	Thalaivaaaaa idhukku dha ivloo naall wait pannooooo	Positive	thalaivaaaaa Positive Positive ivloo naall Positive pannooooo 	1
ta_sent_2284	Repeat mode la pakuravaga like poduga	Positive	Positive Positive Positive pakuravaga Negative Positive 	1
ta_sent_2285	Palaya bhatsava partha mathiri irukku  awsome	Positive	Positive bhatsava Positive Positive Positive  Positive 	1
ta_sent_2286	Action king kaga padam pakka poren da...	Positive	Positive Positive Positive Positive Positive Positive Positive 	1
ta_sent_2287	Marana mass Onnum Panna mudiyathu style king is back.	Positive	Positive Mixed_feelings Positive Positive Positive Positive Positive Positive Positive 	1
ta_sent_2288	Asuran 4 time pathavanga like panuga nan 4 time pathudan	Positive	Positive  Positive Positive Negative Positive Positive  Positive pathudan 	1
ta_sent_2289	Karthi sir u r made  Thank u  Super star change illa semma style marna mass nadippu	Positive	Positive Positive Positive Positive Positive  Positive Positive  Positive Positive Positive Positive Positive Positive Positive Mixed_feelings Positive 	1
ta_sent_2290	Climax thala plus yuvan bgm trailer terikudu	Positive	Positive 1Positive Positive Positive Positive Positive Positive 	1
ta_sent_2291	Paa pakka 28 maari irukkaru paa thalivar	Positive	Positive Positive  Positive Positive Positive Positive 	1
ta_sent_2292	othaaaa ithu trailerrrr  paakkum pothe veriii aaguthuuuu	Positive	othaaaa Positive trailerrrr  Mixed_feelings pothe veriii aaguthuuuu 	1
ta_sent_2293	I'm from Bangalore thale na enaku uyiru avarodhu yedhu vandhalu enaku happy eruku yedhuku dha purile	Positive	Positive Positive unknown_state Positive Positive Positive uyiru avarodhu yedhu Positive Positive Positive Positive Positive Positive purile 	1
ta_sent_2294	Wow . indian  ! . i like it	Positive	Positive  Positive    Positive Negative Positive 	1
ta_sent_2295	Thala sema mass I love you.. Thala.....	Positive	1Positive Positive Mixed_feelings Positive Positive Positive 1Positive 	1
ta_sent_2296	Sam cs vera 11 music ya	Positive	Positive Positive Positive  Positive Positive 	1
ta_sent_2297	Movie vera level  pride of tamil cinema	Positive	Positive Positive Positive  Positive Positive Positive Positive 	1
ta_sent_2298	Ponunga ku mariyadai . Thalai ku visvasam . Life goals	Positive	ponunga Positive mariyadai  Positive Positive Positive  Positive goals 	1
ta_sent_2299	2:11 vayasana kalathule ethukku thalaiva theva ilata velai	Positive	 Positive Mixed_feelings unknown_state Positive Positive ilata Negative 	1
ta_sent_2300	THALA ya enakku evlo pidikkum theriyuma Neraya Neraya Neraya Neraya Neraya Neraya Neraya Neraya Neraya Neraya	Positive	1Positive Positive Positive Positive Positive theriyuma Positive Positive Positive Positive Positive Positive Positive Positive Positive Positive 	1
ta_sent_2301	Yeppa kumaru ....Diwlai mudinju 6 maasam aachu...Innuma thuppakiya thooki suthinu irukkara ??	Positive	Positive Positive diwlai Positive  Positive aachuinnuma thuppakiya Positive suthinu Positive  	1
ta_sent_2302	Soori erkapla vera lvl ah erkum pola 🤣	Positive	Mixed_feelings erkapla Positive Positive Positive erkum Positive  	1
ta_sent_2303	nkp movie fdfs ku Marana waiting la irukuravanga oru like podunga	Positive	Positive Positive Positive Positive Positive Positive Positive unknown_state Positive Negative Positive 	1
ta_sent_2304	reminds me spider man version 1	Positive	Positive Positive Positive Positive Positive  	1
ta_sent_2305	Rajini is All time Super star Rajini fans like hit here	Positive	Positive Positive Positive Positive Positive Positive Positive Positive Negative Positive Positive 	1
ta_sent_2306	Padippu Mattum nammakitte yirunthu edukkamidiyathu Big salute	Positive	Positive Positive nammakitte yirunthu edukkamidiyathu Positive Mixed_feelings 	1
ta_sent_2307	Diwali kaidhi dha.. Sema ya erukum padam thavari kooda bigil ku poga koodadhi	Positive	Positive Positive Positive Positive Positive Positive Positive thavari Positive Positive Positive Positive koodadhi 	1
ta_sent_2308	Kolai konda parvai thala thaladan	Positive	Positive Positive Positive 1Positive Positive 	1
ta_sent_2309	Thala darisanum, yenna charisma, yenna English, yenna alagzhu, lion voice.. thala blood thala veriyan from Bangalore	Positive	1Positive darisanum Positive Positive Positive Positive Positive alagzhu Positive Positive 1Positive Positive 1Positive Positive Positive unknown_state 	1
ta_sent_2310	AR u are just amazing... Music God	Positive	Positive Positive Positive Positive Positive Positive Positive 	1
ta_sent_2311	thala fans athana pernu pakara pls like and	Positive	1Positive Positive Positive pernu Negative Positive Negative Positive 	1
ta_sent_2312	Vikram is like fine wine gets better as he ages	Positive	Positive Positive Negative fine wine Positive Positive Positive Positive ages 	1
ta_sent_2313	Ennamo Avengers endgame ku aparam vijay sethupathi ah vae pudikala...	Positive	Positive Positive Positive Positive Positive Positive Positive Positive vae Positive 	1
ta_sent_2314	Ippadi Nareya ,Nareya , Nareya Nareya....semma	Positive	Positive nareya nareya  nareya nareyasemma 	1
ta_sent_2315	Hollywood ya no tiene nada de. Creatividad	Positive	Positive Positive Positive tiene nada not-Tamil creatividad 	1
ta_sent_2316	250k likes to go.....Yaralam waiting 🥰	Positive	Positive Positive Positive goyaralam Positive  	1
ta_sent_2317	Dei Nala padam da, ithula epadi da fight varum?	Positive	Positive Positive Positive Positive Positive Positive Positive Positive Positive 	1
ta_sent_2318	If in malayalam version '' ippo enna panna porom??? Lesham kanji edukatte....	Positive	Positive Positive Negative Positive  Positive Positive Positive Positive lesham kanji edukatte 	1
ta_sent_2319	Lov Thiz Hero  To	Positive	Positive thiz Positive  Positive 	1
ta_sent_2320	Thalaivar  tharumaru peta parrak ena energy trailer  pothum  engaluku podra vediyyaaaa	Positive	Positive  Positive Positive Positive Positive Positive Positive  Positive  Positive Positive vediyyaaaa 	1
ta_sent_2321	old man better sleep at home puiiiiii	Positive	Positive Positive Positive sleep Positive Mixed_feelings puiiiiii 	1
ta_sent_2322	Pink movie in malayalam  Superb movie	Positive	Positive Positive Positive Negative  Positive Positive 	1
ta_sent_2323	Iam From Maars. Thala Mass       Like Picha Podungale nu Oru GANG VARUM PAARUNGALE	Positive	Positive Positive maars 1Positive Mixed_feelings       Negative Positive podungale Positive Positive Positive Positive paarungale 	1
ta_sent_2324	Rajini sir... You rock..keka... . Love from Andhra	Positive	Positive Positive Positive rockkeka  Positive Positive Positive 	1
ta_sent_2325	truly Vera level da thala     neraiya neraiya neraiya neraiya  waiting for NKP & Kaappaan	Positive	truly Positive Positive Positive 1Positive     Positive Positive Positive Positive  Positive Positive Positive  Positive 	1
ta_sent_2326	Kaithi Pathen vera level Marana masssssssss	Positive	Positive Positive Positive Positive Positive masssssssss 	1
ta_sent_2327	" Enna Sam cs  "" joker"" inspire  panniruppa pola .."	Positive	 Positive Positive Positive   Positive inspire  panniruppa Positive  	1
ta_sent_2328	Intha naa2la neraya ponnunga kitta 1st keka vendiya kelvi  Are you vrigin	Positive	Positive Positive Positive ponnunga Positive Positive Positive Positive Positive  Positive Positive vrigin 	1
ta_sent_2329	All ammai kunji fans ku oru  ooooo podu....🤟	Positive	Positive not-Tamil Negative Positive Positive Positive  ooooo Positive 	1
ta_sent_2330	India ka best industry Koliwod	Positive	Positive Positive Positive Positive koliwod 	1
ta_sent_2331	ರಾಜಕುಮಾರ ಅವರ ನಂತರ ಇಷ್ಟ ಪಡೊ ನಾಯಕನಟ ರಜನಿಕಾಂತ ಅವರು. ಅವರ ನೃತ್ಯ , ಮಾತು, ನಡೆ, ನುಡಿ ಎಲ್ಲಾ ಅದ್ಭುತ.	Positive	                	1
ta_sent_2332	Kadaya pathe anunu thonravanga pink movie parunga	Positive	kadaya Positive anunu thonravanga Positive Positive Positive 	1
ta_sent_2333	Thalaivaa sema mass...Waiting 2 see asuran in screen	Positive	Positive Positive masswaiting  Positive Positive Positive Positive 	1
ta_sent_2334	Viswasam teaser Ku aprm yarllam inga vanteenga?	Positive	Positive Positive Positive Positive yarllam Positive vanteenga 	1
ta_sent_2335	Entha oru publicityum illama oru trailer ku Ivlo likes vanga thalaiyala mattum than mudiyum	Positive	Positive Positive publicityum Positive Positive Positive Positive Positive Positive Positive thalaiyala Positive Positive Positive 	1
ta_sent_2336	KK na KK na yaare...? King of Kollywood	Positive	Positive Positive Positive Positive yaare Positive Positive Positive 	1
ta_sent_2337	Sumo trailer (siva) -like Hero trailer (Sivakarthikeyan) -comment  Agila ulaga super star fans...	Positive	sumo Positive Positive Negative Positive Positive Positive Positive  Negative Positive Positive Positive Positive 	1
ta_sent_2338	Akshay Kumar ku Tamil voice yaaruya koduthathu?	Positive	Positive Positive Positive Positive Positive yaaruya koduthathu 	1
ta_sent_2339	Thalaiya vera angle laa kaana porom	Positive	Positive Positive Positive Positive Positive Positive 	1
ta_sent_2340	Dipavali vettri nayagan Thala fanzz full support for kaithi	Positive	dipavali Positive Positive 1Positive Positive Positive Positive Positive Positive 	1
ta_sent_2341	I'm waiting for sanga tamilan movie	Positive	Positive Positive Positive Positive Positive Positive 	1
ta_sent_2342	thalaivaaa ungala maari vere yaarum kedayath.. neengale puranth vantha thaan und.. rajni veriyan from kerala	Positive	thalaivaaa Positive Positive Positive Positive unknown_state Positive puranth Positive Positive Positive Positive Positive Positive Positive 	1
ta_sent_2343	Kaidhi won in DIWALI RACE BIGIL AH ADICHI ODAVITTACHU PA	Positive	Positive Positive Positive Positive unknown_state Positive Positive Positive odavittachu Positive 	1
ta_sent_2344	Last gun sound in headphone ku ku	Positive	Positive Positive unknown_state Positive headphone Positive Positive 	1
ta_sent_2345	Thala the king - తలా అజిత్ కింగ్.	Positive	1Positive Positive Positive     	1
ta_sent_2346	Haters ida neega unlike pandringa thalaivara Sona Madre unga oda vida poguraru petta marana masss	Positive	Positive Mixed_feelings Positive Positive Positive Positive Positive madre Positive Positive Positive poguraru Positive Positive masss 	1
ta_sent_2347	Kon Log Besabri Say Is Movie Ka intezaar kr rhay hain???	not-malayalam/tamil	not-Tamil not-Tamil besabri Positive Positive Positive Positive intezaar not-Tamil rhay not-Tamil 	4
ta_sent_2348	Intha musica engayo ketta Maari irukkey	Positive	Positive unknown_state Positive Positive Positive Negative 	1
ta_sent_2349	Entha padathuku hero Arjun na illa sk va ( trailer la full a Arjun than hero role matiri iruku)	Positive	Positive Positive Positive Positive Positive Positive Positive Positive  Positive Positive Positive Positive Positive Positive Positive Positive Positive Positive 	1
ta_sent_2350	Kannana kanney lyrics video	Positive	kannana kanney Positive Positive 	1
ta_sent_2351	Thala look maranam  Yuvan bgm	Positive	1Positive Positive Positive  Positive Positive 	1
ta_sent_2352	pakka thaana pora intha kaali yoda aatatha marana mass thalaiva	Positive	Positive Positive Positive Positive Positive Positive Positive Positive Mixed_feelings Positive 	1
ta_sent_2353	Rajini sir ku oru paiyan irundurndha nalla irundurku rendume mutta ponunge	Positive	Positive Positive Positive Positive Positive irundurndha Positive irundurku Positive Negative ponunge 	1
ta_sent_2354	Aathiii trailer eh epdi na... padam epdiyo	Positive	aathiii Positive Positive Positive Positive Positive Negative 	1
ta_sent_2355	trailer  super rajini cinema mass ,dont plitical	Positive	Positive  Positive Positive Positive Mixed_feelings Positive plitical 	1
ta_sent_2356	0.58 to 1.16 Super Lover Boy Rajini..........	Positive	 Positive  Positive unknown_state Negative Positive 	1
ta_sent_2357	A R Rahman + Shankar	Positive	Positive Positive Positive  Positive 	1
ta_sent_2358	Thalaivar verithanam acting  Vera level padam paakka yaaru wait pannrenga	Positive	Positive Positive Positive  Positive Positive Positive Positive Positive Positive pannrenga 	1
ta_sent_2359	BGM  KING  U1	Positive	Positive  Positive  Positive 	1
ta_sent_2360	Vijay sethupathi ulla vandhu pottu pottunu podra scene 1.31 Maranama iruku	Positive	Positive Positive Positive Positive Positive pottunu Positive Positive  Positive Positive 	1
ta_sent_2361	All the best vikram sir I am from karantaka D boss fans	Positive	Positive Positive Positive Positive Positive Positive Positive Positive Positive Positive Positive Positive 	1
ta_sent_2362	Thala -60 or thalapathy-64 apo pakkalam da ..	Positive	1Positive  Positive Positive Positive Positive Positive  	1
ta_sent_2363	THALA na summa va THALA da	Positive	1Positive Positive Positive Positive 1Positive Positive 	1
ta_sent_2364	Waiting for visvasam tesar   thalivar trilar semma	Positive	Positive Positive Positive Positive   Positive Positive Positive 	1
ta_sent_2365	Change petta trailer thumbnail talaivra closeupla kaameenga	Positive	Positive Positive Positive unknown_state talaivra closeupla kaameenga 	1
ta_sent_2366	Comment more n more n more more more guys	Positive	Positive Positive Positive Positive Positive Positive Positive Positive Positive 	1
ta_sent_2367	Idhuku dislike pota naainga ratham kakki saavuvanunga....	Negative	Positive Positive Positive Positive Negative Negative saavuvanunga 	0
ta_sent_2368	Th@liv@r and $ethup@thi ver@@... level p@.....	Positive	thlivr Positive ethupthi ver Positive Positive 	1
ta_sent_2369	Hit like 3M ...Thala Mass	Positive	Positive Negative Positive 1Positive Mixed_feelings 	1
ta_sent_2370	Yaaru da anda dislike panna	Positive	Positive Positive Positive Positive Positive 	1
ta_sent_2371	Chiyaan  semma   Love from kerala	Positive	Positive  Positive   Positive Positive Positive 	1
ta_sent_2372	Ommala national award ready panni vaingada	Positive	Positive Positive Positive Positive Positive Positive 	1
ta_sent_2373	Thalapathi fan la oru like pooduga	Positive	Positive Positive Positive Positive Negative pooduga 	1
ta_sent_2374	: Enda Comment ah  Padikka vanthiyaa   : Scoll Pandravane Keluda	Positive	 Positive Positive Positive  Negative vanthiyaa    scoll pandravane unknown_state 	1
ta_sent_2375	90's parithabam: Mela irundhu kudhicha sakthi maan kapathuvaru	Positive	Positive parithabam Positive Positive Positive Positive Positive kapathuvaru 	1
ta_sent_2376	Thala Bloods daily Atleast 10 times aavathu paarunga views romba kamiyaa irukku.	Positive	1Positive Positive Positive Positive  Positive Positive Positive Positive Positive kamiyaa Positive 	1
ta_sent_2377	BIGIL DIWALI.....VERITHANAM.....ONE ND ONLY THALAPATHY........(aamais paavam kirukku kuu mathrii trool pannitu irukkinga)	Positive	Positive diwaliverithanamone Positive Positive thalapathyaamais Positive kirukku kuu mathrii trool Positive Positive 	1
ta_sent_2378	Semma super trailer.. Trailere ipidy na flim epidy irukkum	Positive	Positive Positive Positive Positive ipidy Positive Positive epidy Positive 	1
ta_sent_2379	Kaithi Vs Bigil  Diwali  treat	Positive	Positive Positive Positive  Positive  Positive 	1
ta_sent_2380	Thala da.....  Vera Evan da.....	Positive	1Positive Positive  Positive Positive Positive 	1
ta_sent_2381	2nd time kandittu vannathe ullu	not-malayalam/tamil	Positive Positive kandittu vannathe not-Tamil 	4
ta_sent_2382	Thala nee vaa thala Marana waiting far nkp movieku	Positive	1Positive Positive Positive 1Positive Positive Positive Positive Positive Positive 	1
ta_sent_2383	Ithulaye ipdi irukke 3D la epdi irukkum just think guys	Positive	ithulaye Positive Positive Positive Positive Positive Positive Positive Positive Positive 	1
ta_sent_2384	#1on trending Sri lanka THALA ultimate	Positive	Positive Positive Positive Positive 1Positive Positive 	1
ta_sent_2385	Apdi ellam nadakkakudathu say ia thala its right.............	Positive	Positive Positive nadakkakudathu Positive ia 1Positive Positive Positive 	1
ta_sent_2386	Siva is bigger star than Akshay Kumar	Positive	Positive Positive bigger Positive Positive Positive Positive 	1
ta_sent_2387	Arjun fans hit  @#🤵 u1	Positive	Positive Positive Positive   Positive 	1
ta_sent_2388	Telugu super star funs like here	Positive	Positive Positive Positive funs Negative Positive 	1
ta_sent_2389	Pink movie remake Nice movie nice trailer	Positive	Positive Positive Positive Positive Positive Positive Positive 	1
ta_sent_2390	Hero trailer > Avengers end game	Positive	Positive Positive  Positive Positive Negative 	1
ta_sent_2391	70k like and 70k views	Positive	Positive Negative Positive Positive Positive 	1
ta_sent_2392	Aiyoio en thalaivaaaa vera level neenga love youuuuuuuuuuuuuuuuuu	Positive	aiyoio Positive thalaivaaaa Positive Positive Positive Positive youuuuuuuuuuuuuuuuuu 	1
ta_sent_2393	Comments ah 26k pa vera lvl	Positive	Positive Positive Positive Positive Positive Positive 	1
ta_sent_2394	Epdi thala Ella getup layum smart irukinga	Positive	Positive 1Positive Positive Positive Positive Positive Positive 	1
ta_sent_2395	i m big fan of BIG b..	Positive	Positive Positive Positive Positive Positive Positive Positive 	1
ta_sent_2396	Mass elements Ella ma oru nalla stroy	Mixed_feelings	Mixed_feelings Mixed_feelings Positive Positive Positive Positive stroy 	3
ta_sent_2397	Thala vera leval  Marana Masss	Positive	1Positive Positive Positive  Positive masss 	1
ta_sent_2398	It company niyabakam vantha vanga like podunga...	Positive	Positive Positive niyabakam Positive Positive Negative Positive 	1
ta_sent_2399	En aayul mudiyum varai naa unga fan mattum than thalaivaaaa i love you thalaivaaaaa enakku 22age than	Positive	Positive aayul Positive Positive Positive Positive Positive Positive Positive thalaivaaaa Positive Positive Positive thalaivaaaaa Positive Positive Positive 	1
ta_sent_2400	hero triller verithanama eruku pa sk veriyan	Positive	Positive triller Positive Positive Positive Positive Positive 	1
ta_sent_2401	Super star fans hit like here	Positive	Positive Positive Positive Positive Negative Positive 	1
ta_sent_2402	Nama 2018 la erukkoma....Ella 1990 la erukkomannu theriyala....thalaivar is back...........	Positive	Positive  Positive erukkomaella  Positive erukkomannu theriyalathalaivar Positive Positive 	1
ta_sent_2403	Vera level trailer..... Thalaivaaaaaaa waiting	Positive	Positive Positive Positive thalaivaaaaaaa Positive 	1
ta_sent_2404	Thala marana look yuvan BGM ultimate	Positive	1Positive Positive Positive Positive Positive Positive 	1
ta_sent_2405	Sarkar Teaser likes ah beat pana mudilayeda... Ama payale🤣🤣🤣🤣  Iththu ponavane	Positive	Positive Positive Positive Positive Positive Positive mudilayeda Positive Negative  iththu ponavane 	1
ta_sent_2406	I love u THALIVA..... From kerala.. Waiting for marana MaSs pEtta....	Positive	Positive Positive Positive Positive Positive Positive Positive Positive Positive Mixed_feelings Positive 	1
ta_sent_2407	Oruthangaluku viswasam katrathukaga en enoruthara asinga  paduthureeenga... Thala vera level mass	Positive	oruthangaluku Positive Positive Positive enoruthara Positive  paduthureeenga 1Positive Positive Positive Mixed_feelings 	1
ta_sent_2408	Thalafans make it fast likes 24hrs la 1.1m varanum...	Positive	Positive Positive Positive Positive Positive Positive Positive Positive Positive 	1
ta_sent_2409	Padippa mattum namma kitta irunthu eduthukitave mudiyathu...... super thalaiva semma dialogue	Positive	Positive Positive Positive Positive Positive eduthukitave Positive Positive Positive Positive Positive 	1
ta_sent_2410	RAJINI NA Endrum super star ni kalaku thalavaaaa	Positive	Positive Positive Positive Positive Positive Positive kalaku thalavaaaa 	1
ta_sent_2411	Thalayoda ner konda paarvai semma masss	Positive	Positive Positive Positive Positive Positive masss 	1
