id	text	category	newtext	label
ta_sent_801	Sivakarthikeyana vida Action king than neraiya edathula vararu	Positive	sivakarthikeyana Positive Positive Positive Positive Positive Negative Positive 	1
ta_sent_802	Hope it is not Rekka 2	Positive	Positive Positive Positive Positive Mixed_feelings  	1
ta_sent_803	PETA super film Kali Ida vata thudagi aaa aaa peeta	Positive	Positive Positive Positive Positive Mixed_feelings vata thudagi aaa aaa Positive 	1
ta_sent_804	Namaku thevaiyanatha namma than adichu vanganum(asuran)........ Namala kapathiga nama pandrathu rowdisum na rowdisum pannuvom(vada chennai)	Positive	Positive Positive Positive Positive Positive vanganumasuran Positive kapathiga Positive Positive rowdisum Positive rowdisum pannuvomvada Positive 	1
ta_sent_805	movie block buster hit aagum	Positive	Positive Positive Positive Positive Positive 	1
ta_sent_806	AMAZING    RAJINI ANTEY RAJINI EY DAAW   WAITING FOR MOVIE	Positive	Positive    Positive antey Positive Negative Negative   Positive Positive Positive 	1
ta_sent_807	ennaya  ithu, Evla time paathalum salikkave matinguthu, 100 time ku Mela pathasu trailer ha, Thalaivar maasss tha eppavume	Positive	Positive  Positive evla Positive Positive Negative Positive  Positive Positive Positive pathasu Positive Positive Positive maasss Positive Positive 	1
ta_sent_808	Krish1 2 mugamuthi daiii apdiya iruki	Positive	Positive  mugamuthi daiii Positive unknown_state 	1
ta_sent_809	Ovvaru sternum, thalaivaa unakaluggu Niger neengathaan,i love u thalivaa	Positive	ovvaru sternum Positive unakaluggu niger neengathaani Positive Positive Positive 	1
ta_sent_810	You kena tunggu Lebih lama lagi untuk tahu Saya!!!	not-malayalam/tamil	Positive not-Tamil not-Tamil not-Tamil not-Tamil not-Tamil not-Tamil not-Tamil not-Tamil 	4
ta_sent_811	Thala last punch true true true ....	Positive	1Positive Positive Positive Positive Positive Positive  	1
ta_sent_812	Shivaaaaaaaa marana waiting, kadharalls la kannudukkadhinga nama munnukka poitte irukkanum	Positive	shivaaaaaaaa Positive Positive kadharalls Positive kannudukkadhinga Positive munnukka poitte Positive 	1
ta_sent_813	Otha padam vera level ah irukum pola .thala mass	Positive	Positive Positive Positive Positive Positive Positive Positive 1Positive Mixed_feelings 	1
ta_sent_814	good message movie awesome AJITH SIR	Positive	Positive Positive Positive Positive Positive Positive 	1
ta_sent_815	Movie patutu vanthu patavanga la like podunga	Positive	Positive patutu Positive Positive Positive Negative Positive 	1
ta_sent_816	Epdi mela vandhanu mela vandhavana dhaan da keka mudiyum! Enada dialog idhu chaiii	Positive	Positive Positive vandhanu Positive vandhavana Positive Positive Positive Positive Positive Positive Positive chaiii 	1
ta_sent_817	Thala pola varuma neengatha thala mass	Positive	1Positive Positive Positive Positive 1Positive Mixed_feelings 	1
ta_sent_818	As usual vijay fans started disliking the trailer.   Avangala thavira yaarum munnera koodathunu ninaikiranga	Positive	Positive Positive Positive Positive Positive disliking Positive Positive   Mixed_feelings Positive Positive munnera Positive ninaikiranga 	1
ta_sent_819	Rajinikanth vera level wating to watching	Positive	Positive Positive Positive Positive Positive Positive 	1
ta_sent_820	Mujha àcha nai laga trailer bakwaas hai akshay Kumar acting is best	not-malayalam/tamil	mujha Positive not-Tamil not-Tamil Positive bakwaas not-Tamil Positive Positive Positive Positive Positive 	4
ta_sent_821	Rajani sir's akshay gi fans put ur like here	Positive	Positive Positive Positive not-Tamil Positive unknown_state Positive Negative Positive 	1
ta_sent_822	Yena aga pore sakthiman ..periya ooollll	Negative	Positive Negative Negative Positive Positive ooollll 	0
ta_sent_823	Hit like if 2.0 breaks bahubali's record,if no hit dislike	Positive	Positive Negative Positive  breaks bahubalis recordif Positive Positive Positive 	1
ta_sent_824	Gotha epo dhan da bigil trailer viduvinga	Positive	Negative Positive Positive Positive Positive Positive Positive 	1
ta_sent_825	Kisne 2 bhar dekha yeh trailer	not-malayalam/tamil	kisne  bhar not-Tamil not-Tamil Positive 	4
ta_sent_826	Kola kandla iruken mavane kollama vida maten what a punch!	Positive	Positive kandla Positive Positive Positive Positive Positive Positive Positive Positive 	1
ta_sent_827	G***mala thala tucker doi!!!! Film blockbuster!!	Positive	gmala 1Positive Positive Positive Positive Positive 	1
ta_sent_828	thala level .. pink ..	Positive	1Positive Positive  Positive  	1
ta_sent_829	No. 1 trending wow.... Thala takkaru doii	Positive	Positive  Positive Positive 1Positive Positive Positive 	1
ta_sent_830	Yaarellam Vadachennai movie alavuku asuran illanu feel panreenga	Positive	Positive Positive Positive Positive Positive Negative Positive Positive 	1
ta_sent_831	Saavatha iruntha sanda poottu saavanu sir Payanthu kaala vilunthu saava koodathu	Positive	saavatha Positive Positive poottu unknown_state Positive Positive Positive Positive Positive Positive 	1
ta_sent_832	T H A L A	Positive	Positive Positive Positive Positive Positive 	1
ta_sent_833	ksubaraj ovoru scenayum katha vitruvaru polaye oh my god	Positive	ksubaraj Positive scenayum Positive vitruvaru Positive Positive Positive Positive 	1
ta_sent_834	Saavanumna santta pottu savanum   Aduthavan kalla pudichu savakudathu   semma  dilogue	Positive	saavanumna santta Positive Positive   Positive Positive unknown_state savakudathu   Positive  Positive 	1
ta_sent_835	Lokesh Kanna ennada panni vachi iruka, semaya iruku po. Unnala onnum panna mudiyathu apdiye poite iru	Positive	Positive Positive Positive Positive Negative Positive Positive Positive Positive Mixed_feelings Positive Positive Positive Positive poite Positive 	1
ta_sent_836	Marana mass ah iruku palaya thalaivar vandhutaru Jan 10 la paakalam kaliyode atathe Côóĺ	Positive	Positive Mixed_feelings Positive Positive Positive Positive vandhutaru Positive  Positive Positive Positive atathe Positive 	1
ta_sent_837	no 1 trending in Malaysia Thalanation	Positive	Positive  Positive Positive Positive thalanation 	1
ta_sent_838	Last 30 sec second scene na pathu..mirandu ponavanga hit like...enaku apdiye odambellam silirthu poiduchi	Positive	Positive  Positive Positive Positive Positive pathumirandu unknown_state Positive likeenaku Positive odambellam silirthu Positive 	1
ta_sent_839	dai ayaz ,kutty munju anada edhaelam solavae ella.	Positive	Positive Positive Positive munju anada edhaelam solavae Positive 	1
ta_sent_840	Kola veri da. Jan 10	Positive	Positive Positive Positive Positive  	1
ta_sent_841	Thalaivaaaa Vera Level   full Masssssssss	Positive	thalaivaaaa Positive Positive   Positive masssssssss 	1
ta_sent_842	Ranjith thevdiya payale neyellam ennada padam edutha...	Positive	Positive thevdiya Negative neyellam Positive Positive Positive 	1
ta_sent_843	the last dance in vetti satte super!	Positive	Positive Positive Positive Positive Positive satte Positive 	1
ta_sent_844	Dhanush action sema anaa itha padam kathyei sathi aatipadiyana movie vanmurai thutum	Positive	Positive Positive Positive Positive Positive Positive kathyei Mixed_feelings aatipadiyana Positive vanmurai thutum 	1
ta_sent_845	all rajini fans must give hit like.	Positive	Positive Positive Positive Positive Positive Positive Negative 	1
ta_sent_846	Last dialogue suit for all fans	Positive	Positive Positive Positive Positive Positive Positive 	1
ta_sent_847	Vikaram and thala only seen like hollywood  stars...	Positive	Positive Positive 1Positive Positive Positive Negative Positive  Positive 	1
ta_sent_848	Sema  iam  thala fan	Positive	Positive  Positive  1Positive Positive 	1
ta_sent_849	Ennada youtube 467 k le nikkudu	Positive	Positive Positive  Positive Positive nikkudu 	1
ta_sent_850	Not a suitable movie for vjs	Positive	Positive Positive Positive Positive Positive Positive 	1
ta_sent_851	I'm from Karnataka big fan of thala	Positive	Positive Positive Positive Positive Positive Positive 1Positive 	1
ta_sent_852	Rajnikanth fuck Hindi bitch aksey kumar	Positive	Positive Positive Positive bitch aksey Positive 	1
ta_sent_853	2.0 lam papa vilayattu ithu Super one Rajnified🤩	Positive	 Positive unknown_state Positive Positive Positive Positive Positive 	1
ta_sent_854	Thalaivar ku munnadi vera ethum illa. Always Petta rocks. Namaku eppavum namma thalaivar than. Eagerly waiting to Petta.	Positive	Positive Positive Positive Positive Negative Positive Positive Positive Positive Positive Positive Positive Positive Positive Positive Positive Positive Positive 	1
ta_sent_855	Rajinikanth gaaru mi gurinchi Entha matladina thakkuve	not-malayalam/tamil	Positive not-Tamil mi gurinchi Positive matladina thakkuve 	4
ta_sent_856	Mugamoodiku moonu ticket irukku.. variya...	Positive	mugamoodiku Positive Positive Positive variya 	1
ta_sent_857	Padam pathuttu yarellam trailer pakka vanthinga	Positive	Positive Positive Positive Positive Positive Positive 	1
ta_sent_858	Thalaivar'ku vayasaiduchinu yaru sonnathu trailer paru summa thala suththuthula	Negative	Negative vayasaiduchinu Positive Negative Positive Negative Positive 1Positive suththuthula 	0
ta_sent_859	Thalapathy fans sarpaga padam blockbuster aaga valthukal	Positive	Positive Positive Positive Positive Positive Positive Positive 	1
ta_sent_860	Movie ah Diwali ku release panna nalla irrukum	Positive	Positive Positive Positive Positive Positive Positive Positive Negative 	1
ta_sent_861	Waittingg... 🤩 karthi fans kerala  മലയാളികൾ ഇല്ലേ	Positive	waittingg  Positive Positive Positive    	1
ta_sent_862	ee padam vijayikkum ennu urappullavar like	Negative	not-Tamil Positive vijayikkum Positive urappullavar Negative 	0
ta_sent_863	Innaikki night show poravanga like podu	Positive	innaikki Positive Positive Positive Negative Positive 	1
ta_sent_864	Thalaivara 90s patha mari erukka?  Athan Super star	Positive	Positive Positive Positive Positive erukka  Positive Positive Positive 	1
ta_sent_865	Super Star fans hit liks.... Vera Level....	Positive	Positive Positive Positive Positive Positive Positive Positive 	1
ta_sent_866	Namma thala Ku epdi semaya music poduringa Yuvan eppudi	Positive	Positive 1Positive Positive Positive Positive Positive Positive Positive Positive 	1
ta_sent_867	Mass illa marana mass and double mass	Mixed_feelings	Mixed_feelings Positive Positive Mixed_feelings Positive unknown_state Mixed_feelings 	3
ta_sent_868	Trailer mattum Tha varuthu Padam varuma????	Positive	Positive Positive Positive Positive Positive Positive 	1
ta_sent_869	sarkar thalapathy fans hit like...	Positive	Positive Positive Positive Positive Negative 	1
ta_sent_870	Thala bloods hit a like	Positive	1Positive Positive Positive Positive Negative 	1
ta_sent_871	Enna da ithu athukkulla 2.5M  views🤔🤔🤔🤔🤔	Positive	Positive Positive Positive athukkulla Positive  Positive 	1
ta_sent_872	Teejay anna va nadika vachathuku thanks vetri maaran sir	Positive	Positive Positive Positive Positive vachathuku Positive Positive Positive Positive 	1
ta_sent_873	Dhaaasu trailer!!! Seen above 100 time	Positive	dhaaasu Positive Positive Positive  Positive 	1
ta_sent_874	I Love Rajini sir sema style ya	Positive	Positive Positive Positive Positive Positive Positive Positive 	1
ta_sent_875	81k views and 82 likes sema masss	Positive	Positive Positive Positive  Positive Positive masss 	1
ta_sent_876	Tamil Se Jyade Hindi Wale Log Trailer Dekh Rhe Hai	not-malayalam/tamil	Positive not-Tamil jyade Positive not-Tamil not-Tamil Positive not-Tamil rhe not-Tamil 	4
ta_sent_877	Bigil teaser ku Aparam Marupadium Kaithi trailor Paka vantha anga Ethana peru?? Kaithi	Positive	Positive Positive Positive Positive Positive Positive Positive Positive Positive Positive Positive Positive Positive 	1
ta_sent_878	Vidiya vidiya THALA ya paaka poravan mattum oru like ah podu	Positive	Positive Positive 1Positive Positive Positive Positive Positive Positive Negative Positive Positive 	1
ta_sent_879	Pettai parak Super.Super Thaliva.Thankyou Karthisuburaj&Rajini. Dinesh.	Positive	Positive Positive supersuper thalivathankyou karthisuburajrajini dinesh 	1
ta_sent_880	anushkayo.....nayanso..thamannayo..illel navya nairo meera jasmino illayo..enthinaa	Positive	anushkayonayansothamannayoillel navya nairo Positive jasmino illayoenthinaa 	1
ta_sent_881	Thala veetla irundhu nera camera munnadi vadhu nipparu pola!  Makeup avathu mannavadhu!   Ever Handsome	Positive	1Positive Positive Positive Positive Positive Positive Negative Positive Positive  Positive Positive Negative   Positive Positive 	1
ta_sent_882	Marano mass u marano adhuku thalaivarudha porandhu varanum petta pongal mass pongal	Positive	Positive Mixed_feelings Positive Positive Positive thalaivarudha Positive Positive Positive Positive Mixed_feelings Positive 	1
ta_sent_883	Can i get 2k like for vikram sir	Positive	Positive Positive Positive Positive Negative Positive Positive Positive 	1
ta_sent_884	Dhanush thalaivarrrr veraaaa level asuran waiting for theee scrennn thalaivaaaaaaa    Dhanush veriyan daaaa naaaa	Positive	Positive thalaivarrrr veraaaa Positive Positive Positive Positive theee scrennn thalaivaaaaaaa    Positive Positive daaaa naaaa 	1
ta_sent_885	Yarellam Padam paathutu vandhu trailer ah notice panninga?	Positive	Positive Positive Positive Positive Positive Positive Positive unknown_state 	1
ta_sent_886	Like = sivakarthikeyan  Comment = vin Disel	Positive	Negative  Positive  Positive  Positive disel 	1
ta_sent_887	I'm very very very happy	Positive	Positive Positive Positive Positive Positive 	1
ta_sent_888	800k+ likes & 72k+ Comments	Positive	Positive Positive  Positive Positive 	1
ta_sent_889	Rahman sir, Shankar sir and 2.0 Team marvelous	Positive	Positive Positive Positive Positive Positive  Positive marvelous 	1
ta_sent_890	Non - stop ah pakure . Thala	Positive	Positive  Positive Positive pakure  1Positive 	1
ta_sent_891	Tamilan Super Hero thaan adunala thaan Indialaye thamarai valarama parthukittoem.	Positive	Positive Positive Positive Positive adunala Positive indialaye thamarai valarama parthukittoem 	1
ta_sent_892	Vigay pans still shouting....pink remake daw daw daw...🤣🤣🤣🤣🤣🤣	Positive	Negative Mixed_feelings Positive shoutingpink Positive Positive Positive Positive 	1
ta_sent_893	Come on guy's need 1million likes	Positive	Positive Positive Positive Positive Positive Positive 	1
ta_sent_894	Idhula Hindi enga irunthuda varudhu???  Producer BJP Polaye... Apo panchayathu than..	Positive	Positive Positive Positive irunthuda Positive  Negative bjp Positive Positive panchayathu Positive 	1
ta_sent_895	Vara vara gibran bgm la kalakkuran	Positive	Positive Positive Positive Positive Positive kalakkuran 	1
ta_sent_896	Thalaivaaaaaa illaya super star Dhansush anna	Positive	thalaivaaaaaa Positive Positive Positive dhansush Positive 	1
ta_sent_897	Diwali release 2.0 vs sarkaar like	Positive	Positive Positive  Positive sarkaar Negative 	1
ta_sent_898	Karthi Subbaraj tq for bring our style samrat back.....	Positive	Positive Positive Mixed_feelings Positive Positive Positive Positive Positive Positive 	1
ta_sent_899	Only Thala veriyan mattum like  Marana masss Thala        Thala veriyan Nadish	Positive	Positive 1Positive Positive Positive Negative  Positive masss 1Positive        1Positive Positive nadish 	1
ta_sent_900	Vera vera vera level la iruku trailer	Positive	Positive Positive Positive Positive Positive Positive Positive 	1
ta_sent_901	Thala I love you soooooooooooooooooo much	Positive	1Positive Positive Positive Positive soooooooooooooooooo Positive 	1
ta_sent_902	Kola Gandu iruken...Kol lama vida matten....--	Positive	Positive Positive irukenkol not-Tamil Positive Positive 	1
ta_sent_903	EAGERLY WAITING FOR YUVAN'S MAGICAL MUSIC	Positive	Positive Positive Positive yuvans Positive Positive 	1
ta_sent_904	Rajini star keka I am form Telangana  am a big fan of Thaliva	Positive	Positive Positive Positive Positive Positive Positive Positive  Positive Positive Positive Positive Positive Positive 	1
ta_sent_905	Pondati pula sentiment iruntha odi poidu -Thalaivar to Viswasamm	Positive	Negative Negative Positive Positive Positive Positive Positive Positive viswasamm 	1
ta_sent_906	Oruthar mela visvasatha kaatradhukaga inoruthara yen asinga paduthuringa!!!!	Positive	Positive Positive Positive Positive Positive Positive Positive Positive 	1
ta_sent_907	Enka anna chiyan vikram the king maker	Positive	Mixed_feelings Positive Positive Positive Positive Positive Positive 	1
ta_sent_908	Again and again  watching	Positive	Positive Positive Positive  Positive 	1
ta_sent_909	Kerala Thala Ajith Fan A big Fan	Positive	Positive 1Positive Positive Positive Positive Positive Positive 	1
ta_sent_910	Make up konjam kooda illa but semma mass vj anna	Positive	Positive Positive Positive Positive Positive Positive Positive Mixed_feelings Positive Positive 	1
ta_sent_911	Bros aana viswasam thoda edhu kami yana likes and views tha na bros	Positive	unknown_state Positive Positive Positive Positive Negative Positive Positive Positive Positive Positive Positive unknown_state 	1
ta_sent_912	Trailer semma  I am Thalapathy veriyan	Positive	Positive Positive  Positive Positive Positive Positive 	1
ta_sent_913	Vjs anna ungala adichika aal eh ila always neenga tha	Positive	Positive Positive Positive Positive unknown_state Positive Positive Positive Positive Positive 	1
ta_sent_914	Hollywood trailer parthi maari iruku....vera level	Positive	Positive Positive Mixed_feelings Positive irukuvera Positive 	1
ta_sent_915	Illa apdi la nadakathu ...nadakavum kudathu	Positive	Positive Positive Positive Positive Positive Positive 	1
ta_sent_916	Prasanth maamey ungala pada m trailer vanthuduchiiii	Positive	prasanth maamey Positive Positive Positive Positive vanthuduchiiii 	1
ta_sent_917	Verraaaaaaaaaaaaaaaaaa levellllll ughhh annaaaa..... Waiting for mass success	Positive	verraaaaaaaaaaaaaaaaaa levellllll ughhh annaaaa Positive Positive Mixed_feelings Positive 	1
ta_sent_918	intha voice a kettale ore kaduppahudhu	Positive	Positive Positive Positive kettale Positive kaduppahudhu 	1
ta_sent_919	Ellam avan seyal movie maari irukum pola	Positive	Positive Negative Negative Positive Positive Positive Positive 	1
ta_sent_920	Mr.Vandu courtla ipdi laam Kattha kudathu	Positive	mrvandu Positive Positive Positive Negative Positive 	1
ta_sent_921	Trailer ellam nalla than irukku aana padam eppidiyo	Positive	Positive Positive Positive Positive Positive Positive Positive eppidiyo 	1
ta_sent_922	Viswasam 17m view 3days ..petta 17m views 7 days....	Positive	Positive Positive Positive Positive Positive Positive Positive  Positive 	1
ta_sent_923	0.20 to 0.40 it looks like Vada Chennai's jail carrom board sketchu scene	Negative	 Positive  Positive Positive Negative Negative chennais unknown_state carrom Positive sketchu Positive 	0
ta_sent_924	Surya fans eppovume ajith sir ku support thann aana etho oru Black sheep  Thala ya kalaikkaranga.............	Positive	Positive Positive Positive Positive Positive Positive Positive Positive Positive Positive Positive Positive Positive  1Positive Positive kalaikkaranga 	1
ta_sent_925	Mugamoodi part 2 .....parkara madhri iruku....	Positive	Positive Positive  parkara Negative Positive 	1
ta_sent_926	Wow.. Vera level .. Thalaivaa	Positive	Positive Positive Positive  Positive 	1
ta_sent_927	Ippdi naray naraya naraya intha speech semma masssssss thala neega	Positive	Positive Positive Positive Positive Positive Positive Positive masssssss 1Positive Positive 	1
ta_sent_928	Moviku wait pantra vanga like poodunga	Positive	moviku Positive Positive Positive Negative Positive 	1
ta_sent_929	Super intha varusam thalapathy Sarkar & Thalaivar 2.0 vera levela irukka poguthu	Positive	Positive Positive Positive Positive Positive  Positive  Positive Positive Positive Positive 	1
ta_sent_930	inum 2 days kulla 1million like varananum pangukala	Positive	Positive  Positive Positive Positive Negative varananum pangukala 	1
ta_sent_931	I am Seeing....seeing....and seeing more than 100 times...Who else here like me...	Positive	Positive Positive seeingseeingand Positive Positive Positive  timeswho Positive Positive Negative Positive 	1
ta_sent_932	Ayyyo thalaivaaaaaa.... Padam vera level  ....... Asurathanama sutharan ... Oru oru scene vandhutu vandhutu podhu	Positive	ayyyo thalaivaaaaaa Positive Positive Positive   asurathanama sutharan  Positive Positive Positive Negative Negative Positive 	1
ta_sent_933	Thala fans laam , Podraa like  aaa.....	Positive	1Positive Positive Positive  podraa Negative  aaa 	1
ta_sent_934	Ajith sir ..u r just fabulous..love u sir	Positive	Positive Positive Positive Positive Positive fabulouslove Positive Positive 	1
ta_sent_935	Pspk,Rajini sir and Vijay,VJS fan's Like Here??	Positive	pspkrajini Positive Positive vijayvjs Positive Negative Positive 	1
ta_sent_936	Movie again pakkanum pola eruku Cha epa pappeno waiting......	Positive	Positive Positive Positive Positive Positive Positive Positive pappeno Positive 	1
ta_sent_937	ithu ye YouTube trending la kaata maatuthu. . 2.0 kum varala .. can any 1 explain	Positive	Positive Positive Positive Positive Positive Positive maatuthu   Positive Positive  Positive Positive  Positive 	1
ta_sent_938	Onnu maattum nalla theridhu  Asuran ninnu pesa podhu.... vetrimaran + dhanush = vetridhan.. ..	Positive	Positive maattum Positive Positive  Positive Positive Negative Positive Positive  Positive  vetridhan  	1
ta_sent_939	Vikram speak malay...you kena tunggu lebih lama lagi untuk tahu saya..	not-malayalam/tamil	Positive Positive malayyou not-Tamil not-Tamil not-Tamil not-Tamil not-Tamil not-Tamil not-Tamil not-Tamil 	4
ta_sent_940	petta Pongal nu solravanga la hit like	Positive	Positive Positive Positive Positive Positive Positive Negative 	1
ta_sent_941	Thalaivaaaaaaaaaaa   Alludhu style.u...Maassss......   Vaera evanavadhu irundhaa Apadiyae vodi poiduu..   Rajinified	Negative	thalaivaaaaaaaaaaa   Positive styleumaassss   Positive Negative Positive Positive Negative Negative   Positive 	0
ta_sent_942	Thala& Yuvan again kola mass	Positive	1Positive Positive Positive Positive Mixed_feelings 	1
ta_sent_943	Wednesday kula 70k cmt varanum 800k likes varanum....   Thala fans...	Positive	wednesday Positive Positive Positive Positive Positive Positive Positive   1Positive Positive 	1
ta_sent_944	Vera level Chiyaan Vikram sir superb	Positive	Positive Positive Positive Positive Positive Positive 	1
ta_sent_945	Chiyaan in k. K mass mass mass mass mass mass mass mass mass  chiyaan veriyan suthamalli chiyaan boys	Mixed_feelings	Positive Positive Positive Positive Mixed_feelings Mixed_feelings Mixed_feelings Mixed_feelings Mixed_feelings Mixed_feelings Mixed_feelings Mixed_feelings Mixed_feelings  Positive Positive suthamalli Positive Positive 	3
ta_sent_946	PANNI MOONJU VAAYAN KABALI KUNJITH... WASTE...	Positive	Positive moonju vaayan Positive kunjith Positive 	1
ta_sent_947	U kena tunggu lebih lama lagi, untuk tahu saya!!!  Damn, Chiyaan Vikram speaking Malay....  WAITING DAA SAAMY...	not-malayalam/tamil	Positive not-Tamil not-Tamil not-Tamil not-Tamil not-Tamil not-Tamil not-Tamil not-Tamil  Positive Positive Positive Negative Positive  Positive Positive Positive 	4
ta_sent_948	Age is not a matter for vikram	Positive	Positive Positive Positive Positive matter Positive Positive 	1
ta_sent_949	Dhanush fans comment  Sk fans like	Positive	Positive Positive Positive  Positive Positive Negative 	1
ta_sent_950	Superb movie!!! Vikram looks Mass!!! Well made movie ..no lag...	Positive	Positive Positive Positive Positive Mixed_feelings Positive Positive Positive Positive not-Tamil 	1
ta_sent_951	Epovama vanmuraiya matum padam edukringa. Yen ipdi mr.vetrimaran...	Positive	epovama Negative Positive Positive Mixed_feelings Positive Positive mrvetrimaran 	1
ta_sent_952	AJITH:Oruthar mela neenga viswasam kaatradhukaga innoruthara yen asinga paduthuringa MASS DIALOGUE	Positive	ajithoruthar Positive Positive Positive Positive Positive Positive Positive Positive Mixed_feelings Positive 	1
ta_sent_953	Bgm enam wrk pani ekanum vm	Positive	Positive enam Mixed_feelings Positive ekanum Negative 	1
ta_sent_954	Trailer la pagal time ee kanom?	not-malayalam/tamil	Positive Positive not-Tamil Positive not-Tamil Positive 	4
ta_sent_955	Thalaaaaaaaaaaaaaaaaaaaaaaaaaaaaa Dharisanammmm da. Thala da vera Evan daaaa 🤝🤙	Positive	thalaaaaaaaaaaaaaaaaaaaaaaaaaaaaa dharisanammmm Positive 1Positive Positive Positive Positive daaaa  	1
ta_sent_956	kelatu tayoli ajith dislike poten da	Positive	Negative tayoli Positive Positive Positive Positive 	1
ta_sent_957	Last dialogue  epo ellam may epd than jalra taturaga	Positive	Positive Positive  Positive Positive Positive unknown_state Positive Negative taturaga 	1
ta_sent_958	Thalaivaaa nee Vera level adhukkum Mela	Positive	thalaivaaa Positive Positive Positive adhukkum Positive 	1
ta_sent_959	Thala Da Eppavuma mass Da	Positive	1Positive Positive eppavuma Mixed_feelings Positive 	1
ta_sent_960	Indha pongal ku thalaivar kudukara treat adhan petta sweet	Positive	Positive Positive Positive Positive kudukara Positive Positive Positive Positive 	1
ta_sent_961	Intha madri padam edukama enthiran kunthiran nu thalaivara kevala paduthuranunga padam na ithu thalaivar padam	Positive	Positive Positive Positive edukama Positive kunthiran Positive Positive Positive paduthuranunga Positive Positive Positive Positive Positive 	1
ta_sent_962	Rajini the maass.. worst music da Anirudh.. Vera level la iruknanum super star Ku lam	Positive	Positive Positive Positive Positive Positive Positive Positive Positive Positive Positive iruknanum Positive Positive Positive Positive 	1
ta_sent_963	Trailer oda kadaisi dialogue, Kola mass	Positive	Positive Positive Positive Positive Positive Mixed_feelings 	1
ta_sent_964	I love you Vikram sir semma	Positive	Positive Positive Positive Positive Positive Positive 	1
