text	category	text	category
innu november 21 e divasamavan ethra kathirunnu inni december 12nu kannam	unknown_state	innu november 21 e divasamavan ethra kathirunnu inni december 12nu kannam	unknown_state
ikka da makale set traler nxt hit for ikka 4 ina row now	Positive	ikka da makale set traler nxt hit for ikka 4 ina row now	Positive
ente ponnoo marakam iyyoo goosebumps kathirippinte kolamass trailer poli kidu kidolokidilan	Positive	ente ponnoo marakam iyyoo goosebumps kathirippinte kolamass trailer poli kidu kidolokidilan	Positive
ithinum dislike adikkunnavar enth kanditta enne ariyilla	Negative	ithinum dislike adikkunnavar enth kanditta enne ariyilla	Negative
earangunnathinu munb dislike adich moonjikkaan koreu ennam earangiyittund	Negative	earangunnathinu munb dislike adich moonjikkaan koreu ennam earangiyittund	Negative
malayala sinimayile ore oru rajav ikka muthan	Positive	malayala sinimayile ore oru rajav ikka muthan	Positive
all the best lalettan team	Positive	all the best lalettan team	not-malayalam
late ayappo excitment koodyavar like adi	unknown_state	late ayappo excitment koodyavar like adi	unknown_state
adipoli trailer waiting madura raja	Positive	adipoli trailer waiting madura raja	Positive
ettan fans ibdee common	Positive	ettan fans ibdee common	unknown_state
trailer kidukki by a lalettan fan	Positive	trailer kidukki by a lalettan fan	Positive
madhura raja yil madhuramaya rani sunny chechi ne kaanaan katta waiting cheyyuntavar undo	Positive	madhura raja yil madhuramaya rani sunny chechi ne kaanaan katta waiting cheyyuntavar undo	unknown_state
ettanta aniyanmarude vaka all the best ikka oru rakshayumilla	Positive	ettanta aniyanmarude vaka all the best ikka oru rakshayumilla	Positive
idakkidakk vannu romaanjam kollunnavar like adi	unknown_state	idakkidakk vannu romaanjam kollunnavar like adi	Positive
omg megaa mass ikkaa outstanding ikkaa and the bgm rocking	Positive	omg megaa mass ikkaa outstanding ikkaa and the bgm rocking	not-malayalam
ente raju etten mwthanne rajuvattente aa voice mathi pinne onnum venda	Positive	ente raju etten mwthanne rajuvattente aa voice mathi pinne onnum venda	Positive
car enu eragi nadakunath kandapol bilal ena orma vanath enik matharam anoo	unknown_state	car enu eragi nadakunath kandapol bilal ena orma vanath enik matharam anoo	unknown_state
lalettan ayalum mammookka ayalum oru pole support cheyyuka snehikuka verukendath sankikale mathram	Positive	lalettan ayalum mammookka ayalum oru pole support cheyyuka snehikuka verukendath sankikale mathram	Positive
katta waitingg lalettaa luv u so much	Positive	katta waitingg lalettaa luv u so much	Positive
ayyo 11 vare wte cheyyanamalloo	unknown_state	ayyo 11 vare wte cheyyanamalloo	Negative
madhraraja ith ikkem ikkade pillerum pwolichadakkum	Positive	madhraraja ith ikkem ikkade pillerum pwolichadakkum	Positive
fanbasil maathram movei kaanunnoraavum dislike cheythu negative aakkunne avarkkente naduviral pranamam	Negative	fanbasil maathram movei kaanunnoraavum dislike cheythu negative aakkunne avarkkente naduviral pranamam	Negative
powlichu lalettan and rajuvettaa thudangalle tcr vedikkettu	Positive	powlichu lalettan and rajuvettaa thudangalle tcr vedikkettu	Positive
tamils always like mammooty as like lalettan	unknown_state	tamils always like mammooty as like lalettan	not-malayalam
entammoo lalettaann fan here hnmm ithu pani aano	Positive	entammoo lalettaann fan here hnmm ithu pani aano	unknown_state
onkv ood neeralii kandam vazhii ikka marana mass	Positive	onkv ood neeralii kandam vazhii ikka marana mass	Negative
enii adeyude ideyude veddi purraam appo pakalla 12 theatrl uff	Positive	enii adeyude ideyude veddi purraam appo pakalla 12 theatrl uff	Positive
teaser kandu pradeekshayokke poyatharnu	Positive	teaser kandu pradeekshayokke poyatharnu	Positive
prakash raj ullatu kondu chelappo hit aavum	unknown_state	prakash raj ullatu kondu chelappo hit aavum	Mixed_feelings
a like like to sorry to god y _	not-malayalam	a like like to sorry to god y _	not-malayalam
promo kand kili poya le njaan	unknown_state	promo kand kili poya le njaan	unknown_state
njan mathram aanoo comments vaayikkan viindum trailer edukkunnee	Positive	njan mathram aanoo comments vaayikkan viindum trailer edukkunnee	unknown_state
6 30 muthal kaathirikkukayaayirunnu 1st comment idaanulla bhagyam ee onam pwolikkum	Positive	6 30 muthal kaathirikkukayaayirunnu 1st comment idaanulla bhagyam ee onam pwolikkum	Positive
ettan fens undo undel edh pever aayi	unknown_state	ettan fens undo undel edh pever aayi	unknown_state
sunny and ekka fans like here	unknown_state	sunny and ekka fans like here	not-malayalam
53 55 sec repeat aduchu kandavar evde like	unknown_state	53 55 sec repeat aduchu kandavar evde like	unknown_state
abinayan ithihaasam nammude mammooka yude katta fans likkikoo	unknown_state	abinayan ithihaasam nammude mammooka yude katta fans likkikoo	unknown_state
ithokke dislike adikkunavare kale vari adikkanam	Negative	ithokke dislike adikkunavare kale vari adikkanam	Negative
10m aayonnu idaykk nokkan varunnavarkku ivide like adikkam	unknown_state	10m aayonnu idaykk nokkan varunnavarkku ivide like adikkam	Positive
arokke 0 21 bigil first look kando	Positive	arokke 0 21 bigil first look kando	unknown_state
prayam koodundorum soundaryam koodunna ore oraal mammookka	Positive	prayam koodundorum soundaryam koodunna ore oraal mammookka	Positive
cinima kando kidu	Positive	cinima kando kidu	Positive
dislike adikuna olikal ellam odd kadam vazhi	Negative	dislike adikuna olikal ellam odd kadam vazhi	Negative
thaliyvaa ikkaa vara level pwolichu	Positive	thaliyvaa ikkaa vara level pwolichu	Positive
spr ikkaa	Positive	spr ikkaa	Positive
idhinde teasern verum 50k like ullu	unknown_state	idhinde teasern verum 50k like ullu	unknown_state
1 07 iyalde kaalu vetiyathalle 1st partlu	unknown_state	1 07 iyalde kaalu vetiyathalle 1st partlu	unknown_state
koode nilkkunnavark chunk kodukkum pullu giri	Positive	koode nilkkunnavark chunk kodukkum pullu giri	Positive
model schoolil padicha lalettan ille ee cinemayil	unknown_state	model schoolil padicha lalettan ille ee cinemayil	unknown_state
4 million views lalettan power	unknown_state	4 million views lalettan power	not-malayalam
best wishes team abrahaminte santhathikal	Positive	best wishes team abrahaminte santhathikal	Positive
sorry to say odukkathe kali aakathirunna mathiyayrunnu	Positive	sorry to say odukkathe kali aakathirunna mathiyayrunnu	Mixed_feelings
urumi valum adhu pande mammukeke paranjedha	unknown_state	urumi valum adhu pande mammukeke paranjedha	unknown_state
kanji edukam samayam aayiee come on guys	Positive	kanji edukam samayam aayiee come on guys	unknown_state
enthanavo manju warier kanumbol oru deshyam	Negative	enthanavo manju warier kanumbol oru deshyam	Negative
innale 9 30n kandu 154k aayrunnu views now	unknown_state	innale 9 30n kandu 154k aayrunnu views now	unknown_state
mastar peace um idupolokke thanneyanu makkale	unknown_state	mastar peace um idupolokke thanneyanu makkale	unknown_state
22k dislike vannenkil urapicho arkokkeyo kuru pottiyitund padam sure hit	Negative	22k dislike vannenkil urapicho arkokkeyo kuru pottiyitund padam sure hit	Negative
10 30 kollathe charithram ariyaan aayi katta waiting cheyyunavar keri like adikkada makkale	Positive	10 30 kollathe charithram ariyaan aayi katta waiting cheyyunavar keri like adikkada makkale	Positive
onnil kooduthal trailer kandavar undengi ibide comeon	unknown_state	onnil kooduthal trailer kandavar undengi ibide comeon	Positive
ente ponnoo nammude sontham ichaka mamookkaa umma cinima kanan kothiyakunnu	Positive	ente ponnoo nammude sontham ichaka mamookkaa umma cinima kanan kothiyakunnu	Positive
padam flop aavm enna kaaryathil oru doubtum illa	Positive	padam flop aavm enna kaaryathil oru doubtum illa	Negative
ella ikka fan kand nokku	Positive	ella ikka fan kand nokku	unknown_state
mammuka massan parayunavar like cheyyuga	unknown_state	mammuka massan parayunavar like cheyyuga	unknown_state
no words pwolikkum waiting by dq fan	Positive	no words pwolikkum waiting by dq fan	Positive
love from utter pradesh mohan sir	not-malayalam	love from utter pradesh mohan sir	not-malayalam
lalettante adutha pottapadam laletta ithokke mathiyakkan aayinnu please	Positive	lalettante adutha pottapadam laletta ithokke mathiyakkan aayinnu please	Negative
nty amoo kunjalimarakaar 9 alla oru pulikutti ayirunu lal sir nigal samsarikubool chiri varunu	Negative	nty amoo kunjalimarakaar 9 alla oru pulikutti ayirunu lal sir nigal samsarikubool chiri varunu	Negative
ith baghamathy moviede kadhapolund anushka unnimukundan movie	Positive	ith baghamathy moviede kadhapolund anushka unnimukundan movie	Mixed_feelings
ikka fans come and like lalettans fans comment	unknown_state	ikka fans come and like lalettans fans comment	unknown_state
super ra iruku by tamil nadu str fans	not-malayalam	super ra iruku by tamil nadu str fans	not-malayalam
charitra cinema aano nayakan mamooka allae vere aarundundu abhinayikkan	Positive	charitra cinema aano nayakan mamooka allae vere aarundundu abhinayikkan	Positive
31 miniute lucifer 200k views 2 hour madhura raja 80k views	not-malayalam	31 miniute lucifer 200k views 2 hour madhura raja 80k views	not-malayalam
1 35 iruttath oru kallan	unknown_state	1 35 iruttath oru kallan	unknown_state
ith kelkumbo kilichundan mambazam orma verunnu	Mixed_feelings	ith kelkumbo kilichundan mambazam orma verunnu	Mixed_feelings
ithu kalakkum adi makkale like ee rajayude pillar strong kaanich kodukk	unknown_state	ithu kalakkum adi makkale like ee rajayude pillar strong kaanich kodukk	unknown_state
17k dislike mamunnifans kurupotty rajuvettan oru prasthanam aanu	Positive	17k dislike mamunnifans kurupotty rajuvettan oru prasthanam aanu	Negative
lalettan fan aya entea ella ashamasakalum	Positive	lalettan fan aya entea ella ashamasakalum	unknown_state
pandam kandathinju shesham vanavar ethra perund pwli padam uff	Positive	pandam kandathinju shesham vanavar ethra perund pwli padam uff	Positive
comadey aguum realse aytuu paryaam	Mixed_feelings	comadey aguum realse aytuu paryaam	Mixed_feelings
vere level trailer pwoli bgm katta mass	Positive	vere level trailer pwoli bgm katta mass	Positive
all the best ettan fansinte vaka ikkaykhe	Positive	all the best ettan fansinte vaka ikkaykhe	Positive
100 kodi clubil kayariyathinu shesham arokke vannu	Positive	100 kodi clubil kayariyathinu shesham arokke vannu	Positive
ithu simple aicp anu cpim hero dvp anu bjp villain tovino varum dvp kare urutti kollum climax aicp election jayikkum	unknown_state	ithu simple aicp anu cpim hero dvp anu bjp villain tovino varum dvp kare urutti kollum climax aicp election jayikkum	unknown_state
oru kaaryam manasilaayee paandi rajayum 30 crore nedillaa	Positive	oru kaaryam manasilaayee paandi rajayum 30 crore nedillaa	Negative
ikkake katta support aa mamakam hit thane akum	Positive	ikkake katta support aa mamakam hit thane akum	Positive
vere aarkund makkale ee prayathil ingane mass kaanikunne oru hero	Positive	vere aarkund makkale ee prayathil ingane mass kaanikunne oru hero	Positive
levelaa	Positive	levelaa	Positive
mamookkakk abhinayam ariyilla enn paranjal adhyam chirikkunnavar ivide like	unknown_state	mamookkakk abhinayam ariyilla enn paranjal adhyam chirikkunnavar ivide like	unknown_state
madhura rajaye adichu potta kinattil itta stefen neduballi hajar hoom	unknown_state	madhura rajaye adichu potta kinattil itta stefen neduballi hajar hoom	unknown_state
love from a diehard lalettan fan	Positive	love from a diehard lalettan fan	not-malayalam
mamaangam valiya hit akatte lalettan and thalapathy vijay fansinte ellavidha supportum undavum	Positive	mamaangam valiya hit akatte lalettan and thalapathy vijay fansinte ellavidha supportum undavum	Positive
100 crores madhura raja or lucifer comment please	unknown_state	100 crores madhura raja or lucifer comment please	not-malayalam
onam lalettan eduthu ennu parayan paranju	Positive	onam lalettan eduthu ennu parayan paranju	Positive
romancham ennokke paranja koranji pogum athukkum mele	Positive	romancham ennokke paranja koranji pogum athukkum mele	Positive
dislike adikkan vendi mathram vannirikunnavanmar orupad undalloo sahikanindavula kazhuverikalk	Negative	dislike adikkan vendi mathram vannirikunnavanmar orupad undalloo sahikanindavula kazhuverikalk	Negative
ayo last aa stund yente ponnu ikka	Positive	ayo last aa stund yente ponnu ikka	Positive
super movie aanu but jai ne kollandayirunny	Positive	super movie aanu but jai ne kollandayirunny	Mixed_feelings
mamooka enn uyir enn anbu enn singamda enn muth mani 300crore adikum	Positive	mamooka enn uyir enn anbu enn singamda enn muth mani 300crore adikum	Positive
trailer okke kollam pakshe evideyokkeyo pulimurukan keri varunnu ennu enik mathramano thonniyath	Positive	trailer okke kollam pakshe evideyokkeyo pulimurukan keri varunnu ennu enik mathramano thonniyath	Mixed_feelings
katta ikka fan s okke onnu like adichu pokke	Positive	katta ikka fan s okke onnu like adichu pokke	unknown_state
padam vijayikkum s s combination with robot	Positive	padam vijayikkum s s combination with robot	Positive
movie suppar hit akum like here	unknown_state	movie suppar hit akum like here	unknown_state
one day 10 lakhs viewers 78k like	not-malayalam	one day 10 lakhs viewers 78k like	not-malayalam
enik matram ahno jishnu ragahvne pole nadane thoniayth rip	unknown_state	enik matram ahno jishnu ragahvne pole nadane thoniayth rip	unknown_state
newer comment kanan vannavar like chey	unknown_state	newer comment kanan vannavar like chey	unknown_state
kochi karan aya kunjali engane ee bhasha padichu avo	unknown_state	kochi karan aya kunjali engane ee bhasha padichu avo	unknown_state
maryathakku oru trailer polym irakaan arillaayy	Positive	maryathakku oru trailer polym irakaan arillaayy	Negative
heavy	Positive	heavy	Positive
raja yude power kanichu kodukkande	unknown_state	raja yude power kanichu kodukkande	unknown_state
mass ennu paranja otta vakkeyollu ath mammookka	Positive	mass ennu paranja otta vakkeyollu ath mammookka	Positive
chetta done deal wait trailer kollam mass	Positive	chetta done deal wait trailer kollam mass	Positive
superb promising trailer	Positive	superb promising trailer	Positive
happy birthday mammookka love you soo much	not-malayalam	happy birthday mammookka love you soo much	not-malayalam
appo hero aaranu	Positive	appo hero aaranu	unknown_state
70 vayasilum sema getha irukura mammooty ku ho	not-malayalam	70 vayasilum sema getha irukura mammooty ku ho	not-malayalam
uyante mone ith eeth lookkaa mammootty vere level	Positive	uyante mone ith eeth lookkaa mammootty vere level	Positive
lalettan rocks thanks rajuetta lucifer loading	Positive	lalettan rocks thanks rajuetta lucifer loading	Positive
pottum bengaali look idgaf mon	Negative	pottum bengaali look idgaf mon	Negative
ikka ikka ikka ikka ikka ikka ikka ikka ikka ente ponnu ikka marikilla ningale njn marikuvolam	Positive	ikka ikka ikka ikka ikka ikka ikka ikka ikka ente ponnu ikka marikilla ningale njn marikuvolam	Positive
suraj ettan vere level 1 01 soubin ikka pwolikkum 0 33	Positive	suraj ettan vere level 1 01 soubin ikka pwolikkum 0 33	Positive
mamangam vismayathinu 5 naalukal mathram katta waiting	Positive	mamangam vismayathinu 5 naalukal mathram katta waiting	Positive
cinema kand kazhinjitt veendum trailer kaanan vannavar undo ivide	unknown_state	cinema kand kazhinjitt veendum trailer kaanan vannavar undo ivide	unknown_state
edakku vannu kanukayum viewsum nokkunnathum arokke mammookka	Positive	edakku vannu kanukayum viewsum nokkunnathum arokke mammookka	Positive
usmaane vegam vaarikettiperukkeda theeyum pokem parapichond oru koottam varunundeda	Positive	usmaane vegam vaarikettiperukkeda theeyum pokem parapichond oru koottam varunundeda	unknown_state
undayum illa oru andiyum illa nammuk nammale ullu uff dialouge	Positive	undayum illa oru andiyum illa nammuk nammale ullu uff dialouge	unknown_state
ayye luciferinte aduth polum etheella luciferine pottikanonnum ponnilla lucifer trailer kandappam mone oruu romnjam aayirunnu ithenthoonu ayye	Negative	ayye luciferinte aduth polum etheella luciferine pottikanonnum ponnilla lucifer trailer kandappam mone oruu romnjam aayirunnu ithenthoonu ayye	Negative
idum kuudi 37 aamathe repeat adi	Positive	idum kuudi 37 aamathe repeat adi	Positive
entammoo enikku kanan vayyaye ente ettaa onnum parayan thonnunilla njan sthabhichu poyii	Positive	entammoo enikku kanan vayyaye ente ettaa onnum parayan thonnunilla njan sthabhichu poyii	Positive
madhura raja kku wait cheytha lucifer fans like adi	unknown_state	madhura raja kku wait cheytha lucifer fans like adi	unknown_state
urutam sounded a bit funny korachum koode punch avarunnu still super movie villain njerichu super	Positive	urutam sounded a bit funny korachum koode punch avarunnu still super movie villain njerichu super	Mixed_feelings
luciferine kaal madhurajaye ishtamullavar adiyada like	unknown_state	luciferine kaal madhurajaye ishtamullavar adiyada like	unknown_state
prayathinde peril ikkaye kaliyakunna ellaa naayinde makkalum nokkada 68 aam vayasil ninde oke thantha vcharichal pattoda ijjathi mass	Positive	prayathinde peril ikkaye kaliyakunna ellaa naayinde makkalum nokkada 68 aam vayasil ninde oke thantha vcharichal pattoda ijjathi mass	Negative
1 34 seen ille prithviraj ninte face pole thoununu	unknown_state	1 34 seen ille prithviraj ninte face pole thoununu	unknown_state
achaayaan poliyaatto kolamaass kalki	Positive	achaayaan poliyaatto kolamaass kalki	Positive
adipolii padam ellavarum must watch suraj oru rakshem illaa	Positive	adipolii padam ellavarum must watch suraj oru rakshem illaa	Positive
oh endhuvaadai idhokke aarkengilum dislike adikkan thono	Negative	oh endhuvaadai idhokke aarkengilum dislike adikkan thono	Negative
last aa chaadiyulla adi athu screenil varumbolulla kaaryam	Positive	last aa chaadiyulla adi athu screenil varumbolulla kaaryam	Positive
cinema premikalkkum tovino fansinum oru mass entertainment prathekishikkavo ichayoo karnam sadharana trailer vere padam vereah ipol	Positive	cinema premikalkkum tovino fansinum oru mass entertainment prathekishikkavo ichayoo karnam sadharana trailer vere padam vereah ipol	unknown_state
not impressed yenne kollale please manasilolladhu paranjanne ollu suraj jpg	Negative	not impressed yenne kollale please manasilolladhu paranjanne ollu suraj jpg	Negative
happy birthday mammukka from mohanlal fans	not-malayalam	happy birthday mammukka from mohanlal fans	not-malayalam
onnum parayanilla mammukkakkum ee teaminte ellavarkkum all the best	Positive	onnum parayanilla mammukkakkum ee teaminte ellavarkkum all the best	Positive
polichh malayala cinema vera level aakuvanallo eni lalettan marakar	Positive	polichh malayala cinema vera level aakuvanallo eni lalettan marakar	Positive
enghall oro movieyilum oro makeoverumm realistic aayii mass kaanikunadhumm kaanumbazhaann lalettane oke eduthh kinattill edaann thonunadhh by a lalettan fann	Positive	enghall oro movieyilum oro makeoverumm realistic aayii mass kaanikunadhumm kaanumbazhaann lalettane oke eduthh kinattill edaann thonunadhh by a lalettan fann	Negative
laleta pattunna kadhapathram cheeyy ningalk charithra cinema sheriyaakoola aa samayam 2 adipoli cinema cheyyan nok borayitund dialog	Positive	laleta pattunna kadhapathram cheeyy ningalk charithra cinema sheriyaakoola aa samayam 2 adipoli cinema cheyyan nok borayitund dialog	Negative
love you sir from vijay deavarakonda pavan kalyan fans	not-malayalam	love you sir from vijay deavarakonda pavan kalyan fans	not-malayalam
oru 18	Positive	oru 18	unknown_state
ente ponnoo oru rekshsyum illaa kidu trailer	Positive	ente ponnoo oru rekshsyum illaa kidu trailer	Positive
poli teaser maathiri alla ith pwoli item aanu aake miss cheyyunath rajuvetteme mathra ningalkko	Positive	poli teaser maathiri alla ith pwoli item aanu aake miss cheyyunath rajuvetteme mathra ningalkko	Positive
support cheyyan paadilla	Positive	support cheyyan paadilla	Negative
ennem koode kootumoo nannayi abhinayikkam	unknown_state	ennem koode kootumoo nannayi abhinayikkam	unknown_state
tamil nadu la irunthu yaarlaam mohan lal kaaga matum paaka vanthinga oru like potu ponga	not-malayalam	tamil nadu la irunthu yaarlaam mohan lal kaaga matum paaka vanthinga oru like potu ponga	not-malayalam
parayan vakulkateetham paranjalla kandariyenda mahaa mamanga velayatathinu loogamengum therasheela pongi inne ellam kaalam parayum	Positive	parayan vakulkateetham paranjalla kandariyenda mahaa mamanga velayatathinu loogamengum therasheela pongi inne ellam kaalam parayum	Positive
prithviraj is not there in madurai raja	not-malayalam	prithviraj is not there in madurai raja	not-malayalam
dislike adichu tholpikan pattila makkaleaa lalettan oru rakshem illa prethviraj pwlichu katta waiting for 28th	Positive	dislike adichu tholpikan pattila makkaleaa lalettan oru rakshem illa prethviraj pwlichu katta waiting for 28th	Mixed_feelings
ohh ikkaa enthane nigalee mass kanichu kolluvo love u and katta waiting pdfs orapichuu	Positive	ohh ikkaa enthane nigalee mass kanichu kolluvo love u and katta waiting pdfs orapichuu	Positive
sunny chechine kurachu koode neram kanikarnu	unknown_state	sunny chechine kurachu koode neram kanikarnu	Mixed_feelings
trending 1 lucifer trending 2 narendra modi ar jayikum	Positive	trending 1 lucifer trending 2 narendra modi ar jayikum	unknown_state
aju vargheese negatuve role aanen thonniyavar ondo	unknown_state	aju vargheese negatuve role aanen thonniyavar ondo	unknown_state
last 10 seconds raja solarthan seyyiuvan seyyaruth mattum than solluvaa	Positive	last 10 seconds raja solarthan seyyiuvan seyyaruth mattum than solluvaa	not-malayalam
padam kandavarkku like aam mass ka baap	Positive	padam kandavarkku like aam mass ka baap	unknown_state
pwoli keralathil kittiyillel telugil um hope ind	Positive	pwoli keralathil kittiyillel telugil um hope ind	Positive
ee mohanlal padam 150 crore clubil varatee	Positive	ee mohanlal padam 150 crore clubil varatee	Positive
ennalum ittimanide chinese link endonnavum arkkengilum ariyamo	unknown_state	ennalum ittimanide chinese link endonnavum arkkengilum ariyamo	unknown_state
orupaad ishtaayi ee padam englm hit aaya mathiyenu	Positive	orupaad ishtaayi ee padam englm hit aaya mathiyenu	Mixed_feelings
ennalum davan coolayittu unda vizhungiyathu athra sheriyayilla padathil anaganills super	Mixed_feelings	ennalum davan coolayittu unda vizhungiyathu athra sheriyayilla padathil anaganills super	Mixed_feelings
e assasincreed te trailer 2019 lu knnunavr etra perund	unknown_state	e assasincreed te trailer 2019 lu knnunavr etra perund	unknown_state
supr hit avumo enkil adiku macha like here	unknown_state	supr hit avumo enkil adiku macha like here	unknown_state
ramesh ettante first padam oru feel good movie aayirunnu ethum angane aakum enn karuthunnu	Positive	ramesh ettante first padam oru feel good movie aayirunnu ethum angane aakum enn karuthunnu	Positive
dialog delevery shariyayilla act super aayirikkum mass lalettan	Positive	dialog delevery shariyayilla act super aayirikkum mass lalettan	Mixed_feelings
dileepettan fans vaka best of luck	Positive	dileepettan fans vaka best of luck	Positive
ithe ikka polikkum ne thonane laletten fansinte vaka ore all the best	Positive	ithe ikka polikkum ne thonane laletten fansinte vaka ore all the best	Positive
romanjification enta ponnikka nigal vere leval aanu	Positive	romanjification enta ponnikka nigal vere leval aanu	Positive
padam pwlikm ikka oru rekshayum ellah age is just a number from a10 fans	Positive	padam pwlikm ikka oru rekshayum ellah age is just a number from a10 fans	Positive
njan vicharicha pole alla ketto sambhavam kidukkiyittundu	Positive	njan vicharicha pole alla ketto sambhavam kidukkiyittundu	Positive
mamangam alla avante appan vannallum eth vijayikkum	Positive	mamangam alla avante appan vannallum eth vijayikkum	Positive
mamangan istam anne poli anne pakshe njangal marakar fans anne	Positive	mamangan istam anne poli anne pakshe njangal marakar fans anne	unknown_state
nalla trailer filimum athu pole aakum ennu pradheeshikkunnu	Positive	nalla trailer filimum athu pole aakum ennu pradheeshikkunnu	Positive
otta vakkil paranjal vismayam mammookka ningal oru idhihasa taram tanne ennu veendum teliyikkunnu	Positive	otta vakkil paranjal vismayam mammookka ningal oru idhihasa taram tanne ennu veendum teliyikkunnu	Positive
lalettan poli 2 kg potherachi vangi veetil ponam	Positive	lalettan poli 2 kg potherachi vangi veetil ponam	Positive
mammunikal kuthiyirunn dislike adikunund bloody patti theetams	Negative	mammunikal kuthiyirunn dislike adikunund bloody patti theetams	Negative
onnil kooduthal kandaavar ividea like adikk nan matram ano	unknown_state	onnil kooduthal kandaavar ividea like adikk nan matram ano	unknown_state
varika varika sahajare listen old version	unknown_state	varika varika sahajare listen old version	not-malayalam
entha chettan vilichittanu njn vannathu enna tovinoyode dialogue mass alle guys	Positive	entha chettan vilichittanu njn vannathu enna tovinoyode dialogue mass alle guys	Positive
eee trailerinu dislike adikaanum oru range okke venam kashttam luv u ikka	Positive	eee trailerinu dislike adikaanum oru range okke venam kashttam luv u ikka	Negative
padam parama koothara	Negative	padam parama koothara	Negative
pwoli sharathe track mari mamagam	Positive	pwoli sharathe track mari mamagam	Positive
ee cinima kannan athin oru name mathii s sunny	Positive	ee cinima kannan athin oru name mathii s sunny	Positive
aa chekkanu jishnuvinte chchaya thonniyavar undo	unknown_state	aa chekkanu jishnuvinte chchaya thonniyavar undo	unknown_state
madhura raja pokkiri raja rajadi raja raja manikyam rakshasa rajav	Positive	madhura raja pokkiri raja rajadi raja raja manikyam rakshasa rajav	unknown_state
at last superstar rajinikanth dialogue	Positive	at last superstar rajinikanth dialogue	not-malayalam
