text	category	text	category
vineeth sreenivasan ennu kanda pinne onnum nokkanda padam vere level ayirikkum	Positive	vineeth sreenivasan ennu kanda pinne onnum nokkanda padam vere level ayirikkum	Positive
release date	unknown_state	release date	not-malayalam
pratheekshakalkum appuram kaatti thannu pratheeksha orupaad uyarthu prithivaraj enna nammude malayalikalude swakarya ahangari	Positive	pratheekshakalkum appuram kaatti thannu pratheeksha orupaad uyarthu prithivaraj enna nammude malayalikalude swakarya ahangari	Positive
7 days to go for mamangam	not-malayalam	7 days to go for mamangam	not-malayalam
ikka trailer inganeyanegil padam engana polikkum ikka	Positive	ikka trailer inganeyanegil padam engana polikkum ikka	unknown_state
enna koora padama mamooty ullond kandirikam nalle boradiikkuna padam sthiram kadha	Negative	enna koora padama mamooty ullond kandirikam nalle boradiikkuna padam sthiram kadha	Negative
avan varum samharathinte avatharamaye avan varum	unknown_state	avan varum samharathinte avatharamaye avan varum	unknown_state
mammooka fans ivide come like adii	unknown_state	mammooka fans ivide come like adii	unknown_state
ithpole oru kidu trailerinu dislike adikkana myrroli mammoonni fansin naduviral namaskaaram ella mamooty fansinem udheshichalla chila choriyanmaare udheshich paranjatha	Negative	ithpole oru kidu trailerinu dislike adikkana myrroli mammoonni fansin naduviral namaskaaram ella mamooty fansinem udheshichalla chila choriyanmaare udheshich paranjatha	Negative
trailer kandappol kanan kuduthal excitment undayi enullavr like adi	unknown_state	trailer kandappol kanan kuduthal excitment undayi enullavr like adi	unknown_state
marana mass waiting for mamankham	Positive	marana mass waiting for mamankham	Positive
uff again age is just a number mammukka	Positive	uff again age is just a number mammukka	not-malayalam
ettan da 6million views l m wood mohanlal	Positive	ettan da 6million views l m wood mohanlal	Positive
laletta negal namde muthanu ine vere arkum vitukodikila malayalikalude sothanu lalettan	Positive	laletta negal namde muthanu ine vere arkum vitukodikila malayalikalude sothanu lalettan	Positive
naanundu i am a katta laalettan fan	Positive	naanundu i am a katta laalettan fan	unknown_state
ithu oru tamil telugu style padamaayi poyaallo dialogue and bgm oru gummillaa	Positive	ithu oru tamil telugu style padamaayi poyaallo dialogue and bgm oru gummillaa	Negative
comments vayichppo oru karyam manasilayi ethu njagade lalettan ann	Positive	comments vayichppo oru karyam manasilayi ethu njagade lalettan ann	Positive
dileepine polullavare thangi nadakkunnavarude padam kanathirikkuka preshakarkku pullinte vila polum evar nalkunnilla	Negative	dileepine polullavare thangi nadakkunnavarude padam kanathirikkuka preshakarkku pullinte vila polum evar nalkunnilla	Negative
trending ayy ini viwesum likesum anu vendath	Positive	trending ayy ini viwesum likesum anu vendath	Positive
malaya cinema abhimanikkunnu ingane oru nadane kittyathil wish u a very swt hpy bthday mammooka	Positive	malaya cinema abhimanikkunnu ingane oru nadane kittyathil wish u a very swt hpy bthday mammooka	Positive
mammookkaa polichadukkii katta waiting nv 21	Positive	mammookkaa polichadukkii katta waiting nv 21	Positive
spoiler alert odiyan is not mohanlal manikyan is mohanlal villaign is odiyan	not-malayalam	spoiler alert odiyan is not mohanlal manikyan is mohanlal villaign is odiyan	not-malayalam
onnum parayanilla enna parayana lalettane enik vayya	Positive	onnum parayanilla enna parayana lalettane enik vayya	Positive
ivde like adichavar avde poy dislike adi avde like adichavar ivde vannum dislike adikku sangathy onnu kozhukkatte	unknown_state	ivde like adichavar avde poy dislike adi avde like adichavar ivde vannum dislike adikku sangathy onnu kozhukkatte	unknown_state
version 2 0 allayiruno ippo angane 5 25 ayii	unknown_state	version 2 0 allayiruno ippo angane 5 25 ayii	unknown_state
still in trending 1 mamangam ikkaa we r waiting	Positive	still in trending 1 mamangam ikkaa we r waiting	not-malayalam
heavy trailer uff 0 14 bgm and ikkante performence	Positive	heavy trailer uff 0 14 bgm and ikkante performence	Positive
like from madurai tamil nadu	not-malayalam	like from madurai tamil nadu	not-malayalam
first adam jon trialer pole ndaynu but bgm kidu	Positive	first adam jon trialer pole ndaynu but bgm kidu	Mixed_feelings
ithiri late aayalum prithviraj koodi venamayirunnu	Positive	ithiri late aayalum prithviraj koodi venamayirunnu	Mixed_feelings
gimitt fans like adi guhan fans karayu gee gee	unknown_state	gimitt fans like adi guhan fans karayu gee gee	unknown_state
nalla padam ini trailer eppozha vara kathayum manassilayi mammukayude entriyum kandu	Positive	nalla padam ini trailer eppozha vara kathayum manassilayi mammukayude entriyum kandu	unknown_state
trailer 2 il kooduthal tavan kandavar like adichea	unknown_state	trailer 2 il kooduthal tavan kandavar like adichea	unknown_state
tollywood bahubali kollywood 2 o sandalwood kgf mollywood mamangam	not-malayalam	tollywood bahubali kollywood 2 o sandalwood kgf mollywood mamangam	not-malayalam
dislike butten are stoped still running for like butten ettan effect	not-malayalam	dislike butten are stoped still running for like butten ettan effect	not-malayalam
bgm ettan dialogues fight romanijification	Positive	bgm ettan dialogues fight romanijification	Positive
model school terror school ever in tivandrum	not-malayalam	model school terror school ever in tivandrum	not-malayalam
youtube hang ayo views update akunilallo	unknown_state	youtube hang ayo views update akunilallo	unknown_state
pullu	Positive	pullu	unknown_state
thala ajith kumar viswasam intro	unknown_state	thala ajith kumar viswasam intro	unknown_state
e padam polikkum annu thonunnavar like adikku	unknown_state	e padam polikkum annu thonunnavar like adikku	unknown_state
vamban hope chaidu vannadellam potti polijatte olle	Negative	vamban hope chaidu vannadellam potti polijatte olle	Negative
aaa motta thalayanta aduth nikkunnath rajuettan alla	unknown_state	aaa motta thalayanta aduth nikkunnath rajuettan alla	unknown_state
lalettan fan but aa lastle chadeet oru pedayille polichuu	Positive	lalettan fan but aa lastle chadeet oru pedayille polichuu	Positive
trailer undakiyarithi valare mosham ann ith kanumbol enik oru feelum vannilla	Positive	trailer undakiyarithi valare mosham ann ith kanumbol enik oru feelum vannilla	Negative
onnil kuduthal tavane kandvar arokke und	unknown_state	onnil kuduthal tavane kandvar arokke und	unknown_state
ee thadiyanano nammale kunjali marakkar aayi abinayikkunnath prithviraj or mammootty cheyyanda role aanu	Positive	ee thadiyanano nammale kunjali marakkar aayi abinayikkunnath prithviraj or mammootty cheyyanda role aanu	Negative
ettante records pottikkan ettan mathrame ollu inn malayala chinimayil	Positive	ettante records pottikkan ettan mathrame ollu inn malayala chinimayil	Positive
ikka is bled	Positive	ikka is bled	not-malayalam
dislike adichitt karyamilla makkale ith alu vereya	Negative	dislike adichitt karyamilla makkale ith alu vereya	Positive
freezerinullil 5 minutolam ninnal polum maravippanu oru mc donald s crew	Positive	freezerinullil 5 minutolam ninnal polum maravippanu oru mc donald s crew	unknown_state
ethu type roleum ettante kayil safe aanu sambhavam kidukum fans show bookedettan uyir	Positive	ethu type roleum ettante kayil safe aanu sambhavam kidukum fans show bookedettan uyir	Positive
wow ikkaa mass bgm pwolii katta waitingg abraham	Positive	wow ikkaa mass bgm pwolii katta waitingg abraham	Positive
swargatthil ninnu purathaakkappetta daivatthinte swantham maalakha polichuu lucifer waitingg	Positive	swargatthil ninnu purathaakkappetta daivatthinte swantham maalakha polichuu lucifer waitingg	Positive
nte ponnu rakshyillaa	Positive	nte ponnu rakshyillaa	Positive
like ethrayayee enu nokan vanavark special like adikanula stalam	unknown_state	like ethrayayee enu nokan vanavark special like adikanula stalam	unknown_state
ayye preteekshicha atonuletta trailer valya tarakedila	Positive	ayye preteekshicha atonuletta trailer valya tarakedila	Mixed_feelings
aye kuura trailer oola padam chali mohanlal	Positive	aye kuura trailer oola padam chali mohanlal	Negative
mammookkaa polichuu hvy trailer katta waiting	Positive	mammookkaa polichuu hvy trailer katta waiting	Positive
malayalam cinema innevare vannathil vachu ettavum mighacha trailer	Positive	malayalam cinema innevare vannathil vachu ettavum mighacha trailer	Positive
superb trailer from lalettan fan ikka polichu	Positive	superb trailer from lalettan fan ikka polichu	Positive
raja de randam varavini kodi kayaran ini kurach manikoorukal mathram idikatta waiting	Positive	raja de randam varavini kodi kayaran ini kurach manikoorukal mathram idikatta waiting	Positive
all india level movie	Positive	all india level movie	not-malayalam
enne pole ee trailer slow modil ittu kanda vere aarelum undo	Positive	enne pole ee trailer slow modil ittu kanda vere aarelum undo	unknown_state
ethu santhathikal vannalum pulimurugante thattu thanu thanne irikkum	Positive	ethu santhathikal vannalum pulimurugante thattu thanu thanne irikkum	Mixed_feelings
enntta surajetta super oru rakshaum ella	Positive	enntta surajetta super oru rakshaum ella	Positive
oru mass heeroye kitti mone kitti	Positive	oru mass heeroye kitti mone kitti	Positive
puli murugante set eppozhum lalettan chunke dee	unknown_state	puli murugante set eppozhum lalettan chunke dee	unknown_state
neerali lifetime views 800k v 29k likes 1 9 k cmnts	unknown_state	neerali lifetime views 800k v 29k likes 1 9 k cmnts	unknown_state
trailer pole naalla story undayal mathiyarinu	Positive	trailer pole naalla story undayal mathiyarinu	Positive
rajaa pokkiri raja adar meesha raja makkalukku raja sen tamilum pesuvaru angalayum pesuvaru malayala thaymozhi than bellari raja	unknown_state	rajaa pokkiri raja adar meesha raja makkalukku raja sen tamilum pesuvaru angalayum pesuvaru malayala thaymozhi than bellari raja	unknown_state
adutha 100 cr ennurapullavar adik mone like	unknown_state	adutha 100 cr ennurapullavar adik mone like	unknown_state
ethonnum mohanlalnu cherilla	Negative	ethonnum mohanlalnu cherilla	Negative
ennum vannu 5 pravsyam kanuvar ivde vaa	Positive	ennum vannu 5 pravsyam kanuvar ivde vaa	unknown_state
megastorm is coming mamangam megastar november 21onwards waiting	not-malayalam	megastorm is coming mamangam megastar november 21onwards waiting	not-malayalam
mammukka ishttam padam pwlikkane bzlee nammude mammukka pwlichu daa	Positive	mammukka ishttam padam pwlikkane bzlee nammude mammukka pwlichu daa	Positive
dislike adicha lalettan hatersnulla adi avate ningalude likes trailer vere level murali gopi mass like prithviraj too	Positive	dislike adicha lalettan hatersnulla adi avate ningalude likes trailer vere level murali gopi mass like prithviraj too	Negative
ente ponno lalettan oru rekshaum illa waiting	Positive	ente ponno lalettan oru rekshaum illa waiting	Positive
star cast ile n f varghese sir inne undayirunangile lalettanta kudey poliche adukiyene lucifer movieyile	Positive	star cast ile n f varghese sir inne undayirunangile lalettanta kudey poliche adukiyene lucifer movieyile	Positive
i love lalettan and prithviraj prithviraj always admired him ithu polikkum alla pinna	Positive	i love lalettan and prithviraj prithviraj always admired him ithu polikkum alla pinna	Positive
views ethraayi enn nokkan veendum veendum kaanunnavar like adikkeda	unknown_state	views ethraayi enn nokkan veendum veendum kaanunnavar like adikkeda	unknown_state
3ble bullseye kodukk 10k piller und	unknown_state	3ble bullseye kodukk 10k piller und	unknown_state
lallettaa pwlichu maranna mass triller you are the only king in mollywood triller ishttapettavar like aaddikkaddaa	not-malayalam	lallettaa pwlichu maranna mass triller you are the only king in mollywood triller ishttapettavar like aaddikkaddaa	Positive
lalettan oru vigaram mathram alla nammude ahangaram aanu	Positive	lalettan oru vigaram mathram alla nammude ahangaram aanu	Positive
ithinekkal valiya romanjifickation trilor aayirunnu villan ennitto padam 8l pottii idum anginethanneyaavum laletta ingalu maarikkoluu pilleru kalikkette	Positive	ithinekkal valiya romanjifickation trilor aayirunnu villan ennitto padam 8l pottii idum anginethanneyaavum laletta ingalu maarikkoluu pilleru kalikkette	Negative
ettante filim pole ikkayude filimum super hit akanam enne agrahikkunnavar like adi	unknown_state	ettante filim pole ikkayude filimum super hit akanam enne agrahikkunnavar like adi	unknown_state
24 k naarikkal ee cinema dislike ittu avanmaarku thallu kodukkuvan agraham ullavar like addi	unknown_state	24 k naarikkal ee cinema dislike ittu avanmaarku thallu kodukkuvan agraham ullavar like addi	Negative
sathyathil abhinandanagal ariyikkendathu prithvirajinanu thakarthu kalanjallo muthu	Positive	sathyathil abhinandanagal ariyikkendathu prithvirajinanu thakarthu kalanjallo muthu	Positive
itthu pokkiri rajaude athava pulimurguan ennte 2 aam baagamo	Mixed_feelings	itthu pokkiri rajaude athava pulimurguan ennte 2 aam baagamo	Mixed_feelings
supperb ikka pwolichuu ikkaa swoth baaki ellaam myr	Positive	supperb ikka pwolichuu ikkaa swoth baaki ellaam myr	Positive
like ipozhe idaruthu trailer vanna shesham idam ee perunnalu mani sir kondpokim	unknown_state	like ipozhe idaruthu trailer vanna shesham idam ee perunnalu mani sir kondpokim	unknown_state
eee paheyente sthaneth mohanlal ann 70am vayesill eee padem cheythirinnenkill edukam pallikatilekh lal ettane allenkil dehippikam	Negative	eee paheyente sthaneth mohanlal ann 70am vayesill eee padem cheythirinnenkill edukam pallikatilekh lal ettane allenkil dehippikam	Negative
ullath parayalloo sidhiq ozhich bhaakki ellaam chali actorors enthaavumoo enthoo comment nookii fayankaram ennu parayaan ee trailoril onnum illaa	Negative	ullath parayalloo sidhiq ozhich bhaakki ellaam chali actorors enthaavumoo enthoo comment nookii fayankaram ennu parayaan ee trailoril onnum illaa	Negative
i am from uganda die hard fan of mammukka	not-malayalam	i am from uganda die hard fan of mammukka	not-malayalam
traileril prithwiraj ne kandavar aarokke	unknown_state	traileril prithwiraj ne kandavar aarokke	unknown_state
surajettanum subin ikkayum polichu sesham screenil	Positive	surajettanum subin ikkayum polichu sesham screenil	Positive
100k likes and 700k views within 1hr	not-malayalam	100k likes and 700k views within 1hr	not-malayalam
nostalgia valiyoru marketing product aanu	Positive	nostalgia valiyoru marketing product aanu	unknown_state
telugu trailor kandit ithu kandavar aarelumundo	unknown_state	telugu trailor kandit ithu kandavar aarelumundo	unknown_state
ariyaalo she is vare lavl katta waiting ikka	Positive	ariyaalo she is vare lavl katta waiting ikka	unknown_state
idikkatta waiting othiri thanks prithvirajinu njangalde ettane	Positive	idikkatta waiting othiri thanks prithvirajinu njangalde ettane	Positive
dislike adicha pannikale theater il kanada	Negative	dislike adicha pannikale theater il kanada	Negative
100 cr movie god f u c m	Positive	100 cr movie god f u c m	not-malayalam
enik pulimurgante scnd part ayita thoniye	unknown_state	enik pulimurgante scnd part ayita thoniye	Mixed_feelings
goosebumps guaranteed ikka fans like here	unknown_state	goosebumps guaranteed ikka fans like here	not-malayalam
sub like sub like	unknown_state	sub like sub like	not-malayalam
muriyandikal pannikuutatam pole thurimezhukuvansllooscenes are rememmbering pulimurugan	Negative	muriyandikal pannikuutatam pole thurimezhukuvansllooscenes are rememmbering pulimurugan	Negative
ho my god sooper dislike adicha pottimaanikal chankupottychaakum	Negative	ho my god sooper dislike adicha pottimaanikal chankupottychaakum	Positive
6 7k dislikes adichaa oolanmarellam angott maarininnu mongikko	Negative	6 7k dislikes adichaa oolanmarellam angott maarininnu mongikko	Negative
mammokayude unda varunnu an kaliyakiyavar kedo unda verum undayala thokkil vediunda yamanasilaya mammookaye kaliyakunnavare	Negative	mammokayude unda varunnu an kaliyakiyavar kedo unda verum undayala thokkil vediunda yamanasilaya mammookaye kaliyakunnavare	Negative
ee saturday padam kodi 10 days 100 crore	Positive	ee saturday padam kodi 10 days 100 crore	unknown_state
poli oru rakshayum illa pakka hvy ithu blockbuster adikum ikka marana mass aane	Positive	poli oru rakshayum illa pakka hvy ithu blockbuster adikum ikka marana mass aane	Positive
adipoli morning 180k likes ondarnath ipol 120k ollalo entha ikkafanse ithu	unknown_state	adipoli morning 180k likes ondarnath ipol 120k ollalo entha ikkafanse ithu	unknown_state
ammo porichu ithu kidilan	Positive	ammo porichu ithu kidilan	Positive
a10 nte oru marana mass guest role aarokke kandu	Positive	a10 nte oru marana mass guest role aarokke kandu	unknown_state
lallikka polich ee kanditum kandittum kodhitheerunnilla ante vismayamee	Positive	lallikka polich ee kanditum kandittum kodhitheerunnilla ante vismayamee	Positive
tovino kku rahul gandhi ayitt similarity thonniyo	unknown_state	tovino kku rahul gandhi ayitt similarity thonniyo	unknown_state
ouru l cifer erangi athe polle thanne enni kore padomm erakuum myrree	Negative	ouru l cifer erangi athe polle thanne enni kore padomm erakuum myrree	Negative
cattepoya ninde chettan cheguttan lasaralla lusifarmatan vannalum raja cup konde poku	Positive	cattepoya ninde chettan cheguttan lasaralla lusifarmatan vannalum raja cup konde poku	unknown_state
ayyoo mohanlal sangiallee poyi chawada kalla cummi a	Negative	ayyoo mohanlal sangiallee poyi chawada kalla cummi a	Negative
unniyettan first jayettan fans like podu	unknown_state	unniyettan first jayettan fans like podu	unknown_state
virus trailer kande evide vannavare undo	unknown_state	virus trailer kande evide vannavare undo	unknown_state
arekilum sradicho trailer erangia divasam 184 likes undairunnu pakshe eppo engane kuranju	unknown_state	arekilum sradicho trailer erangia divasam 184 likes undairunnu pakshe eppo engane kuranju	unknown_state
18 11 2019 is anybody here	not-malayalam	18 11 2019 is anybody here	not-malayalam
wow from tamil nadu sarey kola massu	not-malayalam	wow from tamil nadu sarey kola massu	not-malayalam
hamme poli lastathe aa scene kidu frames	Positive	hamme poli lastathe aa scene kidu frames	Positive
ettan fans ethra per ee padam kanan pokum ettan ishttam	Positive	ettan fans ethra per ee padam kanan pokum ettan ishttam	Positive
naanavum maanavum undoda oolakale trailer verunathinte munb thane degrade cheyaan	Negative	naanavum maanavum undoda oolakale trailer verunathinte munb thane degrade cheyaan	Negative
apo athum potti aa pratheekshayum poyi	Positive	apo athum potti aa pratheekshayum poyi	Negative
uff ijjadi item romanjam ikka fans like adich polikk	Positive	uff ijjadi item romanjam ikka fans like adich polikk	Positive
average padam 2nd half thalli neekkan petta paadu	Positive	average padam 2nd half thalli neekkan petta paadu	unknown_state
seems to be an interesting movie ikka	Positive	seems to be an interesting movie ikka	not-malayalam
mamookade kore naalathe flopkalk shesham oru predeeksha ulla chithram ith pwolikkum haneesadeni	Positive	mamookade kore naalathe flopkalk shesham oru predeeksha ulla chithram ith pwolikkum haneesadeni	Positive
once a king always a king	not-malayalam	once a king always a king	not-malayalam
beginning of the oil era in dubai history	not-malayalam	beginning of the oil era in dubai history	not-malayalam
ethu njan etho english cinemayil kanditundu peru ormayilla	unknown_state	ethu njan etho english cinemayil kanditundu peru ormayilla	unknown_state
ertti madhuram on ikku s bday god bless ma ikkuhappywala bday ikku	Positive	ertti madhuram on ikku s bday god bless ma ikkuhappywala bday ikku	Positive
dislike koranjallo athum njgal mammooka fansinte auto disliker aanennu para	unknown_state	dislike koranjallo athum njgal mammooka fansinte auto disliker aanennu para	unknown_state
njan oru lalattan fan anagilum raja maass akum urappuu	Positive	njan oru lalattan fan anagilum raja maass akum urappuu	Positive
christianikal kidayil oru peru l u c i f e r	Positive	christianikal kidayil oru peru l u c i f e r	unknown_state
katha manasilay tv il varambam kanam	unknown_state	katha manasilay tv il varambam kanam	Negative
what did happen to cheramana perumal tajuddin	not-malayalam	what did happen to cheramana perumal tajuddin	not-malayalam
ithaanu a10 hatersinte vaayil adichu kayatiya adaar item lusifer	Positive	ithaanu a10 hatersinte vaayil adichu kayatiya adaar item lusifer	Positive
chechi kaanaan vendi maatram keriyavar lyk adichit pokaan marakkalle chechi ishtam	Positive	chechi kaanaan vendi maatram keriyavar lyk adichit pokaan marakkalle chechi ishtam	Positive
romanjam ikka predhikshichadh pazham kanjiya but kittiyadh biriyani powli	Positive	romanjam ikka predhikshichadh pazham kanjiya but kittiyadh biriyani powli	Positive
e padam pottan chance undu tiyaan movie orma varunnu murali gopi alle script kandariyam	Mixed_feelings	e padam pottan chance undu tiyaan movie orma varunnu murali gopi alle script kandariyam	Mixed_feelings
anna ben performance vera level	Positive	anna ben performance vera level	Positive
katta waiting perunnal pole aai ee divsam ikka minnichekkene	Positive	katta waiting perunnal pole aai ee divsam ikka minnichekkene	Positive
enn a polle ethraper prarthikunnu ettante jodi manju avalle enn	unknown_state	enn a polle ethraper prarthikunnu ettante jodi manju avalle enn	Mixed_feelings
sound modulation indian cinimayil mammookka athu kayinje vere aarum varathullu	Positive	sound modulation indian cinimayil mammookka athu kayinje vere aarum varathullu	Positive
uff ejaadhii lalettann rdjile edjelum oruu svene e jenmam vheyaan patilaa trailer kandd karayunundaabumm ettan and ettan fanss	Positive	uff ejaadhii lalettann rdjile edjelum oruu svene e jenmam vheyaan patilaa trailer kandd karayunundaabumm ettan and ettan fanss	Negative
ee onam njan ingu edukkuva lalettan	Positive	ee onam njan ingu edukkuva lalettan	Positive
kavya film company perinu oru gummilla	Positive	kavya film company perinu oru gummilla	Negative
6 8m kazhinjal record views aanttaa	unknown_state	6 8m kazhinjal record views aanttaa	unknown_state
padam kand kilipoyitt ivede vannavar undo what a movie	unknown_state	padam kand kilipoyitt ivede vannavar undo what a movie	Positive
ithu dislike adicha pookavadi makkalodu onne parayan ullu	Negative	ithu dislike adicha pookavadi makkalodu onne parayan ullu	Negative
like 104k views 17k	unknown_state	like 104k views 17k	not-malayalam
adipoli set move ayirikum a10 thagarkum	Positive	adipoli set move ayirikum a10 thagarkum	Positive
njan oru ikka fan alla pakshe ente romam vare ezhunnett ninnu apaaram	Positive	njan oru ikka fan alla pakshe ente romam vare ezhunnett ninnu apaaram	Positive
dislike adich kali makkale athre ninneyekkekond pattu	Negative	dislike adich kali makkale athre ninneyekkekond pattu	Negative
mammookka look and diolouge uff oru rakshayum illa	Positive	mammookka look and diolouge uff oru rakshayum illa	Positive
ente ponnu endb item aan he he ikka romanjj	Positive	ente ponnu endb item aan he he ikka romanjj	Positive
akshay p r bhavi nadan nammada chunck 0 21	unknown_state	akshay p r bhavi nadan nammada chunck 0 21	unknown_state
1 39 bhaaki ullarakh ath punch njangal wwe fansin ath superman punch	Positive	1 39 bhaaki ullarakh ath punch njangal wwe fansin ath superman punch	Positive
theatre baaki undayal mathiyarunu ente laletaa ingal vere level aanu man	Positive	theatre baaki undayal mathiyarunu ente laletaa ingal vere level aanu man	Positive
mammokkade pillerk vendiyulla like button	unknown_state	mammokkade pillerk vendiyulla like button	unknown_state
ikkaye kanan vendi mathram trailer kandu	Positive	ikkaye kanan vendi mathram trailer kandu	unknown_state
ente mammooka ninghale mass alla marana massum alla pakshe ninghal kolamass aanu ikka	Positive	ente mammooka ninghale mass alla marana massum alla pakshe ninghal kolamass aanu ikka	Positive
ennikill oru 10 like ikkaye istamulvar please	unknown_state	ennikill oru 10 like ikkaye istamulvar please	unknown_state
vyshakinte pagill ettal egane ya views thonne kittuka valiya chanalil alle edendathu luciferne pole	Negative	vyshakinte pagill ettal egane ya views thonne kittuka valiya chanalil alle edendathu luciferne pole	Negative
lucifer is mammookka fan	Positive	lucifer is mammookka fan	not-malayalam
govt school pillar ku like adikkan ulla place	unknown_state	govt school pillar ku like adikkan ulla place	unknown_state
padam verum oru below average lucifer like oombiya padam aakum enn orappullavr c man	Positive	padam verum oru below average lucifer like oombiya padam aakum enn orappullavr c man	Negative
dileepettaa last dialogue karayippichallo 5 second lalettan kazhinja dileepettan aanh full senti	Positive	dileepettaa last dialogue karayippichallo 5 second lalettan kazhinja dileepettan aanh full senti	Positive
katta waiting like cheyy	Positive	katta waiting like cheyy	Positive
njan matramanoo trailer il prithviraj ne kandanthu kandavar like adiche	unknown_state	njan matramanoo trailer il prithviraj ne kandanthu kandavar like adiche	unknown_state
camera work kolam bgm set onum athra pora	Positive	camera work kolam bgm set onum athra pora	Mixed_feelings
ithrem dislike adichavar malayalikal aagan vazhiyilla	Negative	ithrem dislike adichavar malayalikal aagan vazhiyilla	Negative
ith nice aakum sure aanu	Positive	ith nice aakum sure aanu	Positive
ethu polikkum makalle our king is back	Positive	ethu polikkum makalle our king is back	Positive
evde asif ali evde kandavar indo	unknown_state	evde asif ali evde kandavar indo	unknown_state
5 minit koodumbo views koodunnundonn nokunnath nan maathramano	unknown_state	5 minit koodumbo views koodunnundonn nokunnath nan maathramano	unknown_state
padam moonjiyathinu shesham ethra peru vannu	Positive	padam moonjiyathinu shesham ethra peru vannu	unknown_state
